start,end,category,count,title,content
2020-04-27,2020-05-27,경제민주화,167,"동탄 상가분양 사기를 당하였고, 피의자는 잠적하였습니다.","안녕하세요.
저는 동탄2 테**** 센xxxxx 상가분양을 받은 사람입니다.

저는 아내와 14살, 11살 아들2명을 책임지고 있는 4식구의 가장으로서 
노후대비를 위하여 월세수익이 나올곳을 알아보던중
2018.04.에 동탄2 테****에 위치한 센xxxxx 분양사무실을 방문하였고
여기에서 김xx 이라는 분양팀장을 만나서 상담을 받았습니다.

저는 최초 선임대가 맞추어진 상가 정보를 요청하였으나,
분양팀장 김xx은 선임대 상가보다 더 좋은 물건이 있다고 하면서
일방적으로 특정 물건 분양계약을 강요하였습니다.

그러나, 상가 공실 리스크가 걱정되어 계약을 거부 하였고,
그러자, 김xx은 시행사와의 분양계약과는 별도로
이 상가에 대해서는 자신이 임대차 계약을 보장하고,
만일 임대차 계약이 체결되지 않으면 해당 상가를 전매시켜준다고 약속하였습니다.
또한, 전매를 하지 못하면 어차피 돈이 되는 상가이니
자신이 직접 전매를 해간다고 추가로 약속하였습니다.

이러한 김xx의 약속으로 공실 리스크가 사라졌다고 판단하여,
저는 김xx이 지정한 상가에 대해서 분양계약을 체결하였습니다.

그 이후, 저는 사정이 생겨 분양상가 계약시 약속한대로
김xx에게 상가 분양전매를 요청하였고,
김xx은 자신이 책임지고 약속을 지키겠다고 하였습니다.

그러나, 김xx은 그 이후 전매가 잘 이루어지는것처럼 온갖 거짓말을 하면서 시간을 끌었고
어느 순간부터는 제 연락을 아예 받지 않고 완전히 잠적하였습니다.

그러던중, 상가 준공이 완료되었고
시행사에서는 기한내 잔금 및 등기를 이전하지 않으면 10%가 넘는 연체이자를 물어야 한다면서 저를 압박하였습니다.
그리고, 약속을 하였던 김xx은 여전히 연락이 되지 않았습니다.

고율의 연체이자를 피하기 위하여 어쩔수 없이 저는 주택담보대출, 신용대출 및 상가담보대출을 모두 끌어모아 겨우 상가 등기를 마쳤으며, 
공실을 해결하기 위하여 주변 수십군데 분양가보다 수천만원 낮은 가격의 매매 및 
대출이자에도 못미치는 금액으로 임대차를 내놓았으나 부동산으로부터 단 한 번도 연락을 받지 못하였습니다.

그렇게 저는, 준공된지 6개월이 지난 지금까지 수백만원의 이자 및 관리비를 매달 계속 내고있습니다.

저는 김xx이 저에게 한 약속내용이 담긴 녹취록을 준비하여,
김xx을 사기죄로 경찰서에 고소하였습니다.
그러나, 경찰에서는 혐의는 인정되지만 증거가 불충분해서 기소가 어렵다고 하였습니다.
그러면서, 상가분양에서는 사기죄가 인정되기 어렵다며 억울하지만 방법이 없다고 하였습니다.

투자는 본인의 판단하에 이루어지고 그에 대해서는 본인이 책임을 져야 합니다.
그러나, 그러한 판단을 함에 있어서 누군가가 본인의 이익을 위해서
악의적으로 거짓말을 했다면 이는 처벌받는게 마땅하다고 생각합니다.

준공등기후 상가분양을 받은 다른 분들을 만날수 있었으며,
이 분들 또한 대부분 저와 같이 거짓약속과 거짓정보를 받아들여 피해를 보신분들이었습니다.

정말 억울하고 답답해서 미칠것 같습니다.
거짓약속으로 자신의 이익만을 취하고,
1년넘게 도망만 다니는 김xx때문에 불면증, 소화불량등 건강이 악화되고
현실적 경제적 부담으로 인하여, 정말 하루하루가 고통인 나날을 보내고 있습니다.

이렇게 억울한 일을 당해도 잠적한 상가 분양팀장 김xx을
처벌하지도 못한다면 앞으로도 노후를 준비하는 다른 선량한 사람들에게 얼마나 이런 일이 많이 벌어질까 무섭습니다.

제발, 우리나라에 정의가 살아있다는 것을 보여주기 위해서라도
억울한 이 상황을 초래한 분양팀장 김xx을 처벌해주시기 바랍니다.
만일, 이러한 사람을 벌주지 않으면 앞으로도 저와 같은 피해자들은 계속해서 발생할 것입니다.

 [본 게시물의 일부 내용이 국민 청원 요건에 위배되어 관리자에 의해 수정되었습니다]"
2020-04-27,2020-05-27,정치개혁,"15,841",정**교수님 보석허가 해주세요,"이명박 보석허가  전** 보석허가 해주고형평성이안맛는다고바요
아프신전**교수님은 왜보석허가안해주는지모르겠습니다
저는전**교수님생각나면마음이아파요 
전**교수님 보석해주시면 감사합니다 
사법부 도 문제가있다고 봐요 
사법부도 개혁이필요하다고 강력하게 호소합니다

 [본 게시물의 일부 내용이 국민 청원 요건에 위배되어 관리자에 의해 수정되었습니다]"
2020-04-27,2020-05-27,외교/통일/국방,"1,933",인류애를 저버린 국가에 대한 인도적 지원에 반대합니다.,"전염병으로 인해 전 지구적으로 전례없는 어려움을 겪고 있는 이 때에, 대한민국이 훌륭한 대응으로 세계의 모범이 되고 이들에게 방법과 물자를 제공할 수 있다는 점은 우리 모두의 자랑입니다.

일선의 의료진과 방역인력, 관리책임자 등 수많은 분들과 나아가 우리 국민의 대다수의 노력이 더욱 빛날 수 있도록 그간의 성과를 인류에게 이로운 방향으로 활용하는 것은 매우 바람직합니다.

허나 인류애를 저버리는 행동을 일삼았던 일본에 대한 인도적 지원은 부적절합니다.

이들은 과거 군국주의의 야욕에 동아시아 전체의 평화를 파괴하고, 수많은 생명과 신체, 그리고 셀 수 없는 유형무형의 인류의 자산들을 파괴하고 침해하였습니다.

유사한 과거를 지닌 다른 국가들과 달리 일본은 과거에 대한 인정과 반성은 커녕, 역사를 왜곡하고 자신들의 만행을 미화하며, 주변국과의 영토분쟁을 유발하는 등 여전히 오만하고 제멋대로인 행보를 보이고 있습니다.

더욱이 이러한 일본의 추태에도 불구하고 지난 대지진 당시 우리 국민이 보여준 인류애와 도움의 손길(성금, 구조대 파견)에도 불구하고, 세계의 지원 내역을 소개하면서 고의로 누락하는 등 배은망덕한 모습을 보이기도 했습니다.

각국의 선수단, 취재진 등 세계 곳곳으로부터의 유입과 대회 이후 전파를 무릅쓰고도, 자국의 이익을 위해 올림픽을 강행하고자 코로나 위기를 침소봉대하고, 안일한 대처로 일관한 결과를 왜 우리의 자원과 세계의 기회를 희생하며 무조건 도와야 하겠습니까.

심지어 우리의 적극적인 대응노력을 희화하고 조롱하기까지 한 일본입니다. 그간의 반인류적인 행위에 대한 공개적인 사과와 공식 요청이 없는 가운데 이들에 대한 지원은, 지원이 아니라 스스로 고개를 조아리는 꼴이며, 이는 21세기 동북아의 새로운 질서에도 부합하지 않는 것입니다. 

일본에 대한 인도적 지원 유보는 한일관계와 동아시아 역사에 대한 세계의 관심을 불러일으켜, 일제강점기와 한국전쟁 등 우리의 피와 눈물 속에서 축적한 자원을 바탕으로 한 아시아의 1등 선진국이라는 탈 속에 숨어 있는 일본의 진면목을 세계에 드러낼 기회가 될 것입니다.

그간 정부에서 잘 처리한 바와 같이, 한국전쟁에 참전하여 우리의 영토와 국민들을 지키는 데 힘을 보태주었던 고마운 국가들,  우리 국민들에 대한 입국제한을 최대한 늦추거나, 교민들의 입국을 지원해주거나, 통화스왑을 체결하는 등 이 위기를 함께 이겨나가기 위한 노력과 자세를 보여준 국가들에 대한 분명하고 확실한 지원을 통해 인류애를 재확인하고, 세계에서의 대한민국을 더욱 빛나게 하는 것이 우리가 선택해야 할 길이라고 이 청원을 통해 제안드립니다."
2020-04-27,2020-05-27,인권/성평등,"1,330",n번방 가해자 처벌과 일간베스트와 디시인사이드 폐쇄를 해주세요.,"n번방 사건으로 인해 피해자들의 정신건강상태가 위태로운 수준에 이르게 되었습니다. 가해자들에 대한 강력 처벌을 제대로 내려주지 않고 대충 판결하여 넘겨내는 행위를 하게 되면 범죄자들이 한국 법에 대해 우습게 보면서 여러 범죄사건이 일어나게 될겁니다. 부디 이번 사건의 가해자들을 강력 처벌하여 모든 범죄자들이 두려움을 떨도록 만들어주십시오.

그다음은 일간베스트와 디시인사이드에 대한 폐쇄를 해주십시오. n번방과 연관 있는데다 누구나 가입하거나 가입없이 글을 올릴 수 있다는 점과 범죄악용되기 쉬운곳, 도를 넘는 피해자에 대한 비하, 각종 혐오감을 불러일으키는 혐오드립같은 혐오콘텐츠를 생산하여 전 인터넷에 퍼뜨리는 행위등을 하고 있는데다 일베는 디시에서 나왔던 독립 사이트다보니, 두 사이트를 번갈아 쓰는 유저들이 극도로 많습니다. 그런 점 때문에 우리 사회에 나타난 혐오등 비롯한 표현와 콘텐츠중에 일베와 디시 관련된게 엄청 많습니다.  그렇기에 일간베스트와 디시인사이드에 대한 폐쇄를 해야합니다. 
사이트 폐쇄를 하는건 자유에 대핸 침해를 부를 수 있다고 하지만 독일과 폴란드, 미국에도 그런 사이트에 대한 폐쇄 및 강제 서비스 종료를 시킨 사례가 있는데다 우리나라도 소라넷과 메갈리아 폐쇄한 사례가 있습니다. 자유에 대한 이해를 하지 않고 표현의 자유를 둔갑해서 온갖 악플과 피해자들과 사회적 약자들에 대한 조롱과 여러 혐오 콘텐츠를 생산하는 행위는 결코 용납할수 없다는 판단하에 폐쇄 조치를 내렸으니 표현의 자유와 영 관계가 없다고 생각합니다.
따로따로 해서 자기네끼리 얘기하도록 내버려두는게 오히려 안전하다는 의견은 이제 옛날말입니다. 오히려 도를 넘는 행위를 가진 자들이 넘쳐 온갖 피해을 끼치고 사회를 혼란스럽게 만들어내고 있습니다. 마치 범죄집단을 내버리니까 규모가 더욱 커져 피해를 일으키는 것처럼 말입니다. 아무리 그렇다고 폐쇄를 하면 다시 흩어지다가 다른 곳으로 옮겨 다시 일으킨다는 말이 있는데 역시 내버려둔 상태에서도 악성종양처럼 다른 곳으로 옮겨 피폐하게 심각한 상황을 만들어 내고 있습니다. 그러므로 폐쇄하기전에 다른 곳으로 옮기지 못하게 조치를 취해 다시는 이런 일들이 일어나지 않게 만들어내야 합니다."
2020-04-27,2020-05-27,일자리,387,"한국노총 개인사업자, 법인사업자로 구성 된 건설기계분과 자체가 불법인데 왜   문재인 정부와 고용노동부에서는 해결책을 찾지 않으십니까?","전북 전주에서 건설기계 장비를 운영하는 개인사업자 입니다.

건설현장에서 스스로 영업을 해서 생계를 꾸려나가고 있는 상황입니다만
언젠가부터 군산,익산에서 활동하던 한국노총 건설기계분과 지부장 김00 이라는 사람이 
한국노총 전주지부를 내고 건설현장 시공사(원청), 그리고 골조업체를 압박해서 
한국노총에 가입된 사업자들에게 일감 몰아주기를 하고 있습니다.
그로인해 기존에 영업해서 일하던 현장마저 빼앗겨서 생계가 막연한 상황이 됐습니다.
글을 올리는 본인 뿐만 아니라 한국노총 기계분과에 가입하지 않은 많은 건설장비 사업자들이
한국노총의 횡포에 휘둘려 생계 존립의 심각한 상황에 처해 있습니다.

한국노총 기계분과에 가입 하고 싶은 마음도 없지만 가입 조건도 가관입니다.
가입비 200만원 월 회비 5만원, 월별 계산서 발행한 매출액의 5% 상납, 1년에 장비 한대당 50만원 상납 등등....
이건 자기네들 관할구역 보호비 명목으로 금전 뜯어가는 양아치, 건달하고 다를게 없습니다.

문제는 한국노총 건설기계분과 노조에 가입된 조합원들이 전부 사업자들로 구성되어 있다는 것 입니다.
심지어 건설기계분과인데 철물점 사장, 안전용품 사장, 함바식당 사장 등 
건설기계와 관계 없는 사업자들까지 가입 되어 있다는 것 입니다. 

2018년 인터넷 기사에 사업자들로 구성된 걸설기계분과는 불법이라고 고용 노동부에서 인정한 내용이 있습니다.
고용노동부에서 인정한 내용인데 그런 내용을 알면서도 실제 노조를 해체시키거나 법적인 절차를 진행하고 있지 않는 실정입니다.
그로인해 전국 모든 건설현장 앞에서는 

1. 확성기를 틀고 집회 > 민원 발생 > 시공사 압박> 시공사는 골조업체에 압력
2. 현장 안에서 노조원들이 돌변하여 안전, 환경, 외국인 근로자 사진촬영> 시청, 구청에 고발> 합의해주는 조건으로
     자기네 노조원(개인사업자) 쓰라고 압박> 기존에 일하던 건설기계 사업자는 퇴출

위 사례가 거의 모든 건설현장에서 이루어지고 있습니다.

문재인 정부에서는 적폐청산을 외치는데 정작 진정한 적폐세력인 사업자들로 구성된 불법 건설기계노조는 수수방관 하는 것 입니까?
왜 문재인 정부와 고용노동부는 대한민국의 국민을 병들게 하는 불법노조가 있다는 것을 알면서도 방관하는 것 입니까?  
사업자들은 합법적인 내에서 자유롭게 영업하며 자유롭게 일을 할 권리가 있습니다.

생계가 무너지니까 너무 힘들어서 극단적인 생각까지 듭니다.

부디 문재인 정부와 고용노동부가 움직여서 이런 불법적인 행태를 바로 잡아 주시길 바랍니다.
답변 기다리고 있겠습니다.
또한 해결책도 기다리고 있겠습니다."
2020-04-27,2020-05-27,외교/통일/국방,402,"국방TV 인기 프로그램 ""토크멘터리 전쟁사"" 폐지 철회해 주세요","국방TV 최정상 인기 프로그램 ""토크멘터리 전쟁사""가 갑자기 폐지되었다고 합니다. 세계사의 전쟁을 분석하여 일반 대중에게 알기쉽고 재미있게 전쟁과 그 전쟁을 둘러싼 국제관계를 설명해주면서 오랜기간 사랑받고있는 프로그램입니다. 하다못해 이 프로를 소개하는 유튜브 영상 조회수도 영상마다 수십만에서 백만이상을 기록하고 있는 국방TV 최정상 인기 프로그램입니다. 
그런 프로그램을 사전 공지도 없이 갑자기 폐지했다는 뉴스를 접하고 바로잡아야 한다고 생각했습니다. 
폐지 사유로 ""다소 지루하다는 일부 시청자의 의견이 있었다"" 를 들었다는데 최근의 제작물까지 지루했던적 없었고 대부분의 애청자들은 이 프로그램을 진정 사랑하고 매주 기다리고 있었습니다.
절대 폐지해선 안되는 ""토크멘터리 전쟁사""를 다시 제작하도록 조치해주세요"
2020-04-27,2020-05-27,경제민주화,818,**자산운용 원유선물 불법주가 조작을 고발합니다.,"2020년 4월 23일 오전, **자산운용은 상품설명서와 다르게 임의적으로 ***** WTI 원유선물(H)의 구성종목을 불법으로 변경하여, 주주들에 심각한 피해를 주었습니다. 

***** WTI 원유선물(H) 6월물의 비중을 일방적으로 사전공지없이 일부 7,8,9월 물들로 나누어 구성함으로써, 급격한 하락후 반등을 기다리고 투자하였던 투자자들은 원래 구성종목대로라면 얻을수 있는 이득을 얻지 못하게 되었으며(실제 4월 23일 새벽시간~24일 현재 새벽시간까지 원유가격의 상당한 폭의 상승이 이루어진 상황), 추후에도 wti 원유선물 6월물 또는 근월물의 상승이 있을 경우 기대보다 현저히 낮은 이득을 얻게 되는 상황이 되어버렸습니다. 

또한, 기존의 **자산운용에서 제시한 롤오버 기간 (매월 5~9 영업일 동안 5일간, 매일 20%씩 진행)을 무시하여, 추가의 롤오버로 인한 비용 또는 손해를 주주에게 전가하려 하고 있으며, 투자의 종목, 기간을 선택하고 들어온 주주들의 동의 없이 투자물의 변경을 임의로 강행함으로써 투자자들과 당초 약속한 투자종목과 투자물의 기간을 어기고 멋대로 운영하게 된 상황입니다. 

**자산운용 측은 일부 공지에서  급격한 원유가격의 변동상황에서 투자자 보호를 목적한다고 하였으나, 결과적으로 투자자 이익을 침해 또는 비중교체의 정확한 시점과 내용에 따라서는 편취한 상황이 되어버렸고,  급격한 원유가격 하락으로 엄청난 금전적 손실을 본 기존 투자자들에게 하락과 동일한 비율의 원유가격 상승이 추후 일어나게 되더라도 원래대로라면 회복할 수 있는 손실을 더 이상 회복할수 없게 끔 투자물의 구성을 임의적으로 변경처리했습니다. 이에 해당 사안에 대한 엄중한 수사와 처벌 그리고 얻을수 있었던 수익의 복구 등 손해배상 방법의 강구를 국민청원 하였습니다. 

1. 주주의 사전 동의 및 공지 없은 일방적인 구성종목 변경 
2. 그로 인한 주주의 금전적 손실  
3. 투자설명서에 제시된 롤오버 기간 (매월 5~9영업일동안 5일간 진행)의 약속 불이행 및
4. 이로 인한 피해를 투자자들에게 고의적이며 악랄한 수법으로 피해를 입게함
5. 마지막으로 원유선물 하락을 주도한 **자산운용을 고발합니다.

 [본 게시물의 일부 내용이 국민 청원 요건에 위배되어 관리자에 의해 수정되었습니다]"
2020-04-27,2020-05-27,육아/교육,461,어린이집 재등원 금지가 합법적인것인가요?,"안녕하십니까? 저는 4살 6살 아이를 두고있는 워킹맘입니다. 
보건복지부 올해 3월부터 기본보육과 연장 보육 시간 구분, 연장보육 전담교사 배치 관련  <2020년도 보육 사업안내>에 따라 
어린이집을 하원한 아동이 학원등을 다녀온 후 재 등원 하지 않는것을 원칙으로 한다는 규정을 이의 제기 하고 싶습니다.
대부분 어린 아이를 어린이집을 보내는 경우 거주지에서  도보 5분이나 10분거리 이내의 어린이집을 보내고 그 반경내의 피아노, 태권도, 미술등등 학원등을 보냅니다.  특히 저와 같은 경우는 맞벌이이고 퇴근을 하면 보통 6시가 넘는 상황이라 어린이집을 보내고 바로 옆의 학원을 인솔 선생님 동행하에 1시간을 다녀온후 다시 어린이집에서 아이들을 봐주어 퇴근하고 아이와 함께 하원을 해서 집으로 돌아오는 삶을 유지해오고 있었습니다. 아이가 좋아하는 발레나 미술을 제가 퇴근하고 보내기에는 너무 늦은시간이고 특히 아이가 피곤해 하기 때문에, 어린이집을 마치고 아이가 좋아하는 학원을 다녀오고 아이가 편안하게 있을수 있는 어린이집에서 돌봄을 해주니 저는 마음 편하게 일을 하고 퇴근하고 아이들과 함꼐 집으로 오는 지금의 일상이 너무 감사했습니다.
그런데 갑자기 바뀐 정책으로 인해서 저는 그동안의 삶의 질서가 흔들렸습니다. 학원을 마치고 집에 가도 봐줄 분이 없는 상황에 학원을 보내야되는지 말아야 되는지 선택의 기로에 섰으며, 한창 회사에서 업무의 중추역할을 하는 저의 위치에서 아이들 때문에 일을 더하는것이 맞는지 안맞는지 정신적인 스트레스도 받고 있습니다. 아이가 배우고 싶어하는 부분을 부모로서 시켜주고 싶은데 복지부에서 학원을 다녀온후 재 등원 금지라는 규정때문에 어린이집에서는 안된다라고 하니 저는 바뀐 정책이 맞벌이 인 부모에게 맞는 정책인지 묻고 싶습니다.
어린이집을 마치고 학원을 다녀오고 난후 1시간 반정도 어린이집에서 선생님들과 있으면 퇴근한 아빠엄마랑 함께 집에 돌아오던 아이들인데 바뀐 정책으로 인해 저는 생각지도 못한 돌보미 해줄분도 알아봐야 하고 그로인한 비용이 발생이 되고, 어린이집을 편하게 생각하던 아이들에게 낯선 돌보미분과 집에서 지내라고 해야 하고 과연 그분이 우리아이들이나 저랑 잘 맞는분인지도 정신적으로 신경을 써야 하고 너무 답답합니다.
그리고 제가 오늘 아침 보건복지부 보육정책관 보육기반과 서기관님과 상담 통화를 했습니다. 이미 이 정책을 할것이라고 코로나와 상관없이 작년 9월18일에  등재가 보건복지부 보도자료에 등재가 되었는데 상담을 하는 저에게 코로나로 인해서도 안될것 같다라는 황당한 답변을 하시더라구요. 그리고 다 알고 있는 규정만 얘기하시며 침묵만 지키시구요. 그동안 수차례 전화를 해도  받지 않고 전화로 민원을 제기 하였을때도 심드렁하게 답변하는 담당 직원의 무성의한 태도는 더욱 화가납니다. 이미 그 전에도 몇달을 고민해서 글을 남겼는데 고작 답글은 향후 보육 정책 수립시 소중한 참고 자료로 쓰겠다라는 무미건조한 답변을 받으니 과연 이런 규정들이 누구를 위한 정책인가 묻고 싶습니다. 그리고 복지부에서 어린이집 재등원 금지지침을 내는것이 과연 합법적인것인지도 묻고 싶습니다. 아이들이 원해서 학원을 보내고 싶고 학원을 보내고 다시 재등원을 해도 어린이집에서도 받아준다고 하는데 왜 복지부에서 그걸 금지하는지 묻고 싶습니다. 맞벌이 하는 부모들 특히, 나라에서는 여성 경력단절에 대해서 얘기를 많이 하는데 이런 규정이 워킹맘에게 도움이 된다고 생각하십니까? 커리어 우먼으로 인정받으며 저희 아이들도 잘키우고 싶습니다. 제발 복지부에서 긍정적인 검토를 해주시고 저에게 힘이 되는 답변 기대해봅니다. 예외규정으로 어린이집에서 도보로 반경 5분이나 10분이내 위치한 학원을 다닌 아이들에 대해서 재등원이 가능하도록 말입니다. 물론 아이가 학원을 다니는데 있어서 담당 인솔교사와 부모의 서약을 두고서 말입니다. 저와 같은 경우의 워킹맘들을 위해서 긍정적인 답변 한번더 간곡히 드리겠습니다."
