start,end,category,count,title,content
2020-04-19,2020-05-19,교통/건축/국토,241,불법유턴 적용 교통법규 개선,"저는 2019년 9월 교통사고가 나서 장애인이 되었습니다. 
중앙선이 황색실선 2줄인 왕복 4차선 도로에서 오토바이로 1차로로 주행하던중, 2차선 길가에 불법주차중이던 차량이 갑작스레 불법유턴하여 사고가 났습니다. 오토바이와 차량이 같은 주행방향이라는 이유로 불법유턴이 아닌, 안전의무 불이행만 적용되었습니다. 
가해자는 누가봐도 불법유턴을 하였지만 불법유턴이 적용되지않아서, 종합보험에 가입되어있다는 이유만으로 아무런 처벌을 받지 않고, 피해자는 평생 고통속에 살아가야됩니다. 
이에 불법유턴 교통법규 개선이 필요합니다. 

사고영상 : sbs 맨인블랙박스  11월 23일 257회
관련사례 : 유튜브 ***TV 1075회

 [본 게시물의 일부 내용이 국민 청원 요건에 위배되어 관리자에 의해 수정되었습니다]"
2020-04-19,2020-05-19,육아/교육,942,교육부가 정말 해야 하는 이야기를 해주세요.,"저는 한 학교의 교사입니다.

저는 3월부터 결국 교육부가 온라인 개학을 시키고 싶은 것 같다는 느낌을 받긴 했어요.

3월9일 개학 다시 연기하면서 E학습터니, EBS니 하는 이야기를 처음 시작할 때부터.

그 때도 제일 먼저 협조를 학교가 아닌, EBS에 구하는 거 보고 대체 왜??? 라는 생각이 들었어요.

지금 교육이 어떻게 이루어지고 있는지 전혀 감을 못 잡고 있구나 싶더라고요.

EBS에 사정해서 뭐 할건데요? 강의만 주구장창 보라고요? 현장에서 강의 비율이 어마어마하게 줄은지 오래 됐는데요?

결국 온라인 개학을 하면 1. 인강처럼 강의만 해서 될 거 아니고 선생님들이 아이들 관리 들어가야 하고,

2.학부모 협조를 꼭 구해야 한다.

이 2가지가 훨씬 중요하다고 생각했어요.

제가 온라인 개학하면 교사는 욕받이가 되겠구나 하는 생각에 소화도 안되고 두통까지 온 가장 큰 이유가요.

저는 초등이기 때문에 더욱 그런데,

어떤 식으로 온라인수업을 해도 학부모의 도움 없이 안 돼요.

학부모님들의 열린 마음 없이는요, 교사는 어떤 수업을 해도 욕을 먹을 수 밖에 없어요.

온라인으로 질높은 수업을 해도, 일부 학부모님들은 부담스러워 하세요.

질만 높으면 뭐 하냐, 그거 부모숙제여서 너무 힘들다 이렇게 결론이 나오게 됩니다.

간단한 과제를 시키면 또 그건 질이 낮다고 당연히 욕하고요.

결국 온라인 개학을 결정한 순간부터 교육부에서 내야 했던 보도 방향은,

우리 선생님들이 잘 해낼 거라 믿습니다! 하면서 교사에게 짐을 던질 게 아니라,

학부모님들에게 책임과 고통 분담의 양해를 꼭 구했어야 했어요.

기자들이 먹잇감 물은 거처럼, '이거 다~~~~~ 부모 짐인데 어쩔거야!!!!!!'라고 비난을 쏟아내기 전에,

교육부가 선제적으로, '온라인 개학하면 부모와 함께 해야 합니다. 이 유례없는 국가적인 위기를 같이 극복할 수 있게 학부모님들과 사회에 양해를 구한다'는 보도를 먼저 해줬어야 해요.

이게요, 사람이 살면서 정말 중요한 문제에요.

어떤 사람이 수고를 하면 그 수고를 알아줘야 한다는 건 정말 기본이에요.

사실 기자들이 쓰는 비난 기사 자체가 두려운 게 아니에요.

사람들이 그 기사에 동조하느냐, 아니냐가 더욱 문제에요.

부모님들이, 당장 교육 관련 카페들 돌아보면 부모님 입장에서 불만인 글들이 계속 올라옵니다.

온라인 개학이 부모의 일이라는 걸 인정을 안 해주는데, 정작 부모님들이 힘들단 말이에요.

그런데 교육부는 온라인 개학의 모든 책임이 교사들인냥 하니까, 욕할 판이 깔아지는 거에요.

부모님들 입장에서 '그래, 교육은 교사들이 할 일인데, 왜 부모를 이렇게 고생시켜!!' 이렇게 느끼게 분위기를 만드는 거라고요.

그게 아니라, 원래 온라인 개학을 하면 집에 있는 어른인 부모님도 같이 해야 한다는 인식 전환을 먼저 시켜줬어야 해요.

 이게 그냥 온라인 개학한다고 일방적으로 통보만 하는 게 아니라, 어쩔 수 없는 상황이라는 공감대와 협조를 먼저 끌어 내줬어야 해요.

그로 인해 따라오는 사회적 문제, 맞벌이 부모는 재택근무시 일정 시간은 아이의 온라인 수업을 봐줘야 하는 게 당연하다는 논의도 되게 해서 그런 환경을 조성해줘야 하는데,

교육에서 무조건 부모를 빼고, 양해를 구하지도 않고

그런데 부모가 안 힘든 건 아니니까 불만은 넘치고 그럼 그 화살이 교사로 향하는 게 당연한 수순인 거죠.

교사인 저도 온라인 수업 준비하면서, 아직까지는 2일 밖에 안 돼서 우리반은 큰 문제없이 운영되고 있기는 한데,

교육 관련 기사 댓글, 교육 관련 커뮤니티 글들에서 자꾸 교사 욕을 보니까 너무 우울해요.

저는 온라인 개학이라는 걸 아무리 생각해봐도 학부모님들 도움 없이는 절대 할 수가 없더라고요.

그래서 이 양해 과정을 굉장히 중요하게 거쳤어요.

학부모님들이 불만을 이야기하기 전에, 교육 커뮤니티에서 먼저 여기저기 가입해야 해서 힘들다는 학부모 입장의 글을 보고 나서는,

제가 먼저 우리반 전체에게 문자로, ""우리 반은 ***사이트 하나 가입해달라고 하지만, 자녀가 여럿인 분들은 학교마다, 혹은 선생님마다 가입해달라는 곳이 달라 힘드시겠다, 이 코로나 상황이 너무 갑작스럽게 벌어져서 부모님들도 너무 힘드실 것 안다, 서버도 다운되지 않고 모든 학교가 1군데만 쓸 수 있으면 참 좋을텐데 그렇지 않아서 본의아니게 힘든 학부모님들이 계신 것 같아 너무 안타깝고 죄송하다, 늘 협조해주셔서 감사하다""라고 보냈어요.

그 외에도 학부모님들에게 해줄 말이 있다면, 요청하기 전에 먼저 감사하다고 표현을 많이 했어요.

아니나 다를까 당장 우리 학교에도, 교과서 나눠줄 때 보니까 우리반 아닌 어떤 학부모님이 왜 선생님마다, 학교마다 가입하라는 데가 다르냐, 자기처럼 초,중,고 자녀 다 있는 집은 가입만 몇 군데를 하는지 모르겠다 화를 내시더라고요.

학부모님이 불만을 말을 하기 전에, 수고를 알아주는 말을 먼저 해주면 화까지 내지 않거든요.

근데 이걸 교사 개개인이, 누군 생각해서 말하고, 누군 이거까지 생각 못 해서 말 못 하고 이런 게 아니라,

☆☆☆ 교육부가 나서서 양해를 구하는 과정이 필요했어요. ☆☆☆

그리고 학부모님들이 자녀 온라인 개학 지원이 가능하도록 사회(직장)에서도 지원해달라고 정부 입장에서 말을 해줘야 했고요.

학부모님들이 아이 온라인 개학같이 해주시려고 연가를 내신 분들이 많더라고요.

그런데 연가를 하루만 낼 수 있는데, 그 날 서버가 다운돼서 제대로 도와주지 못해 걱정하시고요.

서버는 모두가 예상했던 문제지만 교육부가 최선을 다 하고 있는 거 아니까 이런 서버 다운 자체를 지적하고 싶은 거 아니에요.

그런데 사회적으로 온라인 개학을 함께 도와야 한다는 공감대가 없다고요.

이런 상황에서 잘 안 되면 모든 화가 교사에게만 향하게 되는 거에요. 이거 원래 다 교사가 해야 하는 일인데, 내가 왜 이 고생을 해야 하는 거야, 회사에 또 연가낸다고 말 못 하는데 이거 왜 이렇게 안 돼! 이렇게 생각하게 되는 부모님들이 꽤 있어요.

우리 미래를 책임질 아이들을 위해 함께 하자는 메시지를 주지 않았거든요.

어차피 온라인 개학하면서 저는 무슨 느낌이냐면요,

내 손,발 다 짤려 나갔는데 목은 안 짤라서 말할 수는 있으니까 해봐. 이런 느낌이에요.

제가 정말 자신있는 분야는 학급운영, 반 분위기 조성을 잘 해서 수업 분위기 좋게 하고 학생들도 함께 협력하게 하고, 그래서 공부를 싫어하던 아이들도 친구들과 함께 하니까 같이 힘내서 하고 그런 건데,

그런 거 하나도 못 하고 그냥 공부만 시켜라...

그것도 진짜 내가 지금까지 담임했던 아이들은 진짜 내 울타리에 쏙 들어오게 해서 내 사람 만드는 과정이 늘 있었고 그렇게 신뢰가 쌓이는 건데,

지금 새학기에 만나보지도 못 해서 모르는 아이들을 데리고 만나지도 않고 온라인으로 수업해라...

그것도 애들만 만나는 것도 아니고, 부모님들도 교육의 책임은 교사라고 생각하는데다, 지금 코로나 상황으로 스트레스가 엄청나서 그 화가 언제든 교사들에게 향할 수 있는 학부모님들까지 지켜보고 있다는 걸 알면서요.

우리 학교에서요, 선생님들이 선생님들 얼굴 들어가는 수업 영상 만들기를 꺼려하시는 선생님들이 많으시거든요. 겨우 설득해서 강의 만들어도 목소리만 들어가게 만드는 분들이 많아요.

왜 그러냐며, 선생님들이 그걸 너무 느끼고 있어요. 우리가 어떻게 해도 분노의 화살이 우리에게 향할 것이다 라는 것이요.

안 그래도 코로나 블루라는 말까지 있을 정도로, 지금 상황은 전국민이 스트레스가 높은 상황인데,

학부모들에게 함께 교육하는 파트너로서 존중한다는 느낌을 전혀 주지도 못 하고, 교사들만 총알받이로 세워놓은 느낌이에요.

우리 반 학부모가 27명인데, 그 27명의 요구가 다 달라요. 
어떤 분은 과제 많이 내주셨으면 좋겠다, 어떤 분은 과제 적게 내주셨으면 좋겠다, 
어떤 분은 인터넷 너무 많이 하지 않게 해달라, 어떤 분은 왜 IT시대에 기기를 충분히 활용하지 않느냐...

현장에서 선생님들은 결국 어떻게 하든, 누군가에겐 총알을 맞겠구나 라는 생각을 가지고 일하고 있어요. 

그래도, 저는 제 입장에서 최선을 다 하죠. 제가 우리 학년에 설득해서 우리 학년은 한 아이와 일주일에 되도록 1번 이상 전화통화라도 할 수 있게 하자(화상수업은 못 하는 학군이에요.) 하기로 했어요.

역시나 아이들은 전화해주니까 진짜 좋아하고 학부모 불만도 많이 들어갔어요.

그렇게 학교 현장에서 고군분투해도 교육 커뮤니티 글들 보면 우울해질 때가 많아요.

교육부가 교사만 전전긍긍해서 해결될 게 아니라, 학부모, 학생도 함께 하는 거라는 분위기를 전혀 만들어주지 못 한 게 제일 힘들어요.

교육부가 무슨 일을 해야 하는지 전혀 모르고 있는 것 같을 때마다 정말 마음이 힘들어요.

지금 책임질 수 없는 학교등교개학 이야기는 이제 그만하세요. 학부모들이 자꾸 교육부에서 곧 등교한다고 했다고 뉴스보고 물어보는데 교사 입장에서 뭐라고 말을 해야 해요? 

어차피 개학은 교육부가 결정할 수 있는 일이 아니에요, 보니까.

개학 날짜는 질병 전문가인 질본이 정하는 거니까 이제 제발 교육부가 점쟁이처럼 대략 언제 개학한다 이런 거 찍으면서 일하고 있다고 하지 마시고요.

교사들만 내세우셔도 온라인 개학 절대 성공할 수 없어요.

교육 커뮤니티보면 이렇게 서로 신뢰가 무너져서 나중에 등교를 한다고 해도 학부모님들이 더욱 학교에 악감정만 생기실 것 같아요.

제발 학부모님들께도, 그리고 사회적으로도 온라인 학습을 함께 준비하고 함께 이겨낼 수 있도록 메시지를 전파해주세요.

청원을 하기 위해 청와대 사이트를 들어와 보니 가장 먼저 보이는 글귀가

'서로를 믿고 격려하며 오늘을 이겨냅시다'더라고요.

제발 교육부는 야근하고 일하고 있어요~~, 실현 가능할지는 모르겠지만 오전,오후2부제, 며칠만 등교 이런이런 상상력을 발휘하며 열심히 일하고 있답니다 이런 메시지 말고요.

교육은 교사만 할 수 있는 게 아니라는 거, 부모의 역할이 너무나 중요하다는 거 뼈저리게 느끼고 있는 요즘입니다.

학부모님들께 모든 일을 미루자는 게 아니라, 서로 신뢰하는 마음을 갖게 하자는 거에요.

혹, 일하셔서, 아니면 자녀가 많아서, 부모님이 아이를 많이 못 봐주셔도, 학교를 믿고 아이에게도 좋게 말씀해주시고 이 위기를 함께 극복해 나갈 수 있도록요.

제발 교육에서도 서로를 믿고 격려하며 오늘을 이겨낼 수 있도록.

교육부가 우리 선생님들이 어떻게든 해낼 거에요라고 교사만 총알받이로 세우지 마시고,

학부모님들과 사회에도 협조를 구하고 함께 해달라고 메시지를 계속 전달해주세요.

교육의 제일 중요한 원칙인 '우리 아이들의 건강과 미래'를 위해서요."
2020-04-19,2020-05-19,행정,490,화물주선사업자 신용보증보험 의무가입시켜 주세요.,"저는 대한민국 소상공인 화물운송사업자  입니다.
구구절절한 애기는 생략하고 본론만 쓰겠습니다.

모든 주선  사업자는  신용보증보험 가입을 의무화 하여  도산하여 미수금 발생시 신용보증보험으로 청구하여  원활한 운수사업이 될수 있도록 하여주십시오

열심히 일한자들  발 뻗고 잠잘수 있는 구조를 만들어 주십시오.
세상이 어렵고 경기도 어려운세상  화물운송 노동자들은 어떻해서든 위기 극복 하려고 새벽잠 안자고  이리 뛰고 저리뛰어 부족한 수입 올리기위해 혈안이 되어 열심히 일하고 있습니다.

그러나  주선사업자들  줄도산으로  외상거래 미수금이 발생하고  
결국 미수금 회수 못하여 열심히 뛰었던 화물운송사업자들은 줄줄이 벼랑끝 위기로 내몰립니다.

한 가장이 힘들어지고 그 밑에 아이들  학원비 생계비 를 비롯 한가정  풍비박산  나는 상황을 한두번 본것이 아닙니다.
화물노동자는 대부분 영세업자들입니다. 조금의 미수금으로도 돈의 회전이 안되면 망하기 일쑤입니다.

이런문제   대책을 강구 하여주십시오.
이부분 대책이 준비된다면 많은 화물노동자들이 자유롭게 사업을 영위할수  있는 구조를 만들어주시기 부탁드립니다.

모든 주선  사업자는  신용보증보험 가입을 의무화 하여  도산하여 미수금 발생시 신용보증보험으로 청구하여  원활한 운수사업이 될수 있도록 하여주십시오.

대책이 시급합니다  
해마다 10억 이상의 운송사들의 미수금이 발생하는일이 비일비재합니다.
화물 노동자들  현장의 비명과 절규를 들어주시어  개선을 부탁드립니다."
2020-04-19,2020-05-19,육아/교육,504,"국가 재난사태로 본 교육공무원의 민낯,학부모 평가제 강화해주세요","국가 재난사태로 본 교육공무원의 민낯, 학부모 평가제 강화해주세요

모든 직업은 잘하는 사람이 있고, 못하는 사람이 있다. 간혹 몇 명의 못하는 사람들로 인하여 그 직업군 전체가 욕을 먹기도 한다. 하지만 대부분의 직업은 욕을 먹고 일을 못하면 내 소득과 연결이 직결이 되어 더 열심히 하려고 노력하고 때론 그것 때문에 스트레스를 받는 일이 많다.
하지만 일을 못해도 내 기본 소득과 관련이 없다면 그다지 노력하지 않는 직업군들이 있다.
바로 공무원들.
모든 공무원들이 그렇다는 것은 아니다. 초반에 썼듯 몇 명의 노는 공무원들 때문에 욕을 먹는다. 그래서 평가제 도입이 절실해 보인다.
이번 국가재난사태에서 정말 나를 희생해서 노력하는 사람들 대부분들은 공무원들보다 일반인들이 많다. 의료진을 포함해..대부분 나라에서 월급을 주지 않는 사람들이다.
내가 이 들을 쓰는 이유는 이번 ‘코로나19 사태’로 ‘온라인개학’이라는 것을 하면서 아이와 붙어서 교육을 대신 진행하개 됨으로써 교육공무원들이 얼마나 일을 안하고 있는지 뼈저리게 느꼈기 때문이다.
나는 초등학교 아이와 중학교 아이를 키우는 엄마다. 직장맘인데 이번 ‘원격수업’과 ‘온라인 개학’ 때문에 회사에 휴가를 내었다.
우리 아이가 다니는 학교는 온라인 개학 전 ‘원격수업 시범학교’로 지정되어 일주일 간 원격수업이라는 것을 하였다.
근데 그 진행이 엉망이다. 선생님들도 물론 대비할 시간이 없었던 것은 맞겠지만..
적어도 원격수업이라고 시간표에 적혀있는 날은 해당 과목 선생님은 등교를 해야하는 것 아닌가?
학교에서 올려놓은 시간표대로 EBS에 가봤더니 그런게 없었서 학교에 전화를 했다. 그랬더니 “오늘 영어 선생님 출근 안하셨는데요”란다. 순간 멍해졌다. 사회적 거리두기로 2부제 출근을 한다는 것은 이해한다 쳐도..적어도 본인 해당과목 첫 원격수업 날이면 출근해서 대비를 해야하는 것 아닌가? 그리고 본인이 서류 작업했을 때만 해도 그 페이지가 있었는데 오늘은 없단다.. 이게 말이되나? ‘시범학교’라는 타이틀을 달았으면 적어도 하루 전에는 최종확인을 했어야하는 게 맞는 거 아닌가? 이뿐만 아니다..원격수업을 하는 일주일 내내 이런 비슷한 일들이 있어서 학교에 몇 번씩 전화를 하게 되었는데 단 한번도 담당선생님이 나와 있었던 적이 없다. 
원격수업은 그렇다 치자. 어제부터 출결이 반영되는 온라인 개학이 되었다.
‘출결’이라는 중요한 것들이 걸려있다.
선생님들도 온라인개학이 처음이라 당황스러울 거다. 하지만 아이들은 여러 번 있던 일인가? 아이들이 더 당황스럽다. 그리고 컴퓨터에 익숙하지않은 초등생이나 중등생은 더 그렇다.
지금 4월 17일, 원래대로라면 개학이 한달 반이 지났다.
그런데 첫째아이 담임선생님에게 먼저 전화 한통이 없었다. 그저 문자오는 건 공지사항이다.
둘째아이 같은 경우는 벌써 상담도 끝나고 어려운 점이 없는지 수시로 전화도 하신다.
그러면 내가 “선생님, 이렇게 하나하나 신경쓰시느라 너무 힘드시겠어요.”하면 선생님께서 “당연히 저희가 해야할 일인 걸요. 저희가 아이들을 돌봐야 하는 공부를 현재 부모님들이 챙겨주시고 있으니 저희가 죄송하죠” 하신다.
너무 감사했다.
이게 중요하다. 학교가야 할 시간에 선생님들이 해야 할 것들을 현재 부모가 하고 있다. 온라인 수업이라는 것은 사실상 아이 혼자 100% 할 수 있는 것은 아니기에 나는 이것 때문에 현재 회사 휴가를 내야만 했다
누구도 예측하지 못한 국가재난사태. 힘듦은 다 같이 나눠야 하는데 현재 교육현장에 있는 선생님들보다 부모들이 더 고생하고 독박아닌 독박을 쓰고 있다.
첫째아이 선생님은 본인의 서류작업에 필요한 것들만 여전히 문자로 물어 보고 있다.
모든 선생님들이 우리 둘째 아이 선생님처럼 학부모나 아이한테 안부를 묻고 문자가 아닌 유선상의 통화를 많이 해달라는 것은 아니다. 하지만 적어도 이건 사람간의 예의는 아닌 것 같다. 공무원이라는 것은 국가 또는 지방 공공단체의 일을 맡아보는 사람..이다. ‘국가’와 관련된..더구나 우리나라 미래를 위한 ‘교육’을 담당하는 선생님들이라는 사람들이 너무 안일하게 일을 하는 것이 이번 사태로 정말 확실하게 보여줬다.나한테 전화 안했다고 그런 생각을 하는 것은 아니다. 코로나때문에 아이들은 어찌지내는지 잘 지내는지..라는 식의 물음이 한 번이라도 있고 공지의 문자가 왔으면 이런 생각도 안한다.

누구의 잘못일까?
선생님 개인? 학교? 정책?
다 잘못인게 맞는 것 같다.
선생님들도 요즘 힘들다고 들었다. 이렇게 한다 해서 준비해놓으면 교육부에서 갑자기 바꿔서 다시 준비해야하고..노고가 많다고 들었다.
하지만 간혹 우리 첫째 아이 담임선생님처럼, 영어 과목 선생님처럼 일을 안하는 선생님들도 있다.
그래서 이번 기회에 일을 열심히 하시는 선생님들, 아이에게 함부로 하지 않는 선생님들에게는 더 많은 보수와 기회를.. 그리고 일을 열심히 하지 않고 (소위 엄마들이 말하는 노는 선생님들) 아이에게 함부로 하는 선생님들에게는 보수 삭감 및 패널티 적용 등을 강력히 요구한다.
이렇게 되려면 정책적으로 힘든 것은 안다. 교사들은 임용교시 준비하는 것을 빌미로 어렵게 얻은 직업이라고..그것을 무시하면 안된다고 하겠지만 모든 직장들이 그 분들만큼 들어가기도 힘들고 벌기도 힘들다. 그렇게 힘들게 배운 교육학 교육들을 진짜 진실되게 아이들에게 써줬으면 좋겠다. 그래야 열심히 안해도 월급받고 유급휴가(방학)있고 연급까지 받는 ‘꿀직업’이라는 비아냥을 안받지 않겠는가? 그 돈들은 어디서 나오나? 내가 내는 세금에서 나온다. 국민의 세금으로 본인들이 월급을 받는 직업, 국민들에게 그래서 조금은 봉사..라는 마음을 다른 사람들보다 0.1%라도 더 갖어야 하는 직업..공무원 아닌가?
이번 계기로 교육계에서 일하는 선생님들이 정말 학부모나 학생들에게 존경받는 진짜 “선생님”이 되셨음 한다."
2020-04-19,2020-05-19,문화/예술/체육/언론,346,축구 유소년 선수들의 비용 부담!!!,"코로나19로 인하여 많은 축구선수들이 집에서 2달을 쉬고 있습니다.
2달을 쉬는 학생들 중에는 막 중/고등학교를 입학하는 신입생도 있습니다.
모두 힘들어 하는 이시국에 자기 배만 부르면 된다는 많은 감독들이 있습니다.
학원팀(학교), 클럽팀(개인사업) 이 팀들도 대한민국 국민이며 다 같이 힘든 이시국에 동참하여 조금은
배려를 해랴 하는데.

신입생들은 2달동안 소집일 딱 1번 학교 및 클럽을 방문했고...
밥 한숟가락, 간식한개, 침실에 등을대고 누운적도 없는데.....100% 기존 재학생 및 선배들과 같이 회비를
걷는 곳이 많습니다.

대체 무슨 생각으로 사는 것인지 정말 한심할 뿐 입니다.

물론 고통분담을 하더라도 감독 및 코치진 분들도 생활을 해야함에 급료는 받아야 합니다.
그러나 식대, 간식비, 숙식비는 대체 왜 지금 내야 하는 것인지 모르겠습니다.

일을 하지 않으면 먹지도 않는다 중국의 백장선사는 말했습니다.
무노동 무임금원칙

제발 두꺼비 파리 잡아 먹듯이 이 힘든시기 아이의 미래를 위해 허리펴며 일할 시간도 없는
부모님들 등골 그만 뽑아드시고! ~~~~~
본인들도 일을 하지 않으니 그 것에 맞는 회비를 요청하는 것이 지금 어려운 시기에 동참 하는 것이라
생각 하시길 바랍니다.

아이들의 꿈을 위해 부모님들이 일을 하고 내는 것이지 두꺼비 배 주르게 하려고 일 하는 것이
아닙니다.

운동 교육자들의 최소한의 임금만 받으시며 이 어려운시기를 같이 극복하는 참다운 스승이 되시길
바랍니다.

대한축구협회 및 교육부 그리고 세무종사 하시는 국가공무원 여러분 제발 감사한번 해 주싮십시요!
특히 개인사업자로 등록된 클럽팀들 대부분 부모님들이 99%가 현금으로 집행 합니다.
제발 공정한 경제, 공정한 혜택을 위해 제발 대한민국의 축구클럽팀 세무감사 정말 해 주십시요!

존경하는 정부 여러분 아이들의 꿈을 위해 제발 부탁 드립니다.

아이들을 볼모로 살아가는 두꺼비 수많은 감독님들 정신 차리시길 바랍니다.

마지막으로 제발 축구 개인사업자(클럽팀)강도높은 세무조사 꼭!! 해 주시길 바랍니다.

일을하지 않으면 먹지말고 일을하지 않은만큼만 받기를 바랍니다. 
그것이 스승이고 양심있는 지도자 인 것 입니다."
