start,end,category,count,title,content
2020-03-24,2020-04-23,보건복지,"14,087","대구 17세 소년의 마지막 말 ""엄마 나 아파"" 누가 보듬어 주나","저는현재 52세 두아이를 둔 엄마입니다. 저에게는 대학시절 동거동락한 30년지기 친구가 있습니다. 그 친구에게는 아직 피어보지도 못한 소중한 한 생명이 가족 곁을 떠났음에도 그 누구도 책임이 없다고 하는 이 상황이 화가 나고 암담하여 이렇게 국민청원을 올립니다.

 
3월11일부터 감기기운이 있었던 아이와 가족은 40도가 넘나드는 고열 속에 3월 12일 오후 6시쯤  현재 국민안심병원인 경산 중앙병원을 찾았습니다. 그러나 병원에서는 고열이 나는 상황에서도 아무 조치 없이 해열제와 항생제 처방만으로 집으로 돌아가게 했습니다. 사유는 코로나19가 의심되기 때문에 병원내 전파가 우려되니 내일 선별진료소를 찾는 것 외에는 할 수 있는 것이 없으며 열이나면 미온수로 씻어라 했습니다. 13일 아침 계속되는 고열에 같은 병원 선별진료소를 찾아 코로나19검사와 폐사진 등 검사를 받았습니다. 또한 병원출입이 코로나의심으로 인해 허락되지 않아 링거도 못 해준다하여 가족들이 자차에서라도 맞게 해달라 하여 링거도 차안에서 맞았다고 합니다. 검사후 X선 촬영상 폐에 염증이 있다는 소견을 받았지만, 코로나19 검사 결과가 나오지 않았다는 이유로 체온이 40도이상 올라가는 상황에서도 약만 처방해주고 집으로 돌려보내졌습니다. 가정에 암환자분이 있어, 그간 격리 수준으로 집에 있었던 학생이었습니다. 코로나가 아닐 가능성을 염두에 두고 아무리 치료해 달라고 애원했으나 소용이 없었습니다.

 

13일 오후 3시가 넘어도 열이 40도 이상 계속되어 1339에 재차 문의하니 코로나19검사 결과전에는 아무것도 할 수 없다며 진료 받았던 병원에 연락을 해보라는 답변뿐이었습니다. 다시 중앙병원에 연락을 하니 의사는 소견서를 써 줄테니 3차 병원으로 가보라고 합니다. 상황이 급하여 중앙병원장에게 구급차를 이용할 수 있도록 간절히 부탁하였지만 거절당한 아버지는  고열과 호흡곤란으로 쓰러져 있는 아들을 보며 떨리는 손으로 직접 차를 몰아 영남대병원으로 이동하였습니다. 
차안에서 엄마 나 아파 그토록 참았내던 아이의 마지막 하소연이 귓가를 통해 부모의 심장을 파고 든다하였습니다.

 

영남대병원에 도착하니 바로 코로나19 응급실 음압병실에 보내져 치료와 시술이 시작되었지만 이미 폐를 비롯한 많은 장기들이 손상되어 오늘을 못 넘길 수도 있으니 마음의 준비를 하라는 청천벽력같은 말을 했습니다. 

이후부터 아이는 음압병동에서 혼자 외로이 그 고통을 감당하고 부모는 주차장 차안에서 대기하며 수많은 동의서에 싸인만 계속 했습니다. 코로나19 결과가 나오지 않았지만 아이는 계속 코로나19 환자 취급을 받았습니다. 폐가 망가져 피를 토해 얼굴이 붉게 물들어도 닦아주는 이도 제대로 없어 아이의 얼굴은 계속 붉게 물든 채로 있는데, 보호장구 없이는 아이의 얼굴 한번 보는 것도 허락하지 않았고 부모는 결국 아이가 죽기 전까지 아이의 체온을 느낄 수 있도록 손 한번 만져보지 못했습니다.

이러한 상황은 아이가 죽은 후 음성이라는 판정이 나와도 부모가 접근할 수 없는  비닐팩 보호가방에 싸여져 개봉할 수 없는 상태로 싸여 혼자 외롭게 있었습니다.

 

3월 12일 처음 병원을 찾은 뒤 단 6일만인 18일 먼곳으로 떠날 때까지 13차례의 코로나19 검사와 수없이 많은 다른 검사와 처치를 하는 사이 아이는 알아볼 수 없을 만큼 퉁퉁붓고 피를 토하는 고통을 오로지 혼자 견뎌야했습니다. 코로나19의 가능성 때문에 제대로 된 치료를 받지 못한 아이는 결국 사망 후 음성으로 판정났습니다. 양성으로 확진이 되면 국가적인 차원에서 치료와 대처가 이루어지지만, 코로나19로 인한 질병의 사각지대에서 제대로 된 치료한번 못 받은 채 맞이한 어린 아이의 억울한 죽음에 대해서는 그 어떤 지원도, 이해가능한 설명도 받을 수 없었습니다. 온전히 치료비 전액 및 제반 비용을 스스로 감당하게 하고 애절하게 코로나19가 아니라고, 아이가 저렇게 열이 나는데 봐달라고 애원했지만 아이는 코로나19의 가능성만으로 죽음에 이를 때까지 단 한번도 일반적인 환자로 다뤄지지 않았습니다. 그런데 사망 후 음성이라는 판정 후에 질병관리본부에서는 코로나19 환자가 아니기 때문에 질본 책임이 아니라하고, 그 어떤 병원에서도 책임지지 않는 지금 유가족은 어디에도 항변할 수 없는 힘든 시간을 보내고 있습니다.
마지막 아이를 보낼 때 음압병동에 있었다는 이유로 비닐팩에 넣어져 쌓인 채 옷 한벌 입혀 주지 몼하고 얼굴 한번 보지 못한 상태로 관에 넣어져 보내야만 했습니다.

 지난 토요일 힘든 시간을 보내고 있는 가족에게 아이의 물건들은 잘 보냈냐고 어렵게 물었더니, 옆에 있어주지도 못하고 그렇게 아파하던 것을 보듬어 안아주지도 못했는데 울 자격도 없다던 어머니가 오열하며 학교는 졸업시켜야지 하며, 병원에서의 힘든 일주일도 혼자 감당했는데 고3졸업 때까지만이라도 아이의 흔적과 함께하고 싶다고 그 울음을 끊어내지 못합니다. 

 

이런 국가적 전염병 사태에서, 같은 일이 일어나지 않도록 이번 사례에 대한 대책과 지원방향을 세워주기 바랍니다. 또한 아이가 억울한 죽음이 되지 않게 반드시 누군가 책임을 져야하며 이 사건에 대하여 명확히 재조사를 하여 주시기를 눈물로 간청하며 국민청원합니다."
2020-03-24,2020-04-23,정치개혁,"1,349",텔레그램 n번방 26만명 전원 벌금형 으로 5조이상 만들어 코로나 극복합시다.,안녕하세요. 저는 **중학교 1학년 김**이라고 합니다 우연히 뉴스에서 접한 텔레그램 n번방에 네용을 알게되어 너무 분노가 치밀어 올랐습니다 뉴스를 시청하다보니 26만명에 나쁜어른들 힘들지만 처벌할수 있다는 네용을 듣고 문재인 대통령님께 강력한 처벌을 부탁드리며 이 힘든 코로나 사태에 도움이 되고자하는 아이디어를 네어봅니다 힘드 시겠지만 나쁜어른들 26만명을 모두 법으로 처벌하시여 5조원 이상에 돈을 확보해 코로나로 죽어가는 사람들과 코로나로 힘들어하시는 시민들께 도움이 되는 돈이 되었으면 좋겠습니다 어린아이가 하는말이라고 무시하지 마시고 진지하게 한번 생각해주세요 나쁜놈들 돈이지만 좋은 일에 쓴다 하면 좋은 일 이라고 생각합니다 읽어주셔서 감사합니다
2020-03-24,2020-04-23,안전/환경,"50,706",잔혹한 '관악구 모자 살인 사건'의 피의자 조모씨를 신상공개와 함께 엄벌에 처해 주세요!!,"SBS 그것이 알고 싶다 “관악구 모자 살인사건”(2020년 3월 7일 방영분)의 피해자 유족과 지인입니다. 저희 바람을, 국민청원을 통해 호소하고자 합니다. 

국민 여러분!! 도와주세요! 
아내와 아들의 식도와 기도를 정확히 절단해 살인한 피의자 조모씨에 대한 강력한 처벌과 더불어 신상정보 공개를 청원합니다. 

2019년 8월 22일 엄마와 어린 아들이 침대위에서 살해된 채 발견되었습니다. 
21일 밤 9시부터 다음 날 새벽1시반 사이에 이혼 소송 중인 남편 조모씨가 다녀갔고, 조모씨의 차 블랙박스는 오직 그날만 꺼져 있었으며, 외부침입의 흔적도 나오지 않았습니다. 최종 취식 후 음식물의 소화상태로 본 사망추정시간(최대6시간, 2~4시간)과 직장체온 변화에 의한 사망추정시각(00시 혹은 그 이전 시각도 충분히 가능)까지 모든 정황은 조모씨가 범인임을 지목하고 있습니다. 

조모씨는 헌신적인 아내와 귀여운 아들은 방임한 채 불륜, 경마를 일삼았고 가정에 생활비를 가져다주기는커녕 본인의 헬스장 이용료와 모발이식비용, 심지어 자동차 구매 할부금, 공방 대출이자까지도 모두 피해자의 지갑에서 가져다 썼습니다. 6살 어린 아들이 아빠를 보고싶다 울어도 8개월 동안 한 번도 집에 오지 않았던 조모씨는 내연녀와 주 3회 이상 경마도박을 일삼았습니다. 피해자는 가정에 소홀했던 조모씨에게 ""당신이 아빠, 남편으로서의 역할을 하지 않겠다면, 나도 아내 역할을 하지 않겠다""고 선언한 후 경제적 지원을 하지 않았습니다.
조모씨는 경제적 지원이 끊기자 이내 이혼 요구와 함께 곧 전세기간 만료니 살고 있는 집의 짐도 빼라고 통보했습니다. 결국 피해자는 이혼소장을 조모씨에게 보냈습니다. 하지만 이혼소장을 본 조모씨는 이혼이 오히려 자신에게 경제적 손실과 함께 양육비 부담까지 생겨 불리함을 알았습니다. 심지어 사건 당시 통장에는 2천원 정도밖에 남아 있지 않았으며 더 이상 손 벌릴 곳도 없었습니다.

전세보증금, 피해자 명의의 재산, 상당량의 생명보험금은 상속법에 따르면 무죄일 시 조모씨에게 대부분 가게 됩니다.

장례식장에 누나와 지인 변호사에 의해 이끌려 온 조모씨는 영정 앞에서 슬픈 내색도 없고 너무도 차분하기만 했습니다. 처참하게 죽어버린 아내와 아들 앞에서 이런 남편의 모습이 상상이나 가십니까?

장례식이 끝난 지 일주일도 되지 않은 시점에서 범행 흔적을 지우기 위해 사용되었다 의심되는 가마를 팔았고, 공방을 매물로 내놓는 등 조모씨는 아내와 어린 아들을 잃은 아버지의 행동이라고 하기에 믿기 힘든 일들을 하였습니다.

1차 공판에서 혐의를 인정하지 않는다는 당당한 조모씨의 모습에 유족과 지인들 사이에서는 멈출 수 없는 오열이 터져 나왔습니다. 그 후 2차 공판에서 피해자 모자가 각각 11회, 3회씩 칼에 찔려 식도와 기도가 완전히 잘려버렸다는 부검결과를 듣고도 일체 표정변화가 없었던 조모씨와는 달리 방청석에서는 탄식의 소리가 흘러나왔습니다. 8차 공판인 오늘은 국가의 혈세로 피해자의 아들이 피고인 조모씨의 친자임을 확인하는 유전자검사 결과까지 들어야만 했습니다. 정말 비참하고 참담하기 그지없습니다. 조모씨가 하는 말 중에 진실이 있기나 한 걸까요. 왜 저희가 7개월 동안 고통받는 지옥 속에서 살아야만 하는 겁니까!

탄원서 한 편 쓸 때마다 그리움과 분노로 흘리는 눈물이 얼마나 될지 과연 상상이나 하실 수 있을까요!!
유족과 지인들은 각 공판마다 탄원서로 조모씨의 거짓 주장을 반박하고 있습니다. 많은 친구들이 만사 다 제치고 탄원서를 쓰기 위해 피해자와의 대화나 관련 기록들을 7개월이 지난 지금까지도 훑고 뒤지고 있습니다.
친구를 잃은 충격에 자살충동을 느끼고, 우울증에 시달리며, 억울함에 순간순간 증오가 솟구치는 등 유족과 중⋅고교⋅대학친구들, 그리고 함께 했던 봉사단체친구들은 그들의 영혼을 조모씨에게 무참히 짓밟히고 있습니다.
조모씨는 결코 피해자 모자만을 죽인 게 아닙니다. 

국민 여러분!! 저희의 청원에 동의해주심으로써 국민 배심원이 되어주세요! 피고인 조모씨가 응당한 죗값을 받게 도와주십시오! 끝까지 지켜봐 주십시오! 이 길만이 독서지도사 준비를 마치고 누구에게도 의지하지 않고 아들과 오순도순 살아가려던 꿈에 부풀어 있던 피해자의 한을 풀어 줄 수 있습니다."
2020-03-24,2020-04-23,외교/통일/국방,"2,371",단기방문자 입국 금지,"안녕하세요, 

현재 외국에서 들어오는 입국자들에 대해서 외국인일지라도 국고로 치료를 해주는 제도를 운영하고 있습니다.
1인당 검사 비용은 7만원 안팎이며, 이들이 자가격리에 들어갈 경우 생활지원금을 지원하는 방안에 대해서도 검토 중인것으로 알고 있습니다. 

물론 이와 같은 조치가 코로나 확산방지에 도움이 되는 조치임에는 분명합니다.
하지만 외국인들의 생활지원금이나 검사비용 지원 제도는 악용될 여지가 충분해 오히려 한국으로 유입되는 외국인 확진자를 늘리고, 이를 국민들의 세금으로 충당하게 되는 악순환이 발생할 수 있습니다. 

22일 기준 신규 확진자의 21.9%가 해외유입환자인만큼 해외유입을 막지 않으면 방역 대책이 성공할 수 없습니다.

우리 국민들은 코로나19 확산으로 인해 생활고가 가중되고 있는 지금에도 외부 활동을 최대한 줄이는 등 최대한 정부 시책에 동참하려 노력하고 있습니다. 
이러한 와중에 해외유입이 계속해서 늘어난다면 국민들의 노력이 모두 수포로 돌아가는 것과 다름 없습니다.

해외 여러나라에서 우리나라의 코로나 확진자가 늘어날때 우리나라 입국자을 차단시켰던 사례는 국가이기주의가 아니라 자국민을 보호하기 위한 국가의 최소한의 조치 중 하나였다고 생각합니다.

코로나19로 인한 경제타격으로 우리나라 경제가 휘청이고 있습니다. 현재 우리나라 GDP 대비 정부부채가 낮다고 하지만 정부부채 증가율은 세계 3위일 정도로 빠른 속도로 증가하고 있습니다. 국민들에 대한 생활지원금에 대한 예산마련도 쉽지 않은 이 때에 추가적인 지출을 줄이고, 외부 유입을 최대한 차단하는 것이 코로나19 확산을 막는 가장 효율적인 조치라고 생각됩니다.

경제에 대한 타격을 줄이기 위해 싱가포르와 같이 단기 방문과 경유에 대해서만 입국을 금지하고, 방문 목적을 자세히 기술하여 꼭 필요한 입국자만 선별해 입국시킬 필요가 있습니다. 
단기방문자만 제한할시, 여행 등 꼭 필요하지 않은 방문 수요를 차단할 수 있으며 한국에서 무상으로 치료받기 위한 목적으로 입국하는 외국인 등 불필요한 수요를 차단할 수 있습니다. 
또한 외국인 치료에 대한 접근 방식도 달라져야 한다고 생각합니다. 현재는 소수이지만 항공료가 치료비나 생활지원금을 상회할 시 확진자들이 고의로 입국하는 것을 막을 수 있는 제도적 장치가 전혀 존재하지 않기 때문입니다.  

국가의 존재 목적은 국민이며, 정부는 국민의 세금으로 운영되는 국민을 대리하는 기구입니다. 국민들을 보호하는 것이 정부 시책의 제1순위가 되어야 하며 국민들의 세금이 원하지 않는 타국 환자들을 위해 우선적으로 쓰이는 일이 없어야 합니다. 

""코로나19에 대응하고 우리 국민의 수요에 부응하기 위해 제한된 의료자원을 아낄 필요가 있다""는 싱가포르 정부의 발언을 우리 정부도 한 번 가슴속에 새겨주시길 바랍니다."
2020-03-24,2020-04-23,육아/교육,"6,572",( 코로나19 )어린이집.유.초.중.고 무기한휴교 해주세요.,"그 무엇과도 바꿀수없는 내 소중한 아이들.....
이 어린아이들을 위험한 불구덩이속에 던지지 말아주세요.
코로나19  정말 위험하고 무서운 전염병입니다.
이 힘없고 약한 내 아이들을 지켜주세요.

코로나19로인해 외출 한번 하지않고 집에만 있습니다.
아이들도 많이 답답해하고 힘들어 합니다.
저역시 집안에서 두아이와 하루하루 보내는것이 힘들지않다 하지는 못합니다.
하지만, 내 아이들이 건강한것에 감사하며 살아가고 있습니다.
내아이가 아픈것만큼 고통스러운건 없을거예요.

4월6일 개학을 강행하시는것같네요?
확진자수가 조금씩 줄어드니 이제 개학해도 될 것 같나요?
이 어린아이들이 종일 답답한 마스크를 착용하고 그 긴 시간동안 대화도없이 학교에서 수업이 가능할까요?
밥을 먹기위해서 마스크를 벗어야합니다.
화장실에는 쉬는시간 아이들이 바글바글합니다.
다음 대책은 개인 소변기도 준비하라할껀가요?
그와중 아이들은 답답하니 마스크 썻다 벗엇다...
눈만지고 코만지고 입만지고...
무슨 마스크가 코로나 100퍼 막아주는 방어구입니까?
선생님이 계속붙어다니며 아이 한명 한명 종일 통제 해주실껀가요?
대책이 면마스크2장씩 지급? 일자급식? 칸막이 설치?
면마스크 효과없다면서요? kf 마스크 다 뺏어가더니 고작 면마스크2장씩 지급? 
그리고 콜센터는 칸막이없어 감염됫나요?
좁아터진 교실에서 20명 이상이 수업을 받는데...
200m 거리 둘 공간은 있나요?
선생님 한분이 그많은 아이들 통제가 가능할것 같아요?
우리 아이들 안전.건강, 생명보다 학업일수가 그렇게 중요합니까??
저는 제 아이들 안전.건강이 더 중요합니다.
정말 말도 안되는 정책에  할말도 많고, 쓸 글도 많은데...
확진자 0명 될때까지 무기한휴교 해주세요.
이런 믿음안가는 정책!!! 
누가봐도 개소리인 대책!!!!
이런 상황에 내 아이들 학교보내기 너무 겁나네요.
내 자식이 소중하지 않은 부모는 없어요.
내자식 목숨걸고 공부 시키고싶지 않습니다.
교육부에서도 한명 한명이 내자식이다 소중히 생각해주세요.
저출산시대에 지금 태어나 열심히 살아가고잇는 아이들부터 지켜주세요."
2020-03-24,2020-04-23,보건복지,428,현직약사입니다. 마스크수급실태 개선요합니다.,"1.언론상으로는 3월 17일부터 약국에 낱개포장 마스크가 공급되도록 하겠다고 보도되었는데 3월 23일 현재까지도 계속해서 벌크포장으로 배송이 됩니다.
그런데 도매업체 여건상 앞으로도 벌크포장이 배송될거라고 공문이 왔습니다. 
공장 > 도매업체 > 개인업장 순으로 위생관리가 철저하고 효율적으로 되리라는건 자명한 사실이고.
대부분의 약국이 위생적으로 소분하겠지만 혹여 위생에 대한 관념이 철저하지 않은 어떤 약사가 침 뭍혀가며 약국봉투에 두개씩 집어가며 넣고 있을지, 하루에 1000만장씩 소분마스크를 공급하는게 더 전염병을 양산하는게 아닌지 무섭습니다.
소분을 받아가는 손님들도 꺼림칙해하시지만 그것마저도 금마스크이니 한시간씩 줄을 서서 울며겨자먹기로 받아가십니다.
위생의 우려가 있는 소분마스크 공급하지 마시고, 더 위생적으로 소분 가능한 시스템인 공장에 인력지원하시어 낱개마스크로만 유통되도록 해주세요.

2.직접 의료현장에서 고군분투하는 의사,간호사,자원봉사자 모두들에 비해 저는 아무런 실질적 도움이 되지 못하여 의료인으로서 부끄럽기도 합니다.
현재 약국이 마스크 공급으로 겪고 있는 고통들을 말하는게 그들과 비교되어 말씀드리기 송구스럽기도 합니다.
그럼에도 불구하고 말씀전하면, 저희는 스스로가 원하는 형태로, 할수있는 형태가 아닌 강요당한 방법으로 강제 마스크 공급을 하게 되었습니다. 공적기관이 아님에도 현 시국에서 가장 마스크 공급에 효율적일수 있는 기관이니 힘들지만 해나가고 있습니다.
그런데 언론에 보도된것처럼 협박과 위험속에서도 저희는 전혀 보호받지 못하고 있습니다.
마스크 부족에 대한 불만도 약국에 쏟아지고 엄격한 대리구매에 대한 원성도 약국에 쏟아집니다. 각 약국의 상황에 맞추어서 하는 판매방식,판매시간도 손님들의 불만과 실랑이로 매일이 힘든 상황입니다.
마스크 소분에, 마스크 판매에, 하루 2-300건 쏟아졌던 마스크 문의전화에, 향정만큼 엄격한 마스크 입고 재고보고로 일더미에 파묻히고 매일 시체처럼 잠이 듭니다.
하루 125명씩 마스크 손님들이 약국에 드나들며, 사회적거리두기는 딴 세상 이야기입니다.
그런데 마스크로 약사한명이 입건되었다는 뉴스를 접하고 참으로 한탄스러웠습니다. 이렇게 보내온 한달의 결과물이 이거라니.
약사는 위협과 협박으로부터도 보호받지 못하고, 강제마스크판매와 바이러스에 노출되어 한달을 고생한 결과가 이거라니.
마스크로 인해 피해보는 약사가 있다면 아무리 힘없는 개인이라지만, 힘없는 약사회라지만, 절대 참지 않을겁니다.

3.저는 마스크 판매시 현금,카드 구분없이 받습니다. 마진이 남니 안남니 따지는게 지금 시국에 의료인으로서의 태도가 아닌것 같아요.
젊은 분들은 보통 현금 소지 안하는 경우가 많아서 대부분 카드로 계산하세요.
그런데 도매상에서는 마스크 결제대금을 현금으로만 하라고 요구를 하고 그로 인해 약국들과의 문제가 있었습니다.
저희는 손님들에게 계속 카드결제를 받고 있는데 도매상에는 현금결제를 해주길 바란다는 약사회의 공문도 있었습니다.
누구를 위한 약사회인가요?
대한약사회에 전화하여 여쭈었더니 도매상 현금융통을 위해서 그렇게 해달라는 대답뿐이었습니다.
카드결제거부는 신고대상이죠? 도매상의 카드결제거부를 신고합니다."
2020-03-24,2020-04-23,문화/예술/체육/언론,"2,567",방과후 강사 경제적 생계유지 대안을 촉구합니다.,"안녕하십니까
코로나19사태로 많은 국민들이 힘든 나날을 보내고 있습니다. 저 또한 힘들고 답답한 상황속에서 나날을 보내고 있는 국민으로 호소합니다.

제가 이렇게 청원글을 쓰기전 국민신문고에 민원을 넣었지만 돌아오는 대답은 아직 대책마련이 되지 않았다, 계속 이야기해보겠다, 노력해보겠다 라는 내용의 글 이였습니다.

개학이 미뤄지면서 강사선생님들의 수입은 0원이 되었고, 아무런 대책 마련 없이 미뤄지는 개학일을 바라보면서 답답한 마음에 이렇게 다시 한번 청원글을 올립니다. 

방과후학교는 지난 15년 동안 동일 된 금액의 수업료를 받으며, 정규 교육과정을 보완하여 학생들의 특기와 적성을 계발하고, 경제적 여건이나 거주 지역에 관계없이 학생들이 다양한 교육을 경험할 수 있도록 최선을 다해 교육격차 해소에 도움이 되길 바라며 수업을 진행하고 있습니다.

방과후학교에 대한 학생과 학부모의 만족도도 높아서 거의 모든 초·중·고등학교가 방과후학교, 학기운영제, 학년운영제, 1인1악기 등의 수업을 운영하고 있고,  이처럼 매년 10만 명이 넘는 강사선생님들이 고생하며 수업 프로그램을 만들고 운영하고 있습니다.

또한 학교의 일반 행정 업무를 수행하게 하는 등의 불리한 규정을 두지 않도록 학교에 안내하고 있다고 얘기 하시지만, 실질적으로 갑보다는 을인 강사선생님들이 아무런 보장과 대책도 마련되어 있지 않은 상황에서 불리한 규정을 뿌리칠 수 있다고 보시는지 여쭤보고 싶습니다.

현재 코로나19사태로 개학 연기가 3차례 이어지면서 ’9월개학’ 내용을 보게되었습니다. 

또 한차례의 개학연기 또는 ’9월개학’ 을 계획하고 계신다면, 강사선생님들의 경제적 생계유지의 대책 마련 또한 함께 고민해주셔야 할 것 입니다.

강사님들의 정당한 댓가를 위해 노력하고 있다, 얘기하고 있다 라는 대답보다는 실질적이고 구체적인 해결방안을 마련해주시길 간곡히 부탁드립니다."
