start,end,category,count,title,content
2020-09-14,2020-10-14,교통/건축/국토,316,'토지거래허가제'를 풀어 시장을 얼리지 마시고 자유 매매가 일어나게 하여 상충하는 여러 부동산 대책에 인한 부작용과 상충된 정책으로 고통받는 선의의 피해자를 보호바랍니다.,"안녕하세요.

임대사업자로 사업등록된 주택이 재개발에 의해 멸실이 이루어지고 정부의 민특법의 변경으로 하루 아침에 다주택자가 되어  종부세를 감당 할 수가 없어  거주주택을 의도치 않게 매도 해야 할 상황이 되었습니다.

집을 빼앗기는 것도 억울한데 거주주택은 토지거래 허가지역으로 묶여 매수세가 없어 아직 매도가 일어나지 못하는 상황으로 양도세 중과와 종부세 폭탄의 재산상의  피해가 불가피하게 되었습니다.

따라서 거주주택이 '토지거래 허가제'로 막혀 매도 퇴로 부재로 인한 양도세 비과 적용을 받지 못 하고 양도중과와 종부세 폭탄 피해발생으로 개인 재산귄에 대한 심각한 피해상황에 대한 우려로 청원을 하게 되었습니다.

지난 삼 개월 간, 밤 잠 못 이루며 '신뢰원칙'을 깨는 정부에 대한 실망과 절망으로 고통받으면서도 어쩔수 없이 거주하는 주택을 매도하기로 결정하고 거주주택을 부동산에 내 놓았으나  단 한 명도 집을 보러오지 않는 심각한 실정입니다. 정부는 이러한 시장 상황과 급격한 임대법의 소급적용으로 인하여 구제받지 못하고 고통받는 소수의 피해자가 존재한다는 걸 아시는지요. 

공급책을 유도하시려거든 시장에서 매수매도가 자유롭게 일어나도록 '토지거래 허가제'를 풀어주시고 정부의 일방적인 정책변동으로 인해 불가피해진 개인 재산권의 피해를 최소한으로 보호해 주시길 바랍니다. 

정부의 주택 공급정책과 공적의무를 다하기 위하여 거주주택을 매도할 계획이니 매도 될 수 있도록 거주주택 양도과세 배제와 얼어 붙은 현 시장에서 매도 할 수 있도록 합리적이고 현실 가능성있는 매도기간 유예를 청원드립니다. 

위와 같은 내용의 민원을 여러 번 접수 하였으나  국토부 담당자들은 회신을 차일 피일미루고 서로 책임을 회피함으로써 시간만 소요되고 있는 상황이고  임대사업자의 직권말소에 대해서는 설명을 회피하고 그 어느 누구도 책임지려 하지않습니다.  토지거래 허가제로 옥죄인 주택시장은 얼어붙고 있고 중과를 피하기위해 남은 3개월간 매도를 해야만 하나 현실적으로 불가능하여 다급한 마음으로 청원드립니다.

또한 재개발 임대사업자에 대하여 멸실 전과 멸실 후로 구제책을 달리하시는데 그 이유도 논리성이 전혀 없습니다. 국민들의 편을 가르지 마시기를 부탁드립니다.  이는 형평성에도 어긋 날 뿐더러 멸실 후 사업자들은 거주주택을 당장 매도해야할 위기에 처해 있어 구제가 현실적으로 더 급한 상황입니다. 

국토부에서는 멸실이 이루어진 임대사업자들 에게는 2018.9.13정책이전 재개발로 인한 사업지 멸실 후 자진말소와 함께  재등록하여 공적 임대의무기간을 채우도록 고지하여 왔습니다.

그러나 2년이 지난 현재, 하루 아침에 말을 바꾸어 직권말소 시켜 다주택자로 만들어 종부세를 부과하겠다고 합니다. 그 누가 이런 가능성을 알고 임대등록을 유지해 왔겠습니까. 거주주택을 내 놓아야 할 상황에 처 할 오늘의 상황을 과거에 상상이라도 할 수 있었다면 저는  임대주택을 매수하지도 않았을 뿐 더러 오락가락하는 임대사업자 정책에 대한 불신으로 임대 사업 등록 또 한 하지 않았을 것 입니다.

진정으로 정부에서 고의성으로 멸실 된 재개발 임대사업자들에게 거주주택 매도 퇴로도 막아두시고 폭발적인 종부세와 양도중과세를 부과하시어 종부세 맞고 죽으라는 의도가 정녕 아니시라면 저에게도 퇴로를 열어 주시길 간곡히 청원드립니다.

거주지를 박탈당하는 상황에 공적의무를 다하는 선의의 피해자들에게 거주주택을 매도 할 수 있는 현실적인 유예 기간과 거주주택 양도비과혜택을 주시길바랍니다.

소급적용하시는 법에 선의의 피해자들에게 당연한 구제책과 퇴로는 만들어 주시길 바랍니다."
2020-09-14,2020-10-14,정치개혁,"1,188",윤창호법 강력 적용 안 하는 판사들 규탄 - 6살 아이 사망 사건,"음주 운전으로 인한 사고가 끊이지 않고 일어나고 있습니다. 

최근 6살 아이가 햄버가 가게 앞에서 엄마와 기다리다 음주 운전을 한 가해자가 유발한 사고로 사망한 사고가 있었습니다. 

이것뿐 아니라 수많은 음주 사고가 계속해서 일어나고 있습니다. 

법은 강력한데 법 집행을 하는 판사들이 솜방망이 처벌을 하고 있습니다. 
판사들이 음주 운전자들을 양성하고 있는 것과 마찬가지입니다. 

음주 사고는 잘잘못을 따져야 되는 복잡한 법리적 사항이 아닌 가해자의 명백한 잘못인 경우가 대부분입니다. 

그러함에도 불구하고 음주 사고로 사람을 죽여도 합의하고 몇 년 감옥에서 살다 나오면 그만입니다. 

햄버거집 앞에서 음주 운전자 때문에 사망한 6살 아이 사건도 걱정이 됩니다. 

이에 청원인은 그동안 음주 사고에 대해 관대한 판사들을 규탄합니다. 

이 아이 사건을 계기로, 판사들이 가해자에게 윤창호 법을 강력 적용을 할 수 있도록 판사들을 교육 시켜주시길 청원 합니다. 

그리고 6살아이 사건 뿐만 아니라 모든 음주 사건 사고에 대한 강력한 법 집행을 요구합니다."
2020-09-14,2020-10-14,행정,250,GTX-C  - 과천역은 되고 인덕원역은 안된다는 국토부 논리,"https://news.v.daum.net/v/20200913060059764

기사 보면 --
- 공무원 논리 이해 안되서 건의드립니다.



""""  예를 들어 인덕원역을 신설할 경우 과천역과의 거리가 채 3㎞도 안 되는 탓에 열차가 제 속도를 내기 어려워 광역급행철도 기능에 지장이 생길 수 있다는 것이다. """"



근데  .. GTX-B - 서울역-용산 -여의도 -신도림 구간은 몇 킬로 간격일까요?      평균 4킬로 간격



4호선 - GTX-C  - 인덕원- 과천 구간 -3.8 킬로 간격-  입니다.



국토부 논리가 맞을까요?


4호선,월곶 판교선,인덕원 동탄선 등 3개 철도 노선이 만나는 인덕원역에 GTX 역이 안 생기고,,   이용 인구도 적은 과천에 역 생기는게 국민 편익에 맞는건가요?

GTX-C 노선 -- 과천에 역 만들고 인덕원에 역 안 만드는건 미래 철도 이용 인구들에게 큰 불편을 준다고 생각합니다.
되돌릴수 없는 과오를 피하고 - 합리적인 의사결정을 요청합니다."
2020-09-14,2020-10-14,행정,187,자영업자 매출감소 기준일을 실질적 기준에 맞춰주세요!!,"이번 정부발표에서 자영업자 매출 감소 기준월을 6,7월 매출 대비 8월 매출감소로 확인 한다고 하시는데 실질적 기준에 맞지 않는다고 생각합니다!

저는 학원을 운영하고 있고 학원에 대한 집합금지 기간이 실질적으로 9월달 인데도 불구하고 9월 매출감소 기준이 아닌 8월 매출감소로 확인 한다는건 자영업자들의 어려움을 꼼꼼히 살피지 못하는 행정 편의주의적 정책입니다. 

그동안 코로나 종식을 위해 수많은 자영업자들이 정부의 방역 정책을 믿고 따르며 희생을 감내해 왔는데 이런 국민들의 어려움을 꼼꼼하게 살펴보지 못하는 행정 편의주의적 정부정책을 보고 있으면 앞으로 정부정책을 계속 믿고 따라야 하는건지하는  의구심마저 듭니다.

코로나로 힘들어 하는 수많은 자영업자들을 위해 정부가 조금 더 세심하게 신경써 주셔서 실질적인 혜택이 돌아갈수있도록 간곡히 청원드립니다!"
2020-09-14,2020-10-14,육아/교육,"10,269",N수생들이 안전하게 공부할 수 있게 재수종합학원을 열게해주세요,"현재 서울.수도권의 n수생들은 공부할 곳이 없어 고시원같은 학사나 집에서 혼자 힘들게 공부를 하고 있습니다. 사회적 거리두기는 충분히 공감하고 온 국민이 반드시 실천해야 할  사항이고 앞으로도  생활의 일부분이 되어야 할 것입니다. 
 하지만  300인이상 재수종합학원에서는  철저한 방역으로 다른 어떤 곳보다 안전하게 운영해 온 결과 지금까지 한 명의 확진자도 나오지 않았습니다. 이제 사회적 거리두기 2단계가 앞으로 2주 더 , 아니 추석 지난 시점까지 진행될 경우 수능을 코 앞에 둔 학생들은 개인과외를 알아보거나 공부할 수 있는 공간(독서실. 스터디 카페. 카페. 작은 학원 등등)을 찾아  나설 수 밖에 없습니다.
차라리 안전하게 공부할 수 있게  학원을 열게 해 주세요. 
현 고3은 300인 이상이라도 학교에 가고 있습니다.  N수생들도 관리하에 공부할 수 있도록 그들의 학교인 재수종합학원을 운영하게 해 주십시오. 다만 더 철저하게 방역수칙을 지키며 안전하게 공부할 수 있도록 지침을 따르도록 하면 될 것입니다.

특히 지방에서 서울로 재수하러 올라온 학생들은 2평짜리 방에서 감옥에 갇힌 듯 지내고 있습니다.(일부는 너무 힘들어 정신과 상담을 받고 있습니다)  그들의 어려움을 헤아려 철저한 방역수칙을 따르는 조건으로 재수종합학원을 열어주세요."
2020-09-14,2020-10-14,기타,187,청소년도 피시방 가게 해주세요,"청소년 말고 성인만 피시방 출입이 가능한거는 문제라고 생각함니다.
잘못은 어른이 하고 왜 청소년들이 고통을 받아야 하나요?"
2020-09-14,2020-10-14,행정,388,임대사업자도 고통분담 동참하게 해 주세요.,"유례없는 재난 상황에 국가는 영세사업자들에 강제로 사업을 중단하도록 명하였습니다.
그런데 영세사업자들은 매출만 포기하면 되는게 아니라 빚을 내서라도 인건비와 임대료는 꼬박꼬박 지급해야 하는 삼중고에 시달립니다.

사업장을 빌려서 매출을 올리고 그 매출액의 일부로 임대료를 지급하는 구조에서 사업장을 사용하지 못하도록 강제하려면 사업자가 매출을 포기하는 만큼 임대업자에게도 임대료를 포기하도록 하는 것이 지극히 상식이 아닌가요?

종업원이야 그렇다 치더라도 사정이 조금 나은 임대업자는 대한민국 국민이 아닙니까?
강제로 사업을 중단시킨 것과 형평에 맞게 임대료 수입도 강제로 포기하게 해 주는게 정의롭기도 하거니와 영세사업자에게는 재난지원금보다 훨씬 큰 도움이 될 것입니다.

국가적 재난에 영세사업자들에게만 고통을 강요하고 갑의 위치에 있는 임대업자는 고스란히 수입을 보장해주는 불공정한 고통분담 정책을 즉각 시정해 주시기 바랍니다."
2020-09-14,2020-10-14,행정,"3,182",노래방 살려주세요,"송파구에서 노래방을 운영중인 영세 자영업자입니다.
8월19일부터 지금까지 영업을 못하고 있는데 또다시 2주간 연장이라니 정말 사는게 아닙니다. 숨만 쉰다고 살아있다고 할 수 있나요? 이건 너무나도 불공정한 사한이라 생각합니다.물론 현 상황을 이해 못 하는건 아닙니다. 하지만 11개 시설물만 걸어 잠금다고 해결이 되겠습니까? 연장을 하려면 모두 같이 해야지 몇군데 걸어 잠근다 한들 과연 괜찮을지 의문입니다. 노래방 업주가 죄인도 아니고 확진자도 다른곳에서 더 많이 나왔는데
임대료는 무었으로 낼 것이며 생계는 어떻게 유지하라는건지...
노래방에서는 방역수칙 엄격하게 지키고 손님들 QR코드 
찍고 정부에서 내려온 지침 철저히 지키며 영업했는데 이럴수는 없습니다.제발 노래방 업주들 살려주세요."
2020-09-14,2020-10-14,보건복지,385,"응급실, 중환자실의 파업 금지, 국공립병원 파업 금지","이번 의사 파업으로 인해 가장 국민들이 걱정하고 우려했던 것은 국민 생명과 안전이 위협받는 것이었다.

대형병원의 핵심 의료인력인 전공의들이 진료를 거부한 데다, 응급실·중환자실 등 필수인력까지 자리를 비우자 응급환자들이 응급치료를 받을 병원을 찾지 못해 사망하고, 중증환자들의 수술·항암치료·검사가 연기되는 등 응급·중중 환자들의 피해와 불편은 생명을 위협하는 심각한 상황에까지 이르렀다.

생명이 경각에 달려 있는 중증 환자들을 사지로 몰아넣는 행위와 다를 바 없었고, 이번 의사 집단행동은 환자가 자신의 생명과 치료를  맡기고 있는 의사를 신뢰 할 수 없게 되는 참담한 결과를 초래했다는 사실도 잊어서는 안된다.

피해와 상처를 입은 국민들과 환자들에게 의사단체들은 사과해야 하며, 다시는 이러한 사태가 반복되지 않도록 국회와 정부는 강력한 재발방지 대책을 마련해야 한다. 환자의 생명을 볼모로 정부에 협상을 요구할수 없는 강력한 제도적·입법적 장치가 필요하며 더이상 의사 파업으로 인해 국민 생명과 안전이 위협받지 않도록 안전장치를 강화해야 한다. 업무개시명령만이 아닌 의료법을 고쳐 응급실과 중환자실의 파업 금지, 국공립병원 파업 금지 등을 입법화할 필요성이 있다."
2020-09-14,2020-10-14,보건복지,622,엄마가 요양병원에 입원한지 38일만에 의식불명후 돌아가셧습니다.,"2020년 3월25일 어머니 치매를 치료하기 위하여 요양병원에 입원시켰는데 38일만에 (2020년05월 03일) 갑자기 어머니가 아침식사후 의식불명되어 곳 돌아가실 것 같으니간 마음에 준비를 하셔야 할거 같다 하여 깜짝 놀라서 익산원광대학병원으로 전원요청후 응급실 및 신장내과 중환자실에서 40일간 인공호흡기로 연명치료하면서 살아 가시다가 사망하셨습니다.

대학병원 내과교수님 말씀으로는 요양병원에서 처방한 약물이 과다하여으로 뇌가 급격하게 경색이 되었고 어머니가 음식을 숨으로 인식해서 폐에 음식물이 들어갓고 폐에 들어간 음식물이 염증을 일으켜 폐혈증이 된 것이며 염증이 고혈압을 만들어 뇌에 영향을 주었을 것이고, 신장도 안좋아져서 뇌에 피가 공급이 안되니 의식불명이 되었다고 합니다.

교수님에 그 말을 듣고 기억하였다가 장례를 치루고 49제를 지내고 사망진단서와 진료기록부를 요양병원과 대학병원것을 발부받아 확인해보니 치매환자에게 치매치료제는 1알만 먹이고 나머지 약들은 
(할리페리돌-조현병, 쿠에타핀정-정신분열증, 자나팜정-항불안제, 티세르신-행동장애개선, 졸피신-수면제, 리스펜정-정신분열증) 
이런 독한 약들을 더 많이 먹였더군요. 체중이 40키로미만인 어머니에게 이런 독한 약들을 처방해준 의사를 전 이해를 하지 못하겠습니다.

저도 체중이 90키로이고 어머니가 돌아가신후 우울증이 있어서 정신과 치료중이지만 겨우 3알, 하루 아침 저녁 2번 먹는데도 어지러워서 매일 먹지를 못합니다.

요양병원측과 이야기도 해보았지만 병원측 인력이 1:1 케어가 안되는데 야간에 수면장애가 있는 어머니때문에 다른 환우들이 수면에 방해를 받을까봐 주치의나 담당의사가 조금 과하게 처방한 부분이 없지 않아 있는거 같다는 원무과 직원에 이야기도 들었습니다.
법적 절차를 진행하려고 진료기록부를 발급받는중에 요양병원측에서 합의금 500만원을 제시 하더군요
너무 어의가 없어서 제가 조치할 수 있는 부분들은 하고 있습니다.

치매환자를 돌보기 힘들거나 돌볼 자신이 없으면 퇴원을 시키든가 전원을 시켜야지 치매환자에게 독이 되는 약들을 처방해서 잠만 재운 요양병원측에 행동에 책임을 묻고 싶습니다."
2020-09-14,2020-10-14,기타,885,결혼식 인원제한 및 특별방역기간,"안녕하세요! 

처음으로 청원을 올리게 됩니다
여지껏 정부에서 내려온 지침을 준수하고자 노력하고 노력하던 사람입니다 
저는 10/10 결혼하는 사람으로 코로나로 인해서 하루에도 몇번씩 피눈물을 흘리며 매일 확진자가 줄어들길 바라고 바랬습니다

코로나로 인해 모두가 힘들어 하지만..그 중에 평생에 한번 결혼을 하기위해 많은 수고를 겪은 저희들을 알아봐주시기 바라며 이글을 적습니다

영업을 하지 못하는 소상공인 분들도 물론 많이 힘드시겠지만, 결혼을 준비하고 그 하루를 위해서 노력하고 고생한 저희들은 등한시되는 것 같습니다! 

확진자의 수가 줄어서 2단계로 내린만큼 결혼식도 조금의 차이를 두었으면합니다.
결혼을 축하하러 오지도 못한다는 사실이 너무나도 가슴이 아프네요 단지 축하만 받고 싶다는건데...

2단계오 하향한 만큼 결혼식도 부페 ,식사 금지 등 방역수칙을 준수 하되 인원제한만 풀어주셔서 그날을 위해 준비한 신랑신부가 시작하는 앞날을 축하라도 해줄수 있게 부탁드립니다

또 추석에는 특히 방역기간을 강화하되..주말에 결혼하는 사람들을 위해서 평일까지만 강화하고 주말은 풀어주셨으면 합니다. 제발 시작하는 저희의 앞날을 눈물과 슬픔으로 시작하게하지 말아주세요 간곡히 부탁드립니다.."
