start,end,category,count,title,content
2020-09-07,2020-10-07,인권/성평등,"13,040",일간베스트 사이트를 폐쇄해주세요,"대한민국 악의축 일베 싸이트 폐쇄를 요구합니다

1
지역감정 조장의 근원지 일베 입니다
특정 지역의 말투를 비하하고 조롱하는 목적으로 사용하고 
특정 지역을 조롱하는 등의 부정적인 지역감정을 조장하고 있습니다

2
5.18 민주화 운동에 대해 비하하고 전두환 전 대통령의 폭력적인 행동에 대해 찬양하는 글들을 올려 
생명을 경시하는 폭력적인 분위기를 조장하고 있습니다.

3. 

특정인을 대상으로 음란한 게시물을 올리고 미풍양속에 저해되는 음란하고 모욕적인 욕설과 비하 , 성희롱 발언들이 계속적으로 올라오고 있습니다. 
또한 아동청소년법에 위반되는 사진들을 올리고 무분별하게 
성착취물을 올리는 범죄행위들이 일어나고 있는 사이트입니다. 
또한 특정 성별을 비하하고 다른 사람의 성정체성을 비하하는 혐오적 발언을 일삼고 있습니다 

4. 

고 노무현 대통령 외에 특정인들에 대한 고인능욕적 발언과 
그를 지칭하는 상징들을 계속적으로 올리며 악성 게시물과 댓글을 달고 있습니다. 


또한 계속적으로 범죄행위를 예고하거나 모의를 하는 
장소로 이용되고 있어 앞으로 나타날 범죄행위를 예방하기 위해
사이트 폐쇄가 필요하다고 생각합니다. 


기사 인용

◇n번방의 주류문화가 된 일베, 거리낌 없이 따라하는 10대=두 평론가의 주장을 종합하면 ‘n번방’에는 기존 일베 유저들과 일베 코드를 따르는 극단주의 성향의 유저들이 혼재한 것으로 보인다. 세계적인 극단주의 흐름이 우리나라에서는 노 전 대통령에 대한 비하 등 일베 코드로 나타난 것으로 일베 유저들에 의해 일베 코드가 비(非)일베 유저들로까지 확산된 것으로 볼 수 있다.

문제는 10대들이 ‘일베’로 대표되는 극단주의와 범죄에 크게 영향 받고 있다는 점이다. ‘이기야’ 20세, ‘부따’ 19세, ‘태평양’ 16세, ‘로리대장태범’ 19세, ‘갓갓’ 19세(추정) 등 텔레그램 내 성착취방 10대 가담자들은 노무현 대통령이 취임한 2003년 당시 2살, 3살의 갓난아이에 불과했다. 그럼에도 지난달 28일 경기남부지방경찰청이 성착취물 제작 판매 유포 사범 72명을 검거해 조사해본 결과에서도 10대가 33명(45.8%)으로 가장 많았다. 

방**기자 ******@sedaily.com

허위사실유포, 명예훼손, 약자에 대한 무자비한 폭력과 테러, 성착취물의 온상인 일베싸이트는 이제는 없어져야 맞다고 봅니다. 하루빨리 대한민국 악의축 일베를 폐쇄해 주십시요

 [본 게시물의 일부 내용이 국민 청원 요건에 위배되어 관리자에 의해 수정되었습니다]"
2020-09-07,2020-10-07,행정,564,9시에 영업종료면 불공평한 자영업자들이 너무 많습니다,"문재인 대통령님 8일간 수도권은 9시까지만 장사하라고 하셨는데 너무 불공평하지 않나요? 원래 밥집이나 카페는 9시면 마감할 시간입니다. 그런데 술집은 아홉시부터 거의 장사를 시작하는데 9시에 닫으라면 아예 장사를 하지 말라는 거잖아요. 코로나가 낮에는 안돌아다니고 밤에만 돌아다니는 거 아니잖아요. 따지고 보면 사람들 활동이 더 많은 낮이 제일 위험한 시간이지 않습니다. 다 떠나서 일주일간 다같이 문을 닫아야 하지 않을까요. 9시 이후 술집 문 닫으면 뭐하나요. 오늘 낮에 보니 식당, 카페에서 죄다 마스크 안쓰고 떠들고 있습니다. 누군 영업하고 누군 영업 못하고 너무 불공평합니다. 그리고 단 하루 전에 발표하면 남은 재료들은 어떻게 합니까? 나라에서 보상해 주시나요? 월세는요? 세금은요? 해외입국도 좀 막아주십시오. 해외입국자들 격리기간 제대로 안지키는 사람 너무 많습니다. 폰을 두개를 쓴다던지 거짓위치어플을 설치해서 쓰는 사람 너무 많아요. 그러니 아무리 국민들이 방역을 잘해봐야 무슨 소용입니까 해외입국자들이 다시 다 퍼트리는데 정 해외입국을 못막는다면 해외입국자들 정부 관리하에 자가격리 말고 강제격리 시켜주세요."
2020-09-07,2020-10-07,기타,"9,829","""제주판 살인의 추억""이라고 불리는 사건을 아시나요?","- 제 동생을 죽인 범인이 무죄로 확정되지 않게 도와주세요!!

저는 2009년 2월 1일 제주시 용담동에서 택시탑승을 마지막으로 실종되었다 2월 8일 애월읍의 차가운 배수로에서 잔인하게 살해된채 발견된 '보육교사 살인사건' 피해자의 언니입니다.

처음 동생이 실종되고 발견되기 까지 꼭 돌아올 것이라는 희망으로 미친듯이 찾아 다녔던 시간들...가족끼리 부둥켜 안고 눈물로 지새웠던 날들은 오히려 뭐라도 할 수 있었기에 괜찮았습니다. 하지만 동생이 성폭행 미수범에 의해 살해되었음이 확인된후 부터 우리 가족의 시간은 불행과 악몽속에 멈춰 버렸습니다.

부모님은 그날 이후 거의 웃지 않으십니다. 몇년 동안 계속 경찰서에 가서 형사들에게 범인 잡아달라 하소연 하시고, 술을 드시면 눈물과 한숨이 뒤섞인 통곡으로만 세월을 참아내고 계십니다. 자식이 먼저 죽으면 가슴에 묻는다 하던데...이건 차마 지켜볼 수도 대신할 수도 없는 지옥일 뿐입니다. 그래도 ""동생죽인 범인보다는 더 오래 살면서 그놈 천벌 받는거 봐야겠다""고 말씀하시며 강하게 버텨 주심에 감사할 따름입니다.  

우리 자매들의 삶도 그날 이후 달라졌습니다. 함께 모여도 서로를 무심하게 대하고 동생 이야기를 잘 꺼내지 않습니다. 아마 우리가 평범하게 살아가는 이 작은 일상을 더 이상 누리지 못하게 된 동생에의 미안함과 죄책감 때문에 서로에게 더 무심해 지는 것 같습니다.

1년...1년...세월이 지나 갈수록 이렇게 동생의 억울함이 영영 잊혀지게 되는가 하는 불안감은 더해져만 갔고, 이에 더해 한해가 다르게 눈에 띄게 연로해 지시고 쇠약해져만 가시는 부모님을 뵐때마다 걱정으로 눈물이 마를 날이 없었습니다.

언제쯤 우리가족에게 내려진 이 지옥같은 삶들이 끝이 날까요?

사실 사건 발생초기 경찰에서는 유력한 용의자로 택시기사인 지금의 피고인을 체포 했었으나 당시 사망시간 혼선으로 수사도중 풀어주게 되어 이후 장기 미제사건으로 남게된 것입니다.

그러던 어느날 10년만에 범인이 검거되었다는 소식을 듣게 되었고, 우리 가족은 10년만에 서로를 위로하고 웃을 수 있었습니다. 범인을 잡기 위해 포기하지 않고 끝까지 수사해준 형사님들에게 너무 감사했고 대한민국 국민임이 자랑스러웠습니다. 이제는 억울하게 죽임을 당한 동생이 마음편히 눈을 감을 수 있겠다 생각했습니다.

하지만 그후 1년간 진행된 재판을 지켜보며 다시 한숨과 분노로 가슴을 쥐어짜야만 했습니다. 1심에서 무죄로 풀려나 자유롭게 돌아다니는 피고인을 보니 피가 거꾸로 솟는것 같았고, 항소심까지 무죄판결이 났을땐 정말 하늘이 무너지는것 같았습니다.
검찰에서 마지막으로 대법원에 상고를 하긴 했습니다만, 판사님들이 직접증거만을 요구하고 있기에 아마 유죄를 받기는 어려울 것 같다 합니다.

정말 지금의 피고인은 무죄이고, 억울한 누명을 쓴 사람일까요?

주변에서 듣기로 법원에는 ""한명의 무고한 사람을 처벌하기 보다는 열명의 범인을 놓치는게 낫다""는 형사재판의 원칙이 있다하고 저 또한 틀린말은 아니라 생각합니다. 하지만 첫 재판부터 마지막 재판까지 지켜본 결과 이건 그냥 법원이 범인을 놓치기 위한 재판을 하고 있다는 의심을 가지게 되었습니다. 

1. 경찰과 국과수의 노력으로 동생의 사망시간이 새롭게 확인되었기에 그 시간대 CCTV에 녹화된 차량의 종류가 증거로 제출되었고, 이에 대한 국과수 감정인의 증언이 있었습니다. 그러나 피고인측 변호사의 다그침에 긴장한 증인이 ""아닐 수도 있다""라는 책임회피성 답변을 했습니다. 그리고 이 허술한 답변으로 인해 제출된 차량감정 증거는 아무것도 아닌것이 되어버렸습니다.

2. 동생이 당시 입었던 무스탕 점퍼의 동물털이 피고인 택시차량에서 발견되었고, 피고인의 옷 섬유가 동생의 몸에 남아있음이 증거로 제출되었으나 미세섬유라는 이유로 인정되지 못했습니다. 동생과 피고인이 접촉하지 않았다면 어떻게 동일조직의 섬유가 교차하게 되었을까요? 대체 접촉하지 않아도 교차할 수 있다는 가능성은 무엇을 근거로 내린 판단일까요?

3. 사건이후 피고인이 보인 이상한 정황들-거짓진술, CCTV 자료, 지인에 부탁한 숙소청소, 주민등록 말소, 갑자기 제주도를 떠난 도피생활, 타인명의의 휴대전화 소유등-너무 많아 일일이 열거할 수도 없는 비정상적인 행동들은 무엇을 말하는 것일까요? 왜 피고인은 철저히 자신을 숨기고 흔적을 지우며 살아온 것일까요?

재판에서 판사님들은 경찰과 검찰이 제출한 증거들을 아무것도 아닌것으로 판단하면서 계속 직접증거를 가져오라 요구했습니다. 이미 10년의 세월이 흘렀는데 이 이상 어떻게 더 직접증거를 가져올 수 있을까요? 당시 사망시간 혼선으로 그때 검거한 피고인을 조사도 못해보고 풀어줘 증거인멸의 시간만 주었는데 직접증거가 어디에 남아 있을까요? 

요즘 모든 판사님들이 요구하는 DNA라는 직접증거도 2007년에야 재판에서 채택되었음을 알게 되었습니다. 그렇다면 그전에는 과학적인 직접증거가 많이 인정되지 않았을텐데 그때는 어떻게 재판을 했을까요? 직접증거 부족으로 전부 무죄로 판결 했을까요? 이번에 제출된 과학적인 분석에 의한 미세섬유도 충분히 증거가 될 수 있다 생각되는데 왜 새로운 증거로 인정되지 않았을까요? 

그리고 도난사건과 같은 재판에서 일반적으로 인정되고 있다는 정황증거가 왜 피고인에게는 인정되지 않는 것일까요? 법원에 제출된 명확한 정황증거들과 과학적인 증거들 모두가 피고인을 범인으로 가리키고 있는데 왜 무죄가 되어야 할까요? 생각하면 할수록 이해할 수 없는 의문들 뿐입니다.

사실, 저 또한 무고한 사람을 범인으로 생각하고 있는건 아닐까 계속 고민했고, 잘못된 결과로 한사람의 인생이 망가질까 두렵기도 했습니다. 하지만 수천번 스스로를 의심하면서 재판을 지켜보고 증거들을 확인해 보니 지금의 피고인은 절대 무죄가 될 수 없다 생각합니다. 

여기에 최근 방송된 '그것이 알고 싶다'에 나온 전문가들의 견해를 본후 증거들의 가치와 과학적 신뢰도를 조금 더 이해하게 되었고, 이를 통해 무죄가 아니라는 생각이 확신으로 변했습니다. 방송에 출연한 순천향대학교 홍성욱 교수님을 포함한 다수 전문가분들의 의견을 법원에서 적극적으로 수용해 주면 좋겠습니다.


이제 시간이 얼마 남지 않았습니다. 조만간 대법원 상고심이 열릴것이고 여기에서 무죄로 확정되면 피고인은 영원히 자유의 몸이 될 것입니다. 그때 피고인이 웃으면서 ""사실은 내가 범인이였다""라고 고백하는 영화같은 악몽이 벌어질까 벌써 두렵습니다.

수많은 증거들이 피고인을 범인으로 가리키고 있으며, 여기에 스스로 무죄임을 주장할 수 있는 변변한 설명조차 못하는 피고인이 무죄가 되지 않게 도와 주십시요.
전문가들의 견해가 반영되고, 명확한 정황증거들과 CCTV 증거, 과학적 기법에 의한 미세섬유 증거가 인정된다면 피고인은 당연히 유죄가 되어야 합니다.

저는 우리나라에 정의가 살아 있음을 믿습니다. 
동생을 죽인 그 범인이 반드시 죄값을 치룰수 있게 만들어 주십시요.
어린이집을 운영하겠다는 미래를 위해 성실히 최선을 다해 삶을 살았던 동생의 억울한 한을 풀어 주십시요.

그리고 동생을 허망하게 보낸후 평범한 일상을 잃어버린채 천천히 시들어 가는 우리가족을 살려 주세요. 간절히 부탁드립니다.

마지막으로 사건을 포기하지 않고 끝까지 수사해준 경찰분들과 재판내내 동생을 위해 애써주신 검사님들께 진심으로 감사드립니다. 

2020년 9월  6일
제주도에서"
2020-09-07,2020-10-07,보건복지,686,외국처럼 전문간호사에게 처방권을 주세요. 그럼 지역의료 공백과 의사들의 파업에도 국민들의 불안이 덜해질 것 같습니다.,"안녕하십니까?

이런 인사가 무색해지는 시국입니다.

개념없는 몇몇 집단의 이기적인 행태로 그간 국민들이 함께 노력해서 지켜온 우리의 공간과 시간과 생활이 
다시금 무너지는 것이 아닌가 하고 겁이 납니다.

그런데 이런 시국에 의사들의 '무기한 파업'이라니요....
이건 인질을 데리고 대치하는 해적과 무엇이 다른가요?

급진적으로 원하는걸 이루려고 하지말고 조율을 해 나가야지...배울만큼 배운 분들이...
이런 상황들이 너무 안타깝습니다.

얼마전에도 병원에 의사를 찾아 헤맨 40대가 사망한 사건이 있었는데 그 다음 사람이 저의 사랑하는 가족이 되지 않으리라고 누가 장담할 수 있습니까?

그래서 우리나라도 외국처럼 전문간호사에게 약처방권을 주십시오.
미국이랑 캐나다, 유럽 등 다수 국가에서는 전문간호사가 약처방권을 가지고 환자들을 돌보고 있습니다.
공공의대가 싫으면 전문간호사에게 외국만큼의 권한을 줘서 지역의료 공백이 덜 생기도록 하는 방법은 어떤가요?
지금 이러한 상황에서도 간호사가 처방권이 있다면 국민들의 불안은 훨씬 덜 할 것 같습니다.

다른 나라에 없는 것을 특별하게 우리나라 간호사에게 부여하라는 것이 아닙니다.
다른 나라에서는 다 하는걸 특별하게 우리나라에서만 못하도록 막고 있는걸 풀어주십사 하는것입니다.
이참에 검토해 봐 주십시오."
2020-09-07,2020-10-07,기타,182,국민을 안심시켜 주세요,"금번 김치공장 코로나19 환자발생으로 김치를 통한 코로나 전염 우려 및 불안감에 대한 저의 짧은 소견을 피력코자 합니다.
바이러스는 세포를 가진 생명체가 아니므로 살아있는 생명체에 붙어서 활동을 합니다.
때문에 음식이나 물건등에서는 단시간에 사멸되기에 음식  등 으로의 전파는 전혀 근거가 없는 것으로
금번 김치공장에서의 코로나 환자 발생을 이유로 배추 등 야채 및 김치를 전량 폐기처분 하도록 한 조치는 탁상행정의 한 단면을 보여주는 것으로 국민들에게 미치는 심리적 불안감이 엄청 크게 작용 한 다는것을 간과한체 근시안적 탁상행정의 한 단면을 보여주었다.
정부는 지금이라도 국민불안을 불식 시킬 수 있는 대 국민 안내를 언론을 통해 발표해야 할 것이며 김치폐기 조치를 즉각 철회하여야 할것이다."
2020-09-07,2020-10-07,인권/성평등,942,폭행당한 소방관 제압하며 상해 입히면 상해죄??,"2018년 9워19일  정읍시 상동  한 초등학교 인근 술에 취한 취객 제압중 발목 골절등 전치 6주 상해 1심에 이어 항소심까지 200만원의 벌금형을 선고 받다니...
기사에 나온게 정확한 사실인지는 잘 모르겠으나...취객의 폭행으로 그를 제압한 과정에서 상해를 입혔습니다. 그럼 모든 소방관은 폭력으로부터 무방비 상태에 노출이 되어 무조건 적으로 방어도 못하고 제압도 못하고 맞아야만 합니까?누가 범죄인 입니까??정신없이 누가 누군지 사리분별도 못하고 남에게 어떤 행위를 할지 모르는 취객일까요??아님 신고를 받고 출동해서 무차별적 인신 공격이나 폭행을 당했을지도 모를 소방관이 자신을 지키려던 행동이 범죄인일까요???적어도 자신은 지켜가며...자신의 맡은바를 이어나가야 할거라 생각 합니다."
2020-09-07,2020-10-07,문화/예술/체육/언론,781,BTS 군면제 청원합니다,"BTS가 빌보드 차트에서 1위했습니다.
한국에서는 최초이고 
아시아에서도 거의 드문 성과입니다.
그 영향력은 세계적으로도
엄청나고 경제 효과와 국위선양에도 
그 어떤 외교관이 할 수 없을 정도로 막대합니다.

국제 콩쿠르 우승하면 군면제 해줍니다.
아시아게임 야구 금메달 따도 군면제 해줍니다.
아시아에서 야구하는 나라는
한국 일본 대만뿐입니다.
거기에 일본은 아마추어 대표를 내보냅니다.
거저 따는 아시아게임 야구 금메달입니다.
BTS와 비교 자체가 안됩니다.

이제는 바라보는 시각이 바뀌어야 합니다.
대중문화도 세계적으로 커다란 성과가 있다면
당연히 군면제 해줘야 하는 시각으로 바뀌어야 합니다.
KㅡPOP,Kㅡ드라마,Kㅡ푸드
앞으로는 기준이 바뀌길 희망합니다.

BTS 군면제에 모든 기관들이 논의해주세요
국민적인 여론은 당연히 면제 요건을
갖추었다는 사람들의 시각이 많습니다.
많이 동의해주세요"
2020-09-07,2020-10-07,보건복지,"5,006",10월 3일 개천절 집회를 막아주세요,"2020년 8월 15일, 우리 민족이 가장 자랑스러워 해야 할 광복절의 악몽이 또 일어나지 않게 해주세요. 

** ** 교회를 중심으로 교인들만 1200여명, 집회참가자들 500여명이 코로나에 감염되었고, 그로 인해 n차 감염으로 이어져 아무 관련 없는 국민들이 피해를 입게 되었습니다. 집회를 막지 못 할 경우 의료체계가 붕괴되고, 경제상황이 악화되는게 뻔히 보이는데 아무리 집회금지통보를 내렸다 하더라도 왜 나라의 공권력을 최대한 동원해 막지 못하는 걸까요? 국민들도 사회적 거리두기 2.5단계에 동참하는 마당에 이 상황에서 집회가 말이 됩니까? 나라를 위해서, 국민을 위해서 10월 3일, 개천절에 열릴 종로집회, 광화문집회, 경복궁집회 등을 막아주세요. 위치추적 못하게 핸드폰 끄고, 현금만 사용하여 집회를 여는 **** 무책임한 사람들을 부디 막아주세요. 또한, 집회참가자들 전원의 코로나 치료비를 나라 예산에서 사용하지 않고,  개인에게 청구하는, 보다 강화된 처벌을 원합니다.

 [본 게시물의 일부 내용이 국민 청원 요건에 위배되어 관리자에 의해 수정되었습니다]"
2020-09-07,2020-10-07,안전/환경,"1,134","개천절 보수단체 집회를 강행한다면,  관련자 엄벌해 주시기 바랍니다.","광화문 집회로 국민생명에 위협을 가한 보수 단체들이 스스로 자성하기는 커녕, 오히려 적반하장입니다. 이유는 개천절에 수천명에 달하는 집회신고를 했다고 합니다.

이에 청원합니다. 해당소속기관은  절대 집회에 대해 불허해 주시기를 간곡히 부탁드립니다. 전**을 아직 구속시키지 못한 결과, 청와대, 대통령께 사과하라고 큰소리 칩니다. 외신들도 그를 미친선지자라 보도합니다. 또한 전** 지지자들은 약속이나,  한 듯 코로나를 전면에서 막고 있는 전은경 본부장을 고발 한다는 이야기까지 합니다.

국민 생명을.위협하는 단체에 대해 , 이번 경우 재판부는 국민 앞에서 올바른 판결을 통해, 원칙을  몸소 보여주시기 바랍니다. 말이 아닌 실천이 답입니다.그래서 우리들이 코로나로 불신하는 판사에 대해서도 신뢰를 회복하시기 바랍니다. 그것이 올바른 절차입니다.

코로나로 국민들의 생활은 이루말할 수 없습니다.
외출 자제 뿐, 아니라 코로나로 생계가.어려운 자영업자들도 많습니다. 또한 코로나로 회사를 그만둔 사람들도
속출합니다. 유치원과 이제 막 아장아장 걷는 아기들 조차 마스크를 달고 삽니다. 그들은 아마 마스크를 쓰는 세상에 태어난 것으로 알고 있을겁니다.

그리고 연로하신 분들도  대문 밖 출입이 더 어렵습니다.저부터 매일 간곡하게 부모님께 외출자제를 요청드립니다.자식들 보기도 어렵습니다. 
이런 상황에 반정부적인 시위를 또 눈감아 준다면 허락해 준 어떤 기관이든 국민들이 반드시 책임을 물을것이며, 절대.이번 만큼은 회피하지 못할겁니다. 그것은 국민의 인권, 위에 군림하는 것입니다. 시위를 또 눈감아 준다면 허락해 준 어떤 기관이든 국민들이 반드시 책임을 물을것입니다. 절대.이번 만큼은 회피하지 못할겁니다. 그것은 국민의 인권, 생명은 안중에도 없는 쓸모없는 기관일테니까요.

삼권분립의 존재유무가 무엇입니까? 직업이 갖는 윤리의식은 또 뭐구요? 다수의 횡포도 말이 안되나 소수가 다수를 위협하는 행위는 절대 근절되어야 합니다.

그것은 유명무실한 법사위를 떠나, 상식 중 상식입니다.
반드시 관계된 기관이나 단체들이 협조해서 이번 집회는 막아주세요.

국민들이 매번 방콕,집콕하면 뭐하겠습니까!또한 질본은요. 코로나로 연일 더운 여름날, 땀으로 샤워하는 의료진들은요!  이건 아닙니다. 인지상정은 안된다 쳐도 원칙은 적용해주세요. 국민의 인권과 권리가 특정집단에.의해 침해 당하지 않기를 요구하는 바입니다.
이런 내용이 그들의 인권침해라 한다면 그건 말장난입니다. 

이기적인 집단에게는 관용,이해 그리고 쓸데없이 기다려 주는 기다림 이모든 것이 무용지물입니다. 그들은 반성하기는 커녕, 합리화 내지, 그들 스스로의 행동에 대한 구실을 찾습니다. 제약이 없다면 이사태에 대해 아무런 죄책감없어지므로 다음 행동을 반복하게 하는 원동력이 됩니다. 이런 것들에 대해 해당기관은 언제까지 귀막고 눈감으시렵니까! 

반드시 집회 못하도록 소속기관은 강하게 밀고 나가세요. 국민들도 그들 때문에 폭발직전입니다.

 [본 게시물의 일부 내용이 국민 청원 요건에 위배되어 관리자에 의해 수정되었습니다]"
