start,end,category,count,title,content
2020-05-11,2020-06-10,보건복지,672,﻿코로나 종식될 때 까지라도 불법 유흥업소 영업을 막아주세요.,"﻿
안녕하세요 대통령님,
저는 작년 11월 자영업을 시작한 자영업자입니다.
개업 후 의외로 괜찮은 매상을 올리고 있는 중 코로나 사태를 맞게 되어 치명타를 입고 있는 중입니다.
일명 오픈빨로 작년 연말 매출이 높아 소상공인으로 분류되지 못하고, 정부 지원을 전혀 받지 못하는 상황에 근근이 버티는 중이었습니다.
5월은 나아지겠지 하는 생각에 지속적인 적자에도 버티고 버티는 중에 이태원클럽과 블랙수면방 사건까지 터져서 이제는 다 포기 하고 싶은 생각만 드는 중입니다.
이태원클럽 사건으로 서울에서는 영업정지 행정 명령을 내린 것으로 알고 있습니다.
그러나, 음성적으로 영업하는 불법 유흥업소는 저의 생각으로는 전혀 방법이 없습니다.
대한민국은 엄연히 성매매는 불법 인건 다들 알고 있지만, 그러한 성매매가 사라질 것이라 생각하는 사람은 거의 없을 것이라 저는 생각합니다.
그렇지만, 지금 상황은 틀립니다.
세금 한 푼 안 내고 불법 영업을 버젓이 하는 불법 유흥업소들이 대한민국에는 차고 넘치고 넘칩니다.
만약 이런 불법 유흥업소에 코로나 환자가 한번 갔다 하면 지금까지 전 국민이 쌓아올린 모든 공든 탑이 한 번에 다 무너집니다.
그런 업소의 특성상 모두 현금거래가 이뤄지고, 모두들 회피하기 때문에 동선 파악하는 사이 이미 지역사회 간염은 불을 보듯 뻔한 일입니다.
일명 오피, 키스방, 안마방, 불법마사지 등 수도 없이 많은 종류의 불법 유흥업소들이 판을 치고 있다는 것은 언론을 통해 이미 다 소개되었고, 그러한 불법 유흥업소들 대부분 공권력의 비호를 받으며 영업을 한다는 사실은 이미 대부분의 사람들은 짐작하고 있을 것입니다.
저는 이상론자가 아닙니다.
그런 불법 유흥업소 아무리 단속해도 사라지지 않습니다.
코로나 종식이 될 때까지만이라도 모든 행정력을 동원해서 영업을 못 하게 막아야 합니다.
단속을 해라는 말이 아닙니다.
단속을 하면 더 음성적으로 숨어들게 될 겁니다.
성매매에 대한 수요가 사라지게 하는 건 거의 불가능합니다.
그렇지만, 일시적이나마 성매매 공급 차단은 얼마든지 가능합니다.
왜냐면, 이미 버젓이 대놓고 영업을 하고 있기 때문입니다.
만약 불법 유흥업소에 대한 조치가 늦게 되어 이태원클럽 같은 상황이 발생하면, 이건 도저히 걷잡을 수 없는 상황이 발생합니다.
이미 간염 여부를 파악하지 못한 상황에서 모든 가족, 직장, 학교에 다 전파하고 난 이후가 되어 버리기 때문입니다.
이태원클럽은 양호한 편입니다.
행정명령이라도 내릴 수 있기 때문입니다.
불법 유흥업소는 답이 없습니다.
이미 불법이기 때문입니다.
저는 대통령님의 의지만 있으시다면, 코로나 상황이 종결될 때까지만이라도 전국적으로 만연한 불법 유흥업소의 일시적인 영업정지는 충분히 가능하다 생각합니다.
다시 한번 말씀드리지만 저는 대한민국에 성매매 업소가 사라질 거라는 이상론자는 아닙니다.
이번 코로나 상황에서 세금 한 푼 안내는 불법 유흥업소 때문에. 성실하게 영업하며 세금 납부하는 국민들에게 피해가 없길 바라며 이 청원을 올립니다.
﻿"
2020-05-11,2020-06-10,인권/성평등,300,간호학과 학생의 실습시간과 인권,"간호학과 4학년 학생입니다. 지금까지 약 800여시간을 실습을 하였습니다.(간호학과 졸업이수는 실습 1000여시간)
 지금은 국가 재난상황입니다. 국가 재난상황에서는 모든 게 정상참작 가능하다고 봅니다. 4학년 일학기는 실습으로 한 참 바빠야 할 때입니다.
하지만 코로나로 인하여 실습을 할 수가 없으며, 집에서 인터넷 강의를 듣고 있습니다. 1학기는 이렇게 지나가고, 저희는 이학기 때 국시공부를 하여야 합니다. 실습을 할 시간이 없습니다.
저희는 학생입니다. 직업인이 아니며, 아직도 더 배워야 하는 학생입니다.
이런 저희가 이런 위험한 상황에서 병원 실습은 무리라고 생각합니다.
저희가 코로나가 유행하는 상황에서 병원실습을 한다는 것은 인권침해에 해당한다고 생각합니다. 솔직히 저희가 신규간호사가 되면, 어차피 신규간호사로서 교육을 받게 됩니다. 또한 일정기간 동안 신규 간호사로서 선배 간호사가 지도를 합니다. 그렇기 때문에 굳이 실습이 아니더라도 간호사로서 안전한 간호를 수행하는데는 지장이 없습니다.
 저희는 간호학과를 졸업하려면 1000시간 이상의 실습시간을 채워야 합니다.
지금까지 저희는 약 800시간의 실습시간을 채웠습니다. 그래서 
첫번째로 건의할 사항은 4학년 학생들의 이번 코로나 사태로 인한 실습시간 1000시간을 800시간으로 줄여 달라는 겁니다. 저희 간호학생들의 실습시간이 1000시간에서 800시간으로 줄어 든다고 해서 나중에 병원에서 근무하는데, 실력이나 안전 간호면에서 지장은 없다고 생각합니다. 어차피 저희가 실습을 가서 배우는 것은 정말 거의 없습니다. 저희가 실습을 가면 대학병원에서 거의 노가다를 하고 옵니다.  그리고 다시 말씀드리면 저희는 식사시간 1시간씩은 실습시간에서 제외 받았습니다. 그 식사시간 1시간씩은 인권존중 차원에서 실습시간으로 인정받아야 한다고 생각합니다. 그리고 또한 저희는 실습을 하면서 실습외의 시간에 담당교수님으로 부터 실습 지도를 상당히 많이 받고 있습니다. 솔직히 말씀드리면, 그 시간도 실습시간에 포함되어야 한다고 봅니다. 저희는 학생이고, 병원실습을 안전하고 유익하게 하려면 담당교수님의 지도가 필요하고, 담당교수님의 지도시간도 당연히 실습시간에 포함되어야 하지 않겠습니까? 따라서 저희는 충분히 나머지 채우지 못한 200시간도 실습 지도 교수님의 지도시간과 빼먹은 점심 1시간을 포함하면 충분히 채울 수 있다고 봅니다. 솔직히 병원실습에서 배우는 것보다 지도교수님께 개인적으로 배우는 게 더 유익한 실습이었습니다. 병원에서는 정말 하루 종일 노가다만 하다 오고 정말 힘듭니다.
그것도 점심시간 1시간을 제외하고 채운 실습시간입니다.
그런데, 대학병원에서 요구하기를 식사시간은 실습시간이 아니라면서 식사시간 한 시간을 제외하고, 총 9시간 근무에서 8시간만 실습시간으로 인정받고 실습하였습니다. 저희는 직장인이 아니고, 학생입니다. 학생이 실습을 한다는 것은 모든 상황을 배우기 위함이며, 이 과정에는 식사시간도 포함되어야 한다고 생각합니다. 식사시간을 실습시간에서 제외하는 것은 인권존중에 위배되는 상황이라고 생각합니다. 또한 저희는 학생이기 때문에 당연히 실습을 하면서, 지도교수님의 지도를 받는 시간이 필요합니다. 지도교수님의 지도로 안전교육도 받고, 전문 교육도 받으면서 안전하교 교육적인 실습이 가능하기 때문입니다. 그런데, 대학병원에서는 지도교수님의 지도를 일주일에 2시간 정도 받는데, 그 시간 때문에 점심시간도 삼십분으로 줄였습니다. 이건 엄염한 인권침해에 해당한다고 생각합니다. 
저희는 학생이지, 직장인이 아니며, 또한 저희는 병원의 예비인력이 아닙니다. 그런데, 대학병원에서는 저희에게 힘든 일을 시키면서, 저희 사비로 돈 주고 먹는 밥 먹는 시간까지 침해 하는 건 명백한 인권침해에 해당한다고 봅니다. 
저희학생들은 대학병원에서 정말 많은 일을 합니다. 9시간 동안 거의 서서 일을 하고, 많은 눈치를 보면서, 많은 꾸중을 들으면서 일을 하고 있습니다. 그런데, 밥 먹는 1시간 마저도 존중받지 못한다는 것은 말이 되지 않습니다. 또한 실습시간에서 밥 먹는 한 시간을 제외한다는 것도 인권에 명백히 위배된다고 생각합니다.
제 의견을 정리하겠습니다.
저희는 간호학생이라는 이유로 실습을 한다는 명목으로 저희 차비 내고 출근을 하고, 저희 사비로 점심을 사먹고 있습니다.
저희 간호학생들 중에는 보육원에서 사는 아이들도 있고, 집안 형편이 무지 어려운 학생들도 있습니다. 저희 간호학생들은 새벽 6시에 출근을 하는 근무조도 있습니다. 그런 상황에서 아침에는 택시를 탈 수 밖에 없는 상황도 많습니다.(먼 곳의 병원을 배정받을시, 또한 집이 먼경우 등등) 저희는 이런 저희의 희생으로 실습을 하고 있습니다. 출근을 해서도 마찬가지입니다. 저희는 실습을 하면서 많은 것을 배우려고 왔습니다. 하지만 실상은 어려운 노가다 같은 일만 하고 있습니다. 기저귀를 간다던지, 침대보를 간다던지, 쓰레기통을 정리한다던지, 청소를 한다 던지, 등등 여러 가지 일을 합니다. 하지만 저희는 간호학생이고, 물론 저런 일을 할 수는 있습니다. 그렇지만, 배워가면서 해야 하는 거 아닙니까? 솔직히 배우는 것은 많이 없습니다. 그저 하루 종일 서서, 힘든 일만 하다가 옵니다.
간호실습은 문제점이 많습니다. 저희는 일꾼이 아니라 학생입니다.
간호학생에게 좀 제대로 된 교육을 해 주셨으면 합니다. 일꾼으로 부려 먹을 거면, 차비랑 식사비는 줘야 하는 거 아닙니까? 어려운 학생들은 정말 큰 부담이 됩니다. 이왕이면 집 가까운 병원으로 배치해 준다던지 이런 편의를 봐주지도 않습니다. 결론을 말씀드립니다.
코로나로 인한 국가재난 상황에서 아니 국제 재난상황에서 간호학과 4학년의 실습시간은 감하여 주는게 합당하다고 생각합니다.(실습시간 1000시간에서 800시간으로 줄여주세요)
둘째 간호학과 실습시간에서 점심시간 1시간을 제외하는 것은 인권침해에 해당하며, 지금까지 감한 점심시간 1시간도 실습시간으로 인정해 달라는 겁니다.
셋째 간호학과 실습시간에서 지도교수님의 실습시간 외 지도 시간도 실습시간으로 인정해 달라는 겁니다.
넷째 간호학과 실습시간에서 병원은 제대로 된 간호학과 교육을 해달라는 겁니다. 예비인력으로 부려 먹을 거면, 차비랑 식사비랑 제대로 된 인권비의 지급을 요구합니다.
다섯째 국가재난상황에서 간호학생의 무리한 실습을 요구하여 학생들의 건강권을 침해하지 말라는 것입니다.
여섯째 간호학과 학생은 아직 간호사가 아닙니다. 3교대로 실습을 하는거  또한 인권침해에 해당합니다.
 간호학생의 실습은 9시에서 5시까지로 정해진 시간에만 가능하도록 해주십시요.
일곱째 간호학과의 교직반 실습시간도 코로나로 인하여 모든학교가 개학을 하지 않아서 할 수 가 없으니, 교내지도로 대체해 주십시요.
여덟째 간호학생들을 실습함에 있어서 병원은 학생들의 인권에 침해가 되는 언행은 삼가해 주셨으면 합니다.
간호학과 학생들의 실습에 대하여 이상 말씀드렸습니다."
2020-05-11,2020-06-10,보건복지,826,용인**번확진자(이태원클럽확진자) 신상공개 및 강력 처벌을 요구합니다.,"이태원 확진자 개인신상공개 및 강력한 처벌을 바랍니다.

 [본 게시물의 일부 내용이 국민 청원 요건에 위배되어 관리자에 의해 수정되었습니다]"
2020-05-11,2020-06-10,기타,"1,622",SNS n번방과 비슷한 범죄들로 인해 피해자가 없게끔 도와주세요.,"안녕하세요. Twitter(트위터)에서 n번방과 같은 유사한일을 겪은 한 피해자 입니다. 저는 아직 18살밖에 안된 미성년자 즉, 아직 국가와 보호자로 부터 보호를 받아야 할 나이입니다. 그런데 트위터 라는 sns 에서 제 사진중 2장이 ‘****’ 라는 눈을 위로 지켜올린 표정으로 편집이 되어 ‘***’라는 계정에 편집된 사진이 2020년 5월 8일 오후2시경쯤  여성의 가슴을 남성의 성기에 가져다대어 자위행위를 하는뜻을 가진 ‘****’ 라는 성적인 단어와 함께 올라갔습니다. 제사진을 포함한 중학생,고등학생과 같은 미성년자의 사진을 함부로 가져가̆̈ 편집을 하고, 그사진의 주인에게 허락을 맡지않고 딸감소라는 계정에 제보를하고 자료를 공유하며 사람들과 활동을 즐겨하는듯 보였습니다. 그래서 제 사진이 허락도 없이 편집이 되어 유포된 사실을 듣고난뒤 놀란 마음을 뒤로한채 저도 모르는 사람이 저렇게 유포 했다는건 저와같은 다른 피해자들도 있겠다 라는 생각이 들어 정신을 차리고, 지인분들께 그에대한 대응 방법을 생각하고 논의를해 결국 청원서를 쓰고 사람들에게 알리는게 맞다고 생각 했습니다. 아직 보호 받아야할 미성년자가 지금 트위터에서 성적대상이 되고있습니다. 트위터가 해외 어플이라 범인은 잘 못 잡힌다는건 알고 있습니다. 그래도 저와 같은 피해자가 있을게 뻔한데 결과가 뻔하다고 가만히 있는건 아니라고 보여 이렇게 용기를 내서 청원을 써봅니다. 제발 도와주세요.

 [본 게시물의 일부 내용이 국민 청원 요건에 위배되어 관리자에 의해 수정되었습니다]"
2020-05-11,2020-06-10,보건복지,"1,259","코로나19 검사, 치료비용을 코로나19에 대한 대응에 적극적인 사람들에게만 지원해주세요.","코로나19 진료비용을 자진해서 본인이 해당 지역, 건물에 방문했다고 말한 사람(=연락이 닿는 사람)만 국가에서 지원해주세요. 

코로나19 발생 이후 국민들은 생활에 대한 통제부터 시작하여 감염 병에 대한 안전조차 보장받지 못하고 있습니다. 특히 **번 환자를 시작으로 감염자 수는 엄청나게 폭증하였다는 사실은 모두가 알 것입니다.
의료진의 도움으로 최근 확진자 수는 10명 내외로 전에 비해 많이 줄어들었습니다.
조금만 더 아주 조금만 더 이 상태를 유지하다가 코로나 종식이라는 날이 오기만을 기다렸고 강력한 사회 속 거리두기에서 생활방역으로 최근 전환되었을 때 그에 대한 기대는 더욱 높아져만 갔습니다.
하지만 생활 방역으로 바뀐지 얼마 되지 않아 ‘이태원 클럽’에서 다수의 확진자가 발생하였고 지금은 1300명이 연락이 닿지 않아 큰 곤혹을 치루고 있다는 기사를 접하게 되었습니다.
당장 사회에 나가기위해 학교에서 수업을 받아야 하는 저는 제대로 된 교육권 조차 보장 받지 못하고, 더군다나 군인인 남자친구는 안에서 가족과 여자친구 얼굴을 몇 달 째 보지도 못하고 안에서 정신적 고통과 스트레스로 힘들어 하고 있습니다.

문재인 대통령님, 저희의 부모님 그리고 사회생활을 하고 있는 청년들이 내는 세금을 국가 안전에 적극적이지 못한 사람들에게 치료비용으로 사용한다는 것은 돈을 낸 사람으로서 원치도 않고, 다수의 국민의 안전을 보장하기 위해선 접촉자와 연락이 되어야하는데 그들을 찾기위한 돈, 시간의 비용까지 생각하면 돈은 돈대로 많이 들고, 시간은 시간대로 지체 하는 것이라고 생각합니다.

제가 생각하는 방안으로는 현재 이런 상황에 클럽, 노래방, 술집 등(=집단생활)을 오가다가 코로나 위험에 그대로 노출 된 사람들의 경우 일정 기간을 지정해두고 자진으로 신고를 하는 사람은 양성이든 음성이든 검사비용을 국가에서 부담해주고, 원인 지역을 모르는 사람들에게는 그동안의 방식 (음성: 검사비 개인부담 / 양성: 검사비 국가 부담) 체제를 유지하는 것입니다.
그렇다면 원인을 이를 악용하는 사람들도 있지 않겠습니까? 
제가 알기로는 이태원 클럽의 경우 방문자 명단을 작성 하였다고 하는데 그 명단에 있는 내가 뭐라고 적었는지 확인이 가능하거나 그날 방문을 확실시 할 수 있는 증빙자료 첨부를 하게끔 하고, 거짓이 적발 될 경우 큰 금액의 벌금 청구를 하는 방안 등 생활 방역에 노력하는 사람들을 제외한 이런 몰상식한 사람들에게는 더욱 큰 벌과 규제가 이루어져야한다고 생각합니다.
연락이 닿지 않는 사람들에게는 치료비와 검사비용 모두 개인 부담의 비율을 훨씬 늘려 사실만을 말할 수 있도록 체제를 바꾸었으면 좋겠습니다.
체제를 바꾸기 위해선 그만큼 논의되어야 하는 상황이 많다는 것도 알고 있습니다.
하지만 현재 체제는 코로나를 위해 노력하고 있는 국민들을 배제하고 오로지 그들에게만 너무 집중되어있다고 생각합니다.

제발 안전한 모두가 살 수 있도록 해주세요.

 [본 게시물의 일부 내용이 국민 청원 요건에 위배되어 관리자에 의해 수정되었습니다]"
2020-05-11,2020-06-10,외교/통일/국방,648,대구MBC 보도특집 KAL858기 실종사건 방영.. 동체를 수색하여 인양 재 조사해주세요.,"대구MBC 보도특집 KAL858기 실종사건 방영 33년 전 실종된 대한항공 KAL858기 
추정 동체를 대구MBC 특별취재단이  지난 1월 수중촬영해 보도한 바 있습니다. 

KAL858기에 당시 어떤 일이 있었는지 또 그동안 정부는 왜 찾지 못했는지 
숱한 의문을 안고 있습니다. 

.2019년 11월 말부터 2020년 3월까지 4차례에 걸쳐 미얀마 안다만 해역에서 
수색작업을 펼쳤습니다. 

그 결과 KAL858기의 것으로 추정되는 
항공기의 왼쪽 날개와 날개에 붙어있는 엔진, 보조날개로 추정되는 수많은 잔해를 촬영하는데 성공했습니다. 

 https://dgmbc.com/article/4iih1emyuy1

정부차원에서 적극적으로 수색, 인양, 유해발굴, 재조사 해서 유족들의 억울함을 풀어주세요."
2020-05-11,2020-06-10,안전/환경,"2,102",기후변화문제의 심각성을 많은 사람들이 알 수있게 해주세요.,"이 청원은 대통령님께서도 기후변화 문제에 자주 언급을 해주셨으면 하는 바램도 있지만 이 청원이 공론화되어 여러 언론사에서도 기후 변화 문제에 대해 자주 기사를 내주셨으면 하는 바램도 있습니다. 
-
-
지금은 5월입니다. 
여름이 아니라 봄입니다. 게다가 5월의 반도 오지 않았습니다. 
하지만 어떤지역은 온도가 30도가 넘어가며 여름의 날씨를 보이고 있습니다. 
8년 뒤면 지구의 온도가 1.5도 오른다고 합니다. 
또한 26년 뒤면 2도가 오른다고 합니다.
몇년 전에는 영구동토층이녹아 18000년전 화석이 발견됐다고 합니다. 1년 내내 얼어있는 영구동토층이 녹았다는건 심각한 문제라고 생각합니다. 영구동토층에 얼어있던 고대 바이러스들이 함께녹아 사라졌던 전염병이나 새로운 감염병이 유행할 가능성도 있다고 합니다. 
하지만 지구의 온도는 계속올라가고있습니다.

2018년 인천에서 기후변화에 대한 국제회의가 열렸는데 많은 국민들은 이사실을 알지 못합니다. 기사가 크게 나지 않았기 때문이죠. 기온 상승폭을 1.5도로 묶기로 했다는데 이대로 가다간 1.5도까지 남은시간은 8년입니다. 
이 글을 보고계신 언론인분들께  말합니다. 
이번에 6/29~7/3동안 인천에서 열리는 국제회의 내용을 1면기사로 내주세요. 
환경문제와 관련된 공익광고를 자주 내보내주세요.
방송국에서 일하시는 분들 이라면 예능, 드라마등에 출연진들이 일회용품사용을 줄이는 장면을 간접적이라도 내보내 국민들에게 환경문제에대한 경각심이 자연스럽게 심어지게 해주세요.
-
이글을 보고계시는 사람들 모두 본인이 할 수 있는 일먼저 해주새요."
2020-05-11,2020-06-10,반려동물,"3,385",전국에 있는 개공장을 폐지해 주세요,"한 견주로써 부탁드립니다.

4년 전 SBS 프로그램 '동물농장 765회'에서 나온 강아지 공장을 본 국민들은 경악을 금치 못했습니다. 강아지들이 인간에 의해 비위생적이며 비윤리적인 방법으로 교배당하면서 아기만 낳고 있다는 사실이 밝혀졌기 때문이죠. 

그런데 여기서 국민들이 분노한 부분은 한가지 더 있었습니다. 강아지 공장에서 수컷 강아지에게 발정제를 놔 정액을 주사기로 뽑아낸 후 그것을 암컷 강아지에게 주입시키고 수의 자 자격증 없이 불법 제왕절개 수술을 했음에도 불구하고 강아지 공장의 주인을 처벌할 수 있는 방법은 불법 마취제 투입밖에 없었다는 것입니다. 또한 강아지는 강아지 공장 주인의 사유 재산으로 인정돼 강아지들을 구조할 방법조차 없다고 합니다.

최근 영국은 이러한 사태를 막기 위해 현지시간 22일, 영국 정부가 강아지와 고양이의 상업적 유통을 금지하는 '루시의 법'을 발표했다고 합니다. 시의 법이 시행되면 강아지와 고양이 공장은 물론 펫샵에서 강아지와 고양이를 파는 것도 금지되고 강아지와 고양이를 기르고 싶은 사람은 사육자나 동물보호소에서 직접 데려와야 한다고 합니다.

또한 미국 캘리포니아 주에서도 CNN에 따르면 새해부터 시행되는 동물구조·입양법에 따라 1월 1일부터 캘리포니아주 동물 분양업체들의 유기견 등 동물보호소와 비영리 구조단체를 거쳐온 경우를 제외한 개, 고양이, 토끼 등 분양이 금지된다고 합니다.

최근 들어 다시 강아지 공장에 대한 관심이 낮아지고 있습니다. 하지만 강아지들은 여러분들이 분노를 일으켰던 전과 같은 아픔을 겪고 있습니다. 강아지 공장을 완전히 폐지하는 것은 인간을 위해 사는 동물을 위한 최소한의 예의라고 생각합니다. 강아지 공장 완전 철폐를 위한 여러분의 동의를 부탁드립니다.

강아지 공장 폐지에 대해 청원하신 글이 없을까 해서 검색을 해보았지만 결코 많이 없었고, 그 중 동의 수가 모자라 청원 종료가 된 글을 퍼왔습니다. 연락망이나 출처를 남길 방법이 없어 이렇게라도 써봅니다. 저는 견주로써 너무 슬프고 처참한 현실을 알리고 싶습니다. 혹여 보신다면 너그럽게 이해를 해주셨으면 하는 바램입니다 감사합니다."
