start,end,category,count,title,content
2020-05-04,2020-06-03,육아/교육,179,모교가 아닌 교육청에서의 수능 접수가 원칙이 되어야 합니다,"수능은 매년 몇 십만명이 치르는 큰 시험입니다. 
그럼에도 국가자격증이나 공무원 시험과 다르게 카드 결제나 현금 영수증 처리가 되지 않는 시험입니다.
또한 n수생의 경우 주소를 이전하지 않는 한 수능 접수를 모교에서 해야 하므로 수능을 다시 본다는 이유로 원치 않는 눈총을 받아야 합니다.

저는 초등학교에 진학해서부터 고등학교 2학년 때까지 쭉 기초생활수급자로 지내다 저를 홀로 키워주신 어머니께서 재혼하시고 기초생활수급자에서 벗어났습니다.
하지만 고등학교 3학년 당시 제가 진학하고자 하는 대학교의 학비가 비싸다며 니 형편에 그게 가당키나 한지 잘 생각해보라시던 담임 선생님의 말씀에 편부께서 학비를 지원해주시기로 약속하셨다고 대답하니 그러다 ""남이 퍽도 그 큰 돈 주겠다. 설령 준다고 쳐보자. 니 대학 다니는동안 또 이혼하면 니 빚쟁이 되겠네?"" 라고 하셨습니다.
이 말의 현실화 가능성 여부를 떠나 저는 큰 상실감에 빠졌습니다.

그 선생님께서는 현재 제 모교의 교장선생님이 되셨습니다.
제 모교는 총 교사수가 20명도 채 되지 않는 작은 시골 학교라 제가 설령 행정실로 찾아가 몰래 접수를 한다고 해도 금방 그 선생님의 귀에 들어가 비아냥을 사게 될 것입니다. 
올해 수능 접수가 5달 정도 남았습니다.
문재인 대통령님의 열렬한 지지가 필요합니다."
2020-05-04,2020-06-03,일자리,166,택배일을 연결해주는 회사의 두얼굴,"안녕하세요
너무 답답하고 억울해서 아니 그냥 가만히있음 우리같은 피해자들이 줄줄이 생겨날것같아 이곳에라도 글을 올립니다.
저희 신랑은 자영업을하다 너무 힘들어져 일을 접고 다른일도 시도해봤지만 그것마저도 잘안되고 가정생활은 점점 기울어져 붕괴되기 직전까지 갔습니다.
아이를 생각해서 신랑과 다시한번 맘을다잡고 해보자고 하고 취업사이트로 통해 이일저일 알아보는데 택배일이 자기 일한만큼 돈을 벌수있는것같아 택배일을 알아보는데 어떻게 들어가야되는지가 막연하더라구요
택배회사마다 올라온것들이 알아보니 다 하청일처럼 연결회사를 타고 들어가야되더군요
그러다보니 트럭도 캐피탈로 사야되고 시세보단 천만원이나 더 비쌌습니다
저희에겐 손해인줄 알았지만 이일을 시작하는 방법은 그 방법밖에는 없기에 거기에서도 회사를 추려서 젤 피해가 없을것같은 회사를 골랐습니다
몇몇회사들은 돈을 요구하는곳도 있었고 그만둘때 트럭을 저희신랑이 떠안고가야하는 곳도 있었고 그나마 저희 신랑이 괜찮다는곳은 그만두고 싶을때 트럭을 반납하고 처음시작할때 받은 부과세 환급금만 도로 뱉어내면 된다는 조건이였습니다.
이정도면 손해를 보더라도 괜찮다고 판단 계약을 하게되었습니다.
신랑이 혼자가는것보다 내가 증인처럼이라도 가는게 낫다고 제안하여 저도 그곳에 같이 가게되었습니다
신랑은 주변에서 얘기들은것도 있고해서 누구나 말만들으면 아는 택배회사에서 일을 하고 싶어서 얘기했는데 택배당  수수료를 얘기하면서 딴회사를 추천해주셨고 자리가 나오면 연결시켜주겠다는 소리만하더군요
그래서 자리가나면 해주겠지하고 일단 거기서 연결해준 회사에 출근을 해서 일을 시작했습니다
근데 일을 하면 할수록 택배일이 돈을 벌수있는 일이 아니더군요
차값 보험료 세금등 이것저것 떼가는게 많다보니 수족에 남는건 생활비로도 부족했습니다.
그리고 자영업에 속해서 모든걸 본인이 책임져야되는 부분이였고 세금도 너무 크게 나갔습니다.
신랑이 자기가하는 노동강도에비해  아닌거같다고 차값이라도 안나가게 택배일접고 다른일을 하겠다고 그러더군요
신랑이 일을 하는거기에 지켜보고있는데 연결회사와 통화하고 나온 신랑의 얼굴이 너무 어두운거예요
말도 처음이랑 너무틀리고 차를 반납하겠다고하니 계속 몇달 기다려야될수도있다
거기에 차를 반납해도 다른 사람과 공동명의로 들어간다는 어이없는 내용이였습니다.
신랑이름으로 산차에 다른 사람의 이름을 올린다니요
너무 기가찼습니다. 
제가 직접 전화를 걸어 그말이 뭔뜻이냐 왜 처음 그런 중요한 얘기를 안해줬냐니 자기네는 얘기해줄 이유가없다 우리한테 전혀 피해가 가지않으니 법적으로도 공증을받고 절차를 받으니 걱정하지말라더라구요
어려운사람 살려줬더니 보따리 내놓으라는 격이라며 본인이 더 기분 나쁘다는 말을 하시며 상처를 주시더군요
그 전화 끊고 펑펑 울었습니다.
처음 말도 바꾼 사람들이 두번은 괜찮을까요
도저히 이사람들의 말을 믿을수없었습니다.
법적으로하든 말든 맘데로 하라며 큰소리치며 자기한테 전화하지 말라기에 법적인 절차를 밟기전에 일단 여기에라도 
억울함을 올려봅니다.
신랑이 일을하며 알게된 주변 기사님들을보니 저희같이 피해를 안고 어쩔수없이 노예계약처럼 이일을 쭉하시는 분들도 계시고 피해를 안고 이일을 그만두신 분들도 많다고합니다.
더이상은 저희같이 힘없는 사람들이 피해보지않고 일할수있는 세상이 왔으면 좋겠습니다"
2020-05-04,2020-06-03,기타,257,국민의 선택으로 당선된 정치인들에게 부탁합니다. 법률안개정 제대로 합시다.,"일반인들은 종합병원이나 대학병원을 바라볼 때 그 이름 만으로도 신뢰를 갖게 됩니다．
법규상 규정은 아니지만 해당 의사의 말이 곧 법이 됩니다．

본인은 만48세의 대한민국 국민이며 대전시에 거주 중 입니다.
2017년 7월 건강검진결과 아주 양호한 상태였으나 같은해 9월 심근경색이 발병하여 대전시의 ****병원에서 심혈관조영술을 하게 됩니다．　

그런데 신체일부가 퉁퉁하게 붓고 소변에서 다량의 단백질이 검출되니 정밀검사가 필요하다며 신장의 일부를 채취해서 조직검사를 하였고 그 결과 사구체신염 중 미세변화증후군 이라는 자가면역질환으로 판독이 되어서 2020년3월16일 까지 ****병원의 신장내과에서 진료를 하였으며 처방받은 스테로이드와 면역억제제를　복용했습니다．

문제는 이 과정에서 합병증이 발생합니다．

１）대동맥혈전
- 발병이전 해당의사와의 상담내용
왼쪽다리가 저려서 걷기가 불편하다고 하니 사구체신염은 온몸이 부종의 영향으로 찌릿한 통증도 유발함으로　꾸준한 운동만을 권장함．

- 발병이후과정　
흉부와 허벅지를 개복한 후 대동맥을 막고 있는 혈전을 제거하는 수술이며 최악의 경우 수술과정 중 다리절단 및 사망 할 수 있으나 8시간30분 동안 진행된 수술결과 다행히 오른쪽다리의 혈전은 제거가 되었고 왼쪽다리는 혈전이 너무 굳어서 제거불능 입니다．　
이후 오른쪽다리의 허벅지는 감각이 없고 자주 쥐가 나서 자동차운전이 불가능하고 왼쪽다리는 통증이 심해서　보행에 문제가 있으며 추가로 혈관에 혈전생성 방지를 위하여 항응고제인 와파린을 처방받아 복용 중 입니다．

２）급성폐렴
자가면역질환은 발병원인이 명확하지 않기에 면역력에 심각한 문제가 발생하여 각종 질병에 취약합니다. 그 결과 감기환자와의 접촉에도 급성폐렴으로 발병이 가능합니다．
현재는 완치가 되었습니다．

3) 위괘양
- 발병이전 해당의사와의 상담내용
속쓰림 증상을 호소하니 반드시 식후에 약을 복용하라고 함.

-발병이후과정
건강검진과정에서 위암이 의심된다며 조직검사를 하였고 다행히 헬리코박터균이 검출되지 않아 약물치료로 마무리함.

4）골다공증
-발병이전 해당의사와의 상담내용
온몸의 관절에 통증이 심하고 힘이 없어서 병뚜껑도 열수가 없다고 하니 면역력이 약해 근력감소가 원인인 것　같다며 근력강화운동을 권장함．

-발병이후과정
골밀도검사 결과 심각성이 판단되어 주사제와 처방받은 약을 복용 중 입니다．
진료과정 중 처방한 약품에는 다량의 스테로이드가 있습니다.  해당 약품을 장기간 복용하면 흔하게 발생합니다．

심각한 문제는 이후 발생합니다．
증세가 다시 심해져서 코로라19로 각 의료기관이 분주함에도 지인의 도움으로 해당질병에 고명한 의사 3명을 추천받아 자가격리 중인 분을 제외하고 분당***병원으로 2020년3월25일 전원을 해서 대전****병원의 진료기록, 영상물이 저장된CD, 신장조직 슬라이드를 제출하고 진료를 합니다．
그런데 2017년 대전****병원에서 채취한 해당 신장조직의 판독결과가 기존의 미세변화증후군에서 분당***병원은 사구체경화증로 병명이 바뀌게 됩니다．
중 증도는 미세변화증후군 보다 사구체경화증의 심각성이 높다고 합니다．
이후 대전****병원에 대한 저 개인의 신뢰는 사라졌고 해당전문가의 도움으로 그동안의 진료기록을 검토하기　시작합니다．

１）판독오류
신장조직검사결과 사구체경화증을 미세변화증후군으로 잘못 판독함．

２）약처방의　문제점
조직검사의 판독도 문제지만 원칙적으로 많은 양의 스테로이드를 장기간 복용중이라면 의사는 해당약품의 부작용을 설명해야할 의무가 있고  특성상 항응고제를 처방해서 혈전생성을 방지해야 하며  위장의 손상이 쉽게 발생하니 위장약을 처방 하며 칼슘과 비타민을 처방해서 골다공증을 예방해야 하며 면역억제제를 조절하여 폐렴 같은 질환을 예방함이 원칙입니다．
그러나 해당병원 의사의 처방은 원칙과는 달랐으며 스테로이드 과다복용의 부작용으로 인한 추가질환발병 가능성에 대한 언급도 없었습니다．
심지어 대동맥혈전제거 수술15일 후 중환자실에서 벗어나 일반병동에 입원 중일 때 해당의사가 찾아와 의사본인이 항응고제 처방을 누락해서 이런 일이 발생했다며 미안하다고 했습니다．
그런데 그때는 이일이 얼마나 심각한 일인지를 몰랐습니다．
2020년3월25일 분당***병원으로 전원하고 병명이 바꾸면서 해당분야 전문가의 상담결과 심각함을 깨달았고 불쾌한 마음에 대전**병원에 2020년4월13일 방문하여 항의를 합니다．

다음은 대전****병원 해당부서 직원과의 대화내용．
위의 내용을 구체적으로 설명 후 병원측의 답변을 물으니 충분히 우리(병원)의 책임이기는 하지만 우리는 판결문의　결과로 대응을 한다．
또한 신장내과의 해당 의사는 우리병원을 그만 두었다．
결론은 한국의료분쟁조정중재원 또는 한국소비자보호원 등에 정식으로 접수해라 우리는 그 이후 판결문 결과에 따라 대응한다．
그러면서 저의 인적사항을 요청하기에 환자번호와 신분증을 보여주니 기록하더군요.

저는 환자의 몸으로 5명의 의료과실전문변호사와 상담을 진행했습니다．
상담내용 중 공통된 점은 재판에서 절대로 병원을 이길 수 없다．
이유는 이렇습니다．
객관적, 상식적 견해로는 법조인이 아니어도 병원측의 과실이 인정되나 변호사가 법원에 제출할 소장에는 신장학회나 신장내과 전문의의 진료과정에서 부적합한 내용에 대한 의견이 첨부 되야 하는데 대한민국의 어떠한　의사가 참여를 할까요.
또한 누군가의 도움으로 소장을 제출해도 막강한 자본과 법무팀으로 중무장한 대형병원은 대법원까지 항소를 할것이고 기간은 최하 3년이라서 버틸수가 없다고 합니다.

변호사들의 공통된 의견은 현행법규가 재정비되지 않는 한 이런 억울한 사연은 그데로 묻히게 됩니다.
해당 법률이 뭔지도 모르는 저 같은 일반국민들은 방법이 없습니다.
저 말고도 많은 피혜사례가 있지만 다들 포기 한다고 합니다.

대한민국국민으로 태어나 열심히 살아 왔습니다.
아직 젊은 저에 삶의 질은 바닥으로 추락했으며 일상생활도 어렵습니다.  
이 책임은 누구에게 있을 까요?

변호사조차 분명한 가해자와 피해자가 존제하지만 법규상 절차나 해석이 어렵다면 평범한 대한민국의 국민들은 어떻게 대처를 해야 합니까?

이번에 당선이 확정된 국화의원 여러분에게 축하를 드립니다.
제발 해당 법률안 제데로 개정해서 당선된 여러분들께 투표한 유권자들 잘 사는 나라 대한민국이 되기를 부탁합니다.  

본 청원내용은 사실과 다름이 없으며 내용을 읽으신 청와대와 많은 분들의 관심과 동의를 구합니다. 

건강이 회복되면 1인 시위라도 하려 합니다.

 [본 게시물의 일부 내용이 국민 청원 요건에 위배되어 관리자에 의해 수정되었습니다]"
2020-05-04,2020-06-03,보건복지,234,"사이비 종교단체 안에 불법 이민자 색출, 제2의“신천지”,”N번방”와 같이 대한민국에게 위험을 주는 것을 방지를 위해 청원","저희는 종교에 대해 토론을 하지 않습니다. 저희는 오직 국민의 건강에만 관심이 있습니다. 

코로나19가 확산한 원인으로 전세계에서 긴급한 상태입니다.대한민국은 더욱 빈틈없이 대비해야 합니다. 

하지만 ‘*** 교회’와 같이 사이비 종교 단체신도 중에도 수많은 해외 불법 이민자가 있습니다.그들은 정부에서 요구한 교회 그리고 단체 숙소에 대한 바이러스 검진와 소독을 여러 번이나 거절을 했답니다.외계에서 그 안에 무엇을 진행하고 있는지 신도들이 바이러스 중점 지역에서 온건지 그리고 이미 코로나19에 걸린 사람도 있는지를 전혀 알 수가 없습니다.이러한 사이비 종교 단체에 있는 불법 이민자들은 불법으로 일을 하고 편의점에 가서 뭘 사고 대종교통을 이용하기도 합니다.또한 우리 국민들이랑 가까이 접해 코로나19를 전국에서 확산하기 굉장히 쉬우며 국민들의 건강을 엄청난 위험을 주고 있답니다.대구에 있는 ‘신천지교회’보다 훨씬 더 무섭고 은밀한 위험성이 큰 단체입니다. 

게다가 많은 사이비 종교 단체는 주로 여성신도를 기꺼이 발전한다고 합니다.’***교회’는 안 좋은 사건이 여러 번 피로되었습니다.중국홍콩에서 기독교 목사 구금,중국대륙 맥도날드레스토랑에서 입교를 거절한 여성를 때려죽여,중국대만에서 한 여성한테 약을 먹여 교주가 목욕까지 했다고 합니다.”N번방”사건은 인터넷에 있는 어두움이지만 이러한 사이비 종교들은 바로 우리의 주변에 있는 것입니다.심지어 매일마다 그들을 보이지만 그들의 위험성을 하나도 모르고 있었다는 것입니다.

그래서 코로나19를 예방하기 위해,국민들의 건강을 지키기 위해,<대한민국헌법>제19조,제20조,제21조,제26조로 인해 저희는 사이비 종교 단체에 있는 불법 이민자를 철저하게 색출하는 것,그리고 두번째‘신천지’,’N번방’와 같이 대한민국에게 위험을 주는 것을 방지하기 위해 청원합니다.

 [본 게시물의 일부 내용이 국민 청원 요건에 위배되어 관리자에 의해 수정되었습니다]"
2020-05-04,2020-06-03,기타,468,증권 회사의 WTI유가 상품의 문제로 수많은 개인 투자자들이 힘들어 하고 있습니다,"최근 라임사태 및 금융회사의 투자자 기만 행위로 많은 투자자들이 고통의 하루를 보내고 있습니다
저는 ㅇㅇ증권의 WTI유가ETN 상품의 주주로 주식을 보유하고 있으며 증권회사의 말대 안되는 대응으로 
대부분의 투자자는 엄청난 손실을 보고 있습니다
WTI유가 상품의 특징은 유가가 오르면 수익금을 주고 떨어지면 손해를 주는 상품입니다.
민원인은 위상품의 주식을 3.26일 부터 보유 하고 있었으면
일부는 팔고 다시 매수도 하며 거래를 하였습니다. 대체적으로 유가가 떨어지는 상황이였기에
민원은은 위상품으로 손해가 많이 나고 있는 상황이였습니다
사건의 발단은 
4월21일 아침 8시 53분 위상품의 공시 내용은 
ETN가격 1480원 지표가치 889.23원 괴리율66.43% 인 공시와 
4월21일 아침 8시 55분 발행사 보유수량 확보로 괴리 축소 예상 된다는 공시였습니다
그래서 민원인은 4월 21일 민원인이 가지고 있던 평균 가격보다 많이 내려간 상태로 보였고 괴리율도 그정도면 괜찮은거 같아. 추가로 매수하였습니다.
4월22일 아침 8시49분 위상품의 공시 내용은
ETN가격 905원 지표가치 562.4원 괴리율 60.9%의 공시가 났고
민원인은 평균가격을 낮추기 위해 위상품의 주식을 추가로 매수를 하였습니다.
4.22일 주식장이 끝나고 4월23일 ~ 4월24일 2틀동안 거래정지공시가 나왔고 
23~24일 유가는 상승하였지만 거래정지로 팔수도 없는 상황이였습니다
또한 22일 거래정지 공시후 다음날인 4월23일 아침 8시 57분 공시 내용은
ETN가격 650원 지표가치 74.60원 괴리율 771.31% 공시가 나왔고
하루 아침에 괴리율이 10배가 오르는 상황이 벌어졌습니다. 가격이 1/9 가된것입니다.
**은 어떻게 LP 대응을 한것이며 22일 거래는 10배의 가격으로 주식거래가 이뤄 질수 있는지
도무지 이해를 할래야 할수가 없습니다
그로인한 금전적 피해는 이루 말할수가 없습니다.

 [본 게시물의 일부 내용이 국민 청원 요건에 위배되어 관리자에 의해 수정되었습니다]"
2020-05-04,2020-06-03,육아/교육,"4,908","코로나 사태로인해 현저히 떨어진 강의 질, 학교 강의실 비사용 등으로 발생된 차액, 등록금을 환급해주세요.","코로나와 함께하는 2020년은 공허와 마주하는 한 해인 것 같습니다.
아무 것도 하기 싫은 것이 아닌,
하고 싶어도 멀리 있는 공허한 한 해, 그런 해를 살아가는 우리, 대학생들을 대표해 작은 목소리를 내볼까 합니다.

저의 일상을 감히 소개해보고자 합니다.
오늘도 아침에 눈을 뜹니다. 
평소와 다를 거 없는 맑은 아침, 갖은 서적과 짐을 꾸려 학교로 향했을 그런 아침…
저는 기상과 동시에 컴퓨터 앞에 앉아 학교가 아닌 인터넷으로 수업을 듣습니다.
매일이 반복되는 하루, 그저 무기력하기 이루 다 말할 수 없는 하루입니다.
친구들과 즐겁게 얘기를 나누며 그간 있었던 일들을 펼쳐 놓고 얘기할 수 있는, 그런 일상은 없습니다.

반복되는 공장의 톱니처럼, 
매주 월요일, 탑재된 인터넷 강의를 들으며 의미 없는 과제를 일요일까지 수행하고 한 주를 마무리하는 의미 없는, 반복되는 나날들일 뿐….
또 다음주가 되면 다시 강의가 탑재되고 달라지는 것은 없습니다. 
현장에서의 접하는 강의보다 현저히 낮은 인터넷 강의의 질… 그것 만이 지속될 뿐이죠.

“이러한 나날들이 내가 그토록 꿈꾸던 대학생활이었을까…?”

“이러기 위해 거금을 들여서 학교에 입학했을까?”

하루에도 수없이 ‘휴학’이라는 기로에 서서 망설이기만을 반복하게 됩니다.
과연 이게 제가 꿈꾸던, 아니 우리들이 꿈꾸던 대학의 현실이었을까요?

뒤를 돌아보면, 돈 벌어 자식에게 공부시키고 행복해지기만을 바라며 열심히 일하시는 부모님.
앞을 다시 바라보면, 앞으로의 나날, 막막한 미래 앞에 남루해진 제 자신만을 마주합니다.
이런 기대에 못 미치는, 행복할 수 없는 학업을 위해 부모님에게 손 벌려가며 공부하는 제 자신이 너무 죄송스럽기만 합니다.

코로나로 인한 경제불황으로 수입이 줄어드는 것에 한탄하시는 부모님
그런 것에 죄송스러움을 느끼고, 저는 오늘도 공부답지 못한 공부를 합니다.

강의 질 개선을 위해 여러 개선사항 등의 요구에도 달라짐 없는 학교의 인터넷 강의…
과연 이런 강의를 부모님의 피땀 섞인 제 값을 내며 돈으로 들어야 될까요…?

수차례 대학생들은 이러한 문제들로 싸워왔으나 학교 측에선 시원하게 돌아오는 답변은 없습니다.
그저 회의적인, 책임을 부정하는 답변만이 돌아올 뿐이죠.

저희는 이런 부당한 강의의 질의 향상과 이로 인한 정당하지 못한 등록금에 대해 반환을 요구했습니다.
하지만 그 어느 쪽도 개선된 것은 없는 하루입니다.

어떠한 소리, 해설, 강의자료도 없이 ppt만을 넘기며 강의하시는 교수님의 수업

부족한 강의 질을 그저 방대한 과제로 메꿔, 자기주도학습이라는 명분으로 포장하시는 교수님의 수업

집에서 절대 할 수 없는 과제들을 학생들의 입장을 전혀 고려하지 않은 채 내주시는 실기과 교수님의 수업

이러한 수업들이 대부분입니다. 정말 열띤, 만족할 정도의 퀄리티로 저희에게 수업을 해주시는 교수님은 열에 한 분 나올까 한 것이 현실.
저희는 이런 수업을 전액을 내며 들어야 할까요?
수차례 저희는 학교에 등록금 환급에 대해 요구를 했음에도 불구하고 돌아오는 답변은
-----------------------------------------------------------------------------------------------------------------------------------
‘등록금은 교육부 명시된 것으로 고려해봤을 때, 대학 총장의 결정권이며 현재로서는 반환의 법적 근거는 없다.’ 
천재지변일 경우 감액할 수 있으나. 휴업이 아닌 개강 2주연기, 개강연기후 등교수업 대신에 원격수업 진행 중으로 코로나 19는 규정에 명시된 천재지변으로 해석되지 않는다는 본교 입장입니다
지금은 학기가 진행중이라 1학기 동안 온라인수업을 포함해 충실한 교육에 힘쓰고 있고 철저한 방역으로 안전한 캠퍼스를 지켜내는데 총력을 기울이고 있는 중이며 
교육부와 한국대학 교육협의회에서 국가 차원의 해결방안이 나올 것으로 이에 근거하여 등록금 환불 문제에 적극 대처하겠다는 본교 입장입니다. 
------------------------------------------------------------------------------------------------------------------------------------
돌아오는 이런 말들이 전부입니다.
 저희는 어떠한 부분에서도 학교에서 힘쓴 충실한 교육을 느낄 수 없으며ㅡ
심지어 허술한 방역, 차량통행들에 대한 허술한 발열체크, 제대로 체온을 재지도 않고 경우가 대부분인 이 현실, 철저한 방역 또한 절대 찾아볼 수도 없습니다. 

계속된 희망 고문으로 학생들을 괴롭히기만 하는 이러한 대학의 실태를  목소리 내어 알리고자 합니다.
공중 위생과 관련한 긴급 사태로 규정된 코로나를 사회재난이라고 분류하며 등록금환급에 회의적인 입장만 취하는 이러한 모습….. 본교에는 어떠한 책임이 없다고 회피하는 것이 전부입니다.

학생들의 개선사항 요구에도 불구하고 전혀 달라짐 없는 강의를 제공하는 대학에게 요구하기 앞서,
여러분의 도움, 목소리가 간절합니다. 부디 도와주십시오. 또 함께 힘을 실어 주시면 감사하겠습니다.

- 대학생들을 대표해 모든 대학에게 요구합니다. 강의실 비사용으로 인해 발생하는 전기료, 인건비로 인한 차액, 낮은 강의질과 온라인강의로 인해 발생하는 낮은 노동력에 대한 차액, 온라인 강의로 현저히 낮아진 실기수업의 질 등으로 발생하는 차액 등을 고려해 등록금을 감면하고 그에 따른 환급조치를 요구합니다."
