start,end,category,count,title,content
2020-03-29,2020-04-28,안전/환경,634,"재난긴급생활비, 체크카드가 아닌 모바일 상품권이나 종이 상품권으로 지급해주십시오.","일회성 체크카드, 결국 버려지는 플라스틱입니다.

플라스틱 문제가 심각해 사용을 줄이는 방법을 모색하는 판국에 플라스틱 쓰레기를 만드는 체크카드를 만들어야 할까요.

거의 대부분의 가정에 들어가는 체크카드 발급 비용과 수량도 상상을 초월할 것입니다.

경제도 환경도 위기인 시대, 할 수 있다면 환경오염을 줄이는 쪽을 선택해야 할 것입니다.

잠시 사용을 위해 500년동안 썩지 않는 플라스틱을 대량 생산할 수는 없습니다.

재난긴급생활비, 체크카드가 아닌 모바일 상품권이나 종이 상품권으로 지급해 주십시오."
2020-03-29,2020-04-28,육아/교육,821,공교육 영상자료들에 자막을 삽입해주세요,"저는 초등학교 2학년 난청아동을 키우고있는 엄마입니다
저희아이는 2살무렵 인공와우라는 수술을 해서 기계를 통해 소리를 듣고 있습니다
그러나 소리를 전혀듣지 못한 우리 아이가 모든소리를 전자음으로 들으며 언어를 배우는건
모국어도 없이 외국어를 배우는것같이 쉽지가 않습니다
아주느리긴 하지만 기저귀찬갓난시절부터 지금까지 쉬없이 재활해서 지금은 입모양과 소리 상황을 모두 사용하면 그래도 일상대화의 80%는 가능합니다 
작년 처음 초등학교에 입학하며  받아쓰기에 100점 받은것으로 몇달간 만나는 사람들마다 보여주고 자랑하는 일반아이들처럼 칭찬받고싶고 인정받고싶은 보통아이 이기도 합니다

그런데  거의 모든과목 많은시간중 수업중 영상물이 활용되며 이것을 통해 문제를 풀고 대답을 하고 이야기를 파악하는것을 알게 되었습니다
친구들이 그것을보고 웃을때 함께웃지 못하고 대답할때 영문을 모르고 고개숙였을 아이를 생각하니 마음이 아팠습니다
만약 자막이 있었다면 같이 대답할수 있고 친구들 속에 혼자 좌절의 경험을 격지 않앟을텐데 라는 생각에 가슴이 아픕니다

티비나 전화기 같은 전자음을 다시 전자음으로 듣기에 재활이 아지 진해중인 초등하교 아이들에겐 
영어기초단계 아이에게 원어민강사의 유창한고급영어강의를 틀어주는것처럼 스스로 할수없는 일입니다

곧 온라인개학이 준비된다는 뉴스를 볼때마다 마음이 답답합니다
개학이 연기되며 학교측에서 전달해주시고 권해주시는  교육자료(ebs온라인 교실, e-학습터 등)어디에도 어떤과목에도 자막을 찾을수가 없었습니다
지금제작되고있을 자료들에 청각장애 아동들을 위한 자막이 고려되고 삽입되어지고 있는지 믿음보단 걱정과 불안이 앞섭니다

입학후 한달이 채 되지 않았을때
함께 저녁먹다
""엄마 왜 나는 소리가 안들려
엄마랑 형아는 소리있잖아
나는 왜 없어""
라며 조용히 울먹이던 아이얼굴이 이번 온라인개학 소식에 자꾸 떠오릅니다

누구나 교육받을권리
그러나 그 누구나에 속하지 못했으나 너무 어려서 도움조차 구하지 못하고 혼자 좌절을 격었을 난청 아동들 위해
어렵더라도 번거롭더라도 
국가의 공교육에 사용되는 영상교육자료에 자막을 넣어주시기를 간절히 요청합니다

장애아동들도 배움에 대한 열정은 다르지 않습니다
처음 사회속에 함께하는 초등입학해 잘 생활하는것이 
저희 장애아동을 키우는 부모와 아이들에게는 사회로 나가는 첫 발걸음이기에 너무도 떨리고 긴장되는 일입니다
이를 위해 막 수술한 돌지난때부터 입학전까지 몇년간  있는힘을 다해  재활에 정말 모두재정과 에너지를 다 쏟고 보내는것입니다
자신을 다름을 알지만 용기를 내서 사회로 나가는 우리아이들이 웃을수 있고 꿈을 꿀수있게 소외되었던 영상수업자막 부분을 해결해 주시기를 다시한번 간절히 요청합니다"
2020-03-29,2020-04-28,육아/교육,"1,385",초등학생 부모도 세금 냅니다..초등학생에게도 긴급 수당 지원해 주세요,"만 7세 아동에게 양육수당 외 추가로 긴급돌봄수당이 상품권으로 지급된다고 합니다..
학생들도 가정에서 돌보긴 마찬가지입니다..
왜 자꾸 어린 자녀들에게만 지원을 하고 초.중.고 학생들은 대한민국 자녀가 아니랍니까??
똑같이 세금냅니다..
어린 자녀 못지 않게 양육비 많이 듭니다
왜 자꾸 차별 당하는 것 같고 대한민국 국민이 아니라는 느낌이 들까요
만 7세 지원 수당을 미성년 학생들이 있는 가정에도 골고루 받을 수 있도록  지원을 해 주기를 청원합니다!!"
2020-03-29,2020-04-28,육아/교육,"2,058",코로나로 인한 개학 연기와 관련하여 청원드립니다.,"안녕하십니까?
경남 창원시에서 근무하는 초등교사 장**입니다.
현재 논의되고 있는 코로나 확산으로 인한 초중등학교 및 유치원의 개학 연기와 관련하여 청원드립니다.
먼저 지금 현재 교육부에서 추진중인 온라인 개학은 많은 문제점을 갖고 있다고 생각합니다.
첫째, 온라인 학습은 인터넷이 안되고 와이파이도 안되고 컵퓨터도 구비되어 있지 않은 아이들은 학습 활동이 거의 불가능합니다. 이로 인하여 교육 기회의 불평들을 야기할 수 있다고 생각합니다. 아울러 그 아이들에게 학습 환경을 구비해 주는 것도 간단한 문제가 아니라고 생각합니다.
둘째, 초등학생 특히 초등학교 1,2학년 아이들의 경우 직접 눈으로 보고 손으로 만져보고 조작해 보는 활동이 대부분이라 인터넷 수업으로 제대로 학습을 할 수 없습니다.
셋째, 예체능 교과의 수업은 거이 불가능하며 친구들과의 토론, 토의 수업 등은 아예 할 수가 없을 것입니다.
그  외에도 여러 가지 문제점들이 있다는 것은 잘 알고 있고 모두가 인정할 것입니다.
다만 어쩔 수 없으니까 온라인 수업을 생각했으리라고 봅니다.

이상의 여러 가지 문제를 해결할 방법으로 다음의 내용을 청원드립니다.

1. 아이들의 건강이 가장 중요합니다. 온라인 수업은 아이들에게 부실한 교육을 제공할 것이 뻔합니다.
     따라서 온라인 개학은 하지 말고 
    코로나 19가 완전히 종식될 때까지 개학을 2~6주 또는 그 이상이라도 연기했으면 합니다.
   그렇게 하여 코로나가 완전히 잡혔다고 판단될 때 개학할 것을 제안합니다.  
2. 여름방학과 겨울방학을 각각 15일 정도씩 줄여서 운영했으면 합니다.
3. 그 대신 앞으로 몇 년간 한시적으로 한 학년도를 11개월로 운영할 것을 제안드립니다.
     예를들어
    올해 5월 1일에 개학한다면
   2020학년도는 2020년 5월 1일부터 2021년 3월 31일까지 11개월
   2021학년도는 2021년 4월 1일부터 2022년 2월 28일까지 11개월
   2022락년도부터는 3월1일부터  2023년 2월말까지 1년간으로 정상화
   물론 안타깝게도 코로나 종식이 늦어져서 올해 개학이 6월이나 7월로 연기된다면  
  3월 1일부터의 정상적인 학교 운영도 1~2년 연기되겠죠?
  앞 2항에서처럼 여름 겨울 방학을 15일 정도 줄이면 한 학년도를 11개월로 운영할 수 있고 학생들에게는 방학이 조금 줄어들 뿐 수업일수를 줄이지 않아도 되고 큰 혼란은 없을 것으로 판단됩니다.
4. 유치원부터 대학까지 모든 학교가 이 방식대로 학사일정을 통일하고 수학능력시험도 일정을 맞추어 1년에  한달 정도씩 조절해 나가면 큰 혼란 없이 연착륙이 가능하지 않을까 하는 생각입니다.
대학이나 고등학교를 졸업하고 난 후 취업 문제는 또 그렇게 몇 달 미루어지는 거니 큰 문제는 아니라고 봅니다.

다만
이 과정에서 교원들의 정년이 학기와 맞지 않는 문제로 학년말을 1~3개월 앞두고 담임이 교체되는 등
해결해야 할 문제들은 있을테지만
그런 문제는 엄중한 상황에 사회적 합의로 학년도에 맟춰 퇴임할 수 있도록 특별버 등으로 해결할 수도 있으리라 생각합니다.
아울러 
이러한 방안이 법령을 고쳐야 하는 문제인지 등은 다각도로 검토가 필요하리라고 봅니다.
그렇지만 제 짧은 소견으로는 
그래도 이 방법이 좋겠다 싶어 청원드립니다.
이 방법이 괜찮다고 판단된다면
다음주에 일단 개학 연기부터 결정해 두고 차근차근 준비해도 되리라고 봅니다.
아이들의 건강과 학습권을 모두 보장할 수 있는 좋은 방법이라 생각되어 청원드립니다.
검토를 부탁드립니다.
감사합니다.

 [본 게시물의 일부 내용이 국민 청원 요건에 위배되어 관리자에 의해 수정되었습니다]"
2020-03-29,2020-04-28,보건복지,"9,621",재난지원정책 차별지급 반대합니다,"지금 코로나19로 대한민국에서 안힘든 사람 
단 한명도 없을것입니다
모두가 예상도 못했던 힘든 시기에
소상공인, 직장인, 주부, 프리랜서, 학생들
어느하나 하루하루 버티기가 힘든 시기입니다
정부를 비롯해서 지자체에서 각종 재난소득 관련해서 
정책들이 하나둘씩 쏟아져 나오고 있는데
그 정책들로 인해 국민들이 얼마나 실의에 빠져있는지 아십니까?

먼저 재난소득 관련해서 소득기준으로 책정하여 지급한다고 하는데 대한민국에서 맞벌이하며 외동아이 (2012,2월생으로 아동수당제외됨) 키우는 인천의 평범한 시민입니다
역시나.. 이번에도 제외입니다
7세미만 아동들은 아동수당에 이번 재난지원까지 겹쳐서
지원을 받더라구요?!
초,중,고 아이들은 안먹고 안입고 안쓰나요?
겹치기 지원받는 집도 있는데 1원 한장 못받는 집이 허다합니다
대체 30~50대 7세이후로 키우고 있는 부모들은 
안힘든줄 아시나요?
정말 미치게 힘듭니다
그런데 이번 정책에서도 예산 부족으로 초등학생은 제외시키고
지자체에서도 소득기준으로 제외입니다
지금까지 단 한푼의 돈도 탈세없이 세금 따박따박 냈습니다
그런데 돌아오는건 지자체에서 주는 일회용마스크 6장(1인당2장) 뿐입니다
해도해도 너무하다는 생각 안하시나요?
10만원 20만원 못받아서 화가나는게 아닙니다
대체 무슨 기준으로 차별지급을 한다고 해서 이 분란을 만드십니까
지금 국민들이 맞벌이vs외벌이, 전업맘vs워킹맘, 경기도 외 다른 지역, 모두가 이 재난소득지급때문에 서로 싸우고
의견이 분분합니다
안그래도 힘든데 꼭 이렇게밖에 정책시행이
안되나요?
너무 억울한건 벤츠타고 다니고 전세살며 몇십억 자산 있는 사람이 재산이 안잡힌다고 아동수당받고 경기도 동탄에 산다고 재난지원도 받는다네요
이런건 제대로 알고나 시행하시나요
너무 화나가고 억울해서 대한민국에게 실망하고 있습니다
왜 열심히 아이키우며 살아가는 국민에게는
더 열심히 해라 더 세금내라 하면서
어떤 응원의 도움은 주지 않는 것입니까?
열심히 사는 중산층도 아닌 그냥 평범한 중하층은 그냥
소처럼 땅보며 일만하고 세금만 낼까요?
재난소득지원 차등지원에 반대합니다
선별적 지원이 아닌 
지자체의 모든 예산과 국비를 합쳐서 
100만원 아니라도 상관없습니다
단 10만원씩이라도 모든 국민에게 지급해주십시요"
2020-03-29,2020-04-28,육아/교육,929,형평성 문제만 야기시키는 긴급아동수당 비용보다는 더 필요한 곳에 써주세요,"아동의 사전적 정의는 유아기와 청소년기의 중간
즉, 만 6세이상 12세 까지의 어린이를 말합니다

그런데 이번 코로나 사태로 인하여 
지급하는 긴급아동수당은 이 아이들을 위함이 아닌
이미 매월 아동수당이라는것을 받고 있는 만 7세미만의
아이들에게 지급을 한다고 하시더군요

긴급아동수당을 지급하시는 목적이 무엇입니까?

지역 돌봄시설인 다함께돌봄센터, 청소년방과후아카데미, 지역아동센터에서는 필수 운영시간을 중심으로 총 8시간 이상 돌봄을 제공한다. 전국 276개소 공동육아나눔터를 한동안 돌봄시설로 전환한다. 긴급돌봄이 필요한 가정에는 무상으로 서비스를 제공한다. 나눔터에서는 아이돌봄서비스 아이돌보미, 품앗이 참여부모, 자원봉사자를 활용해 돌봄을 제공한다. 안전을 우려로 돌봄교실을 꺼리는 일이 없도록 소독과 방역은 수시로 실시하기로 했다.도시락 준비에 따른 학부모 불편을 해소하기 위해 긴급돌봄에 참여하는 학생에게는 점심식사도 제공한다. 비용부담을 느끼지 않도록 아동수당 지급 대상자 263만명에게는 4개월 동안 매달 1인당 10만원씩의 '지역사랑상품권', '온누리상품권'이 추가로 지급된다.

교육부와 전국 시·도교육청에는 긴급돌봄 지원센터를 설치한다. 학부모들의 목소리를 듣고 현장을 점검하는 역할을 맡게 된다.

라고 되어있던데요

정작 필요한 아이들에게 혜택을 주시는게 아니라
굳이 중복으로 주시는 이유는 무엇인지요?
솔직히 만 8세 이상의 아이들은 아동수당이라는게 생겼어도
혜택한 번 못 받아본 아이들입니다
이런식으로 긴급자금을 사용하고 나중에는 또 공평하게 세금을 걷으시겠지요?

아동의 의미를 정확히 파악하셔서 제대로 수당을 지급하실게 아니라면 괜한 불평등을 야기시키는 긴급아동수당은 차라리 저소득층이나 더 필요한 곳에 사용해 주셨으면 좋겠습니다"
2020-03-29,2020-04-28,일자리,614,주휴수당 폐지,"주휴수당 폐지를 요구합니다.
쪼개기알바도 힘들고 고용주도 힘듭니다.
받지않을테니 시간길게 해달라고 해도 끝나면 말바꾼다고 안된다고들 하십니다. 결국 쪼갭니다 일주일에 4곳...이동시간에 교통비에 누굴위한 수당인지 모르겠습니다.

주휴수당지급이 여러가지 알바를 경험해보아라에 목적이 있는게 아니라면 폐지 되어야 한다고 생각합니다.
아니면 지급거부 쌍방합의서 이런거라도.."
2020-03-29,2020-04-28,육아/교육,"7,015",보육료결제를 어린이집에서 할수 있게 해주세요,"안녕하세요
어린이집에 몸담고 일하고 있는 교사입니다 .
잠깐이었지만 원장도 했었고요.
현재는 어린이집을 이용하고 있는 원아들은 11일 이상만 등원하면 부모님이 보육료 결제를 하게 되어있습니다.
그보육료로는 어린이집운영과 교사인건비로 모두 다 사용되고 있습니다.
그런데 보육료결제가 제때 이루어지고 있지 않는 부모님들이 많아 교사인건비를 원장이 차입을 넣고 급여를 입금을 하고 다시 차입을 회수하는 일이 빈번해지고 있으며 그마저도 차입을 회수하지 못하는 일도 많습니다.
간혹 몰지각한 부모들은 퇴소를 하면서 보육료 결제를 하지 않아 그것마저도 회수가 되지않고 있어 어린이집운영에 굉장한 차질을 빚고 있습니다.
그리고 지금처럼 코로나로 인해 등원을 하지 않는 원아들이 많아짐에 따라 보육료결제가 이루어지지않는 일들이 많고 부모님들이 보육료를 결제하는대신 양육수당을 요구하는 사례가 생기고 있습니다 물론 불법이라 할수없다 말하고 거절을 했지만 그럼 양육수당을 받겠다고 퇴소를 요구하고 본인부담금 만큼의 보육료를 결제 하지 않는 일이 생겨버렸습니다.
엄마들 지역카페를 보다보면 어린이집에 아이를 보내면서도 나라에서 지원해주는 보육료를 내돈인냥 아까워하고 그마저도 원장과 딜을 하려고 하는일들이 생기고 있습니다.
원아 한명 한명이 어린이집운영에 크게 반영되는 만큼 원아가 퇴소를 하게 됨으로 안그래도 어려운 실정에 운영은 더욱 어려움을 격을수 밖에 없게 됩니다.
보육료결제가 제때 되지 않음으로 차입이 어려운 상황에선 교사 월급 또한 늦어질수 밖에 없고 이런 상황이 지속된다면 일을 하는 교사의 능률도 떨어질뿐 아니라 원장 또한 교사 눈치 학부모 눈치를 봐야하는 상황이 벌어지고 있습니다.
이런상황들이 개선이 되려면 유치원처럼 원에서 보육료 결제가 이루어짐에 따라 교사도 원장도 급여로 인해 서로 힘들지 않고 운영 할 수 있을것이라 생각됩니다.
보육료결제를 부모가 하는것이 아니라!!
 매달 구청에 등원 원아를 보고하고!!
 보조금 신청후 보육료를 받도록!! 개선해주실것을 강력히 요청합니다.!!"
2020-03-29,2020-04-28,육아/교육,"6,119",교육청의 온라인 화상 원격수업료70% 가이드라인 철회를 요구합니다,"초중등 영어학원을 운영중인 원장입니다. 
오늘 교육청 공문을 보고 참담함에 참지 못하고 청원올립니다. 

전염병 확산을 막기 위한 사회적거리두기 좋습니다. 
2월 마지막주부터 휴원하여 지금 5주째이고 
다음주까지 6주간 휴원 예정입니다. 

4주동안 중등은 원격화상수업을, 초등부는 온라인 숙제 검사를 해왔습니다. 
공교육에서 아니 이 결정을 내린 교육부에서
 화상수업을 직접 실행해보시고 
이런 가이드라인을 학원가에 내렸는지는 잘 모르겠지만  
화상수업이 그렇게 만만한 수업이 아닙니다. 
프로그램 설치부터 집중도 체크, 숙제 검사 등등
현장에서의 지도라면 5분만에 끝날 일도 
화상을 통하다보니 길어지고 초기 적응시에 피로도가 매우 높습니다. 
어쨌든 학생들의 학습 결손을 막고,
 선생님들 실업사태를 막으려고 
이리뛰고 저리뛰며 한달 겨우 벼텼더니  수업료를 70%청구하랍니다. 
도대체 어느나라에서 수강료를 후불로 청구합니까? 
등록금도 후불입니까?
그렇게 70%만 받아도 될 온라인 화상수업이면 
그 수많은 대학들과 초중고 에서 
지난 6주간의 휴교 사태에 왜 진작 온라인 개학으로 대처하지 못했는지 묻고 싶습니다. 
유투브를 봐라 EBS를 봐라
이 와중에 교과서 받으러 학교를 와라

대학들부터 사이버 강의로 전환한 곳들은 등록금을 70%로 환불하시죠? 
아 대학들은 국가 보조금으로 버틸수 있겠군요
학원들은 세금 안냅니까? 
나라에서 운영비 보조해줍니까?
 착한 임대인 운동 우리 건물주랑 상관없으면 
먼나라 이야기입니다. 
나라에서 자영업자 무너진다고 대출신청된다길래 2월27일 달려가서 대출신청했습니다. 

이제 심사중이라고 연락왔습니다. 연매출 3억미만 5인이하 사업장 백만원지원해준다고 합니다. 
연매출3억이상 5인이상 사업장은 코로나가 비켜갑니까?
지금 이시점에 힘들지 않은 곳이 어디있습니까? 
5인 이상이어도 선생님 학원이 어렵습니다 그만두세요 소리는 차마 할수가 없습니다. 


무엇보다 원격으로 화상수업을 선택한 제1의 이유가 무엇인줄 아십니까?
이게 바로 사회적 거리두기의 실천이었습니다. 
불안한 마음에 무리해서 등원시킬까봐 
수업준비 피로도는 높지만 국가적 위기 상황이니 협조하려 했습니다. 
협조하면 머합니까?
학원 문 열고 진도나갈테니 등원 원하시는 어머님들은 등원시키세요라고 
공문 보내는 것이 훨씬 현명했겠구나 싶습니다. 
우리나라는 시장경제의 원리를 따르지 않나요?
사교육은 철저하게 경쟁구도입니다. 
회비 값을 못하면 바로 버려지는게 학원이지요.
지금의 이 사태에서도 시장경제의 원리에 따라 
온라인 화상수업이 불만족 스러우셨다면 그만두실 어머님들은 그만 두신다고 생각합니다. 
그걸 교육부가 나서서 수강료 제한을 정할 정도로 
교육부가 한가한지 묻고 싶습니다. 
공교육 정상화부터 해결하셔야 하지 않을까요?
사교육에서 지금 화상수업해 본 학생들은 
공교육에서 줌을쓰든 구글 클래스룸을 쓰든 
그 적응이 훨씬  빠르리라 생각합니다. 
좀 더 큰 그림을 보시고 
지금은 공교육 사교육을 나눌때가 아니라 
학생들의 수업 결손을 막기 위해 
같은 방향을 보고 나가야할때라고 생각합니다. 

교육부의 탁상공론은 정말 없어져 한다고 봅니다."
