start,end,category,count,title,content
2020-09-16,2020-10-16,농산어촌,201,경북 경주시 감포읍  해상 공원  앞  잠제(물에 잠긴 제방)를  신속히 설치해 주십시요,"존경하는   문제인  대통령님께
국정을   수행하시느라   노고가  많으십니다.멀리  경주에서도  대통령님과  국정  수행하시는 분들을   위해 메일 매일 기도하고  있습니다.
청원을 드리는  것은  이번  태풍  마이삭과  하이선으로  해상공원에   파도가 범람하여서  수십채의 가옥이  침수 되었고  담장의 파손과 가옥 파손등  이루 말할 수없는  피해를 입었습니다.
해성 공원은  조형물이   바다로 떠내려가는 등의   피해도  많았습니다.
걱정되는것은   잠제 설치가  안되면   내년에도  또 다음해에도  매년  집이 침수되고 고원은 헤손될 것입니다.
국민의  혈세가  낭비되는(2018년  태풍 콩레이가 왔을때도  공원  정비만 하였지 근본적인  대책인  잠제 설치는  묵살 되었습니다)  과정을  되풀이 하여야   되겟습니까?
부디  이곳 주민들이  정부를 믿고  생업에  종사할 수  있도록  신속히 잠제를   건설해 주십시요.
경북 경주시 감포읍 동해안로 2233에서 채성헌 드림"
2020-09-16,2020-10-16,행정,255,"교원, 시도 간 일방전입 확대를 추진해 주세요.","먼저, 코로나 19로 인해  수많은 민원처리와 교육 안정화를 위해 노력하시는 교육부 모든 분들께 수고와 감사의 말을 전합니다.

작년 교육부에서는 별거 부부를 위해 시도 간 일방전입을 확대 추진하겠다고 했습니다.

현재 별거 중인 부부 교원이 많고 일대일 동수교류를 원칙으로 시도 간 교류가 아주 어려운 실정입니다. 적게는 몇 년 많게는 몇 십년을 기다리고 가족과 떨어져 지내는 선생님들이 계십니다.

저 역시도몇 년째 별거 생활에 어려움을 겪고 있습니다. 동수교류를 원칙으로 기다려야 한다면 앞으로 몇 년을 더 기다려야 하는지 알 수가 없습니다.

이 제도(동수교류원칙)는 주말 부부의 어려움을 겪고 있는 많은 교원의 사기를 떨어뜨리고 가정의 불화를 만들어내는 제도라 생각합니다. 시도교류를 희망하는 교원을 위해 제도의 개선이 필요해 보입니다. 무조건 일방전입을 받아야 한다는 것에 문제가 보이지만 각 교과별로 희망자에 한해 한 명씩이라도 자리를 열어둔다면 자신이 몇 년을 기다려야 아는지 알 수 있을 뿐만 아니라 희망이라는 기대하고 충분히 인내하고 기다릴 수 있다고 생각합니다.

작년 교육부 장관님께서는 이 제도의 문제점을 인지하시고 해소에 약속을 주신 거로 기억합니다.

올해 코로나로 인해 많은 어려움이 있으시겠지만, 소수의 어려움도 알아주시고 제도를 개선해주는 데 관심을 가져주셨으면 합니다."
2020-09-16,2020-10-16,보건복지,256,"코로나바이러스감염증19 최선의 예방책...!!! 대한민국 인구 5,178만(51,780,000)명 전국민을 정규적으로 검사하게 하여주세요","코로나바이러스감염증19 (일명;코로나감염) 의 감염... 참 듣기만 해도 소름끼치고 두려운 일이다. 이 코로나감염이 진정 우리 자신인 나에게 다가 왔을 경우에 코로나감염자는 많은 자괴감 과 패닉상태 에 휩싸이고 코로나감염자 가족은 물론 코로나감염자 와 접촉한 모든 사람들은 가족으로서의 안타까움은 물론 감염우려에 대한 엄청남 스트레스를 받고 있다는 사실을 체험한지 우린 오래입니다.

통계청 자료에 따르면 2019년 11월 1일 기준으로 실시한 2019 인구주택 총조사 결과 대한민국 인구는 5,178만(51,780,000) 명이며, 이중 전체 인구의 50.0% 인 약 2,589만 명이 서울/경기/인천 등의 수도권 인구를 차지하고 있습니다.
그중 코로나감염선별진료를 통하여 검사한 국민의 수는 2020.9.13. 현재 2,143,270 명 입니다. 
나머지 대다수 국민 49,636,730 명은 과연 내가 비 증상 감염자 인지,증상 감염자인지 쉽게 판단할 수 없다는데 에 불안하고 두려운 상태에 계속적으로 처해있다는 것에 큰 문제가 있습니다.
대한민국 최초로 코로나감염자 가 발생된 1번 확진자 는 지난 2020.1.19 신종 코로나바이러스 발원지인 중국 우한에서 인천공항으로 입국하다 발열 증상이 있어 인천의료원에 격리돼 치료를 받았었습니다.


그로부터 무려 약 8개월 여가 조금 안된 지난 2020.9.13. 현재 22.285 번째 확진자가 발생되었고, 그중 사망자가 363 명이 저세상으로 간 현실이 되어버렸습니다.

정부의 방역관리는 지난 8개월 동안 질병관리본부 및 그 관계기관 과 조직원들과 감염환자를 직접 진료하는 의료인력(의사,간호사,임상병리사,방사선기사등)들 이 아주 열심히 감염환자를 돌보고 뛴 결과로 다른나라 보다는 많이 방역관리가 되고 있습니다.
지난 8일 질병관리본부에서 질병관리청으로 승격된 정은경 질병관리청 청장은 14일 기념식에서 ""엄중한 시기에 질병관리청 초대 청장을 맡게 돼 무거운 사명감을 느낀다""며 ""국민의 신뢰와 기대에 부응해 코로나19 극복을 최우선 과제로 추진하겠다""고 말했습니다.

그녀는 아주 열심히 코로나감염을 방역관리 하는 수장으로서 혼신을 다해온 공무원의 본보기 입니다. 그럼에도 불구하고  너무나 많은 국민들이 잠재적으로 코로나감염 가능성을 두고 있어 그야말로 감염방지를 위한 방역관리의 한계는 그녀의 한계를 넘나들며, 코로나바이러스의 횡포가 무풍지대로 판치고 있는지 오래입니다. 


실례로 전 국민 51,780,000 명을 기준으로 지난 2020.9.13. 까지 코로나감염검사를 받은 국민은 전 국민의 5% 도 안되는 4.14% 인 2,143,270 명에 한한다는 충격적인 사실입니다. 과연 100 명중 5명 밖에 안되는 사람에 대한 검사를 통하여 전 국민 의 예비적 방역관리가 통제될 수 있느냐 는데,  의문을 갖지 않을수 없습니다. 코로나감염 가족 확진자의 경우를 보면 내가족(부부,자녀,엄마,아빠,형,오빠,누나,동생 등)이 설마 코로나감염의 양성판정가능성을 가졌냐는 의심보다는 평소처럼 가족의 신뢰상태에서 자연스럽게 집안에서 마스크를 쓰지 않은 상태에서 주방에서의 식사와 음료, 거실 등에서 의 담소를 마스크를 하지 않는 상태에서 자연스럽게 가족이기 때문에 무조건 믿고 대화 한다 는 사실인데, 여기서 코로나양성감염자가 있을 경우 가족모두가 감염된다는 사실이며 실례로 확진자의 20% 가량이 가족중심으로 확진을 받았다는 사실로 정작 마스크는 집안에서 써야한다는 것입니다. 식사시간을 제외하고는 집안에서도 마스크를 사용하고 생활하는 것이 코로나를 이기는 지혜의 한가지 일 것입니다.
청원인은 실제 코로나감염방지를 위하여 10박11일 동안 집안에서 식사와 세면시간 외는 수면시에도 마스크를 착용하고 생활하여 보며 산소포화도(참고내용 참조)를 측정한 결과 혈중산소포화도가 정상범위인 98을 유지한다는 것을 발견할수 있었던바, 가정에서의 마스크사용은 꼭 필요하다 할 것입니다


우리는 코로나감염을 관찰하면서 미국의 산불이 급속화하는 진화를 위하여 숲을 볼수 있는 헬기를 타고 나무와 주변을 관찰하는 지혜를 가져야만 할 것이다. 땅에서 산불로 인한 나무만 바라본다면 아무런 해결책은 나오지 않을 것 이라는 사실을 잘 알고 있습니다. 지난 8.15 광화문집회(경찰추정 약 20만 명 참석) 에서만도 누적 확진자는 무려 565명 이다. 사랑제일교회 관련 확진자만 해도 1,000명을 넘어섰고 아직도 2,000여 명 이상이 검사를 거부하거나 연락이 두절된 상태입니다.
과연 나머지 집회참석자 19만 여명이 제대로 검사를 받았느냐 도 문제입니다.
참으로 심각한 문제가 아닐수 없습니다.

그렇다면, 우리 국민 모두는 자신의 코로나감염 여부를 꼭 확인하여야 보아야 합니다. 무증상이라고 지나칠 문제가 아닙니다. 검사를 할 경우 전국 지자체 보건소의 검사는 무료이지만, 일반병원의 경우 진찰료 62,960원 에 검사료 76,950원 하여 139,910원 약 14만원 가량이 나옵니다. 보통검사결과는 하루만에 나오고 음성 일경우는 문자로 , 양성(감염자)일 경우는 전화통화로 결과가 오는 것이 통례입니다.
여기서 중요한 점은 국민부담금 을 줄여야 한다는 사실입니다. 가뜩이나, 코로나사태로 인한 영업부진 등으로 대다수의 생업종사자나 중소영세사인들 과 기업들이 수익이 없기에 14만원의 검사비 는 부담으로 다가옵니다.
국민보건 및 건강을 위하여 정부는 마땅히  이 비용을 부담하여 국민의 불안을 잠재워야 합니다.



전국민을 단 1회씩 정규적으로 검사하여 관리할 경우 약 7조2,500 억 이라는 예산이 쓰여질수 있습니다. 대통령님 과 당정 과 야당은 최우선으로 이를 예산으로 집행하는데 촉각을 곤두세워 실행하여야 합니다. 소잃고 외양간 고치는 일이 없어야 합니다. 우리 주위에 얼마나 많은 깜깜이 환자가 많은지 와 감염 자각증상이 있어도 코로나 확진감염자라는 명명이 두려워 숨기는 환자도 많은지를 간과하여서는 안될 것입니다.

혹자는 그 많은 예산을 어떻게 충당할 수 있느냐고 반문할 수 있습니다. 
오직 국가가 모든걸 부담한다면 도대체 국가예산엔 한계가 있는데, 어떻게 하느냐는 나라를 위한 마음의 의혹일 것입니다.
그러나, 우리 대한민국의 국가경제는 결코 나약하지 않습니다. 해결방법은 확실합니다. 국채를 발행하여 충당하여야 합니다. 국채는 이자가 없습니다. 필요치 않은 예산을 물쓰듯 쓰는 것보다는 국민건강을 최우선으로 하여야 하는 것이 대통령님 과 당정의 몫입니다.
제대로 나라 살림살이를 쓰는 것 또한 국가발전의 원동력이 되는 길이고 코로나 방역성공이 경제활성화 와 국민에게 용기를 주는 큰 계기가 될 것입니다.

이제, 결단만 남았습니다. 민주주의 주인인 국민을 살려내느냐. 아니면 나라살림살이 때문에 고민하고 야댱의 반대로 해결하지 못하냐를 결론 내릴때입니다.
그리고 한번 결정되면 밀고가야 합니다. 그것이 정치라고 생각합니다.

코로나바이러스감염증19 최선의 예방책...!!! 대한민국 인구 5,178만(51,780,000)명 전국민을 정규적으로 검사하는 것 만이 답입니다...!!!
다시한번 청원인은 마스크를 단단히 갈아끼며, 대한민국 모든국민이 정규적인 코로나 검사를 통하여 국민각자의 건강을 지키는 안전함을 생각하며 행복한 일상에로의 복귀를 그려보았습니다. 대한민국 화이팅 입니다.

*산소포화도*"
2020-09-16,2020-10-16,일자리,987,"고위험시설12종 사각지대 (GX)류 스피닝 , 줌바 등 GX강사(프리랜서) 도와주세요","안녕하세요.
현 스피닝강사(프리랜서)입니다.

코로나로인해 GX가 고 위험시설로 지정되어 4월~5월 거리두기로 인해 수업을 진행 못하였고 
이번 서울시 2.5단계 사회적거리두기로 8월19일부터 집합금지 명령에 의해 
지금까지 수업을 진행하지 못하고있습니다.
수도권에 적용된 사회적 거리두기가 13일 2.5단계에서 2단계로 하향조정되어 이에 따라 14일부터
당구장, 헬스장, 골프장, 탁구장 등 민간 실내체육시설도 ‘집합 금지’에서 ‘집합 제한’ 명령으로 
방역단계가 낮춰지면서 이용이 가능해졌지만 그룹엑서사이즈(GX)류의 줌바, 스피닝 등 일부 종목은 여전히 고위험군으로 분류돼 ‘집합금지’ 명령이 계속 적용되고있습니다. 

저희도 헬스장 과 같이 방역수칙을 지키며 GX 중에서도 일부 종목은 간격 유지가 어렵지만,
스피닝 종목은 고정식 바이크 위에서만 움직이므로 1m든 2m든 필요한 만큼 간격을 떨어뜨리고
인원 수를 제한하면 문제될 게 없다는 게 없다고 생각합니다. 
언제까지 2단계에서 1단계로 내려갈때까지 무 수입으로 살아야하고 
똑같은 운동이며 같은 공간을 쓰는 업종은 영업을 해도되고 
사각지대에 몰린 GX강사(프리랜서)를 위해 대책을 강구해주시길 부탁드립니다."
2020-09-16,2020-10-16,교통/건축/국토,393,화물자동차 4.5톤 차에  바퀴 축 다는것을 금지해 주십시요,"이제는 4.5톤 화물자동차에 축을 다는것을 금지해 주십시요.
본인은 14톤 카고 화물차를 전국으로 운행 하면서 생업을 하는 네식구 가장 입니다.
대한민국에서는 화물자동차의 과적을 단속하기 위해서  도로관리청 에서 단속 하는 도로법 77조, 경찰청에서  단속하는 도로교통법 39조, 그리고 국토교통부에서 지자체로 위임한 화물자동차 운수사업법에 26조. 가있으나  위의 3가지 단속법은 일원화 되지 못하고 세군데 단속청도 각기 다르기 떼문에 일반 적으로 법으로 정해진 모든 차량의 적재중량 10퍼센트 운행의 법이  지켜지지 않는 현실 입니다. 

화물자동차는  1톤 에서 2.5.  3.5. 4.5톤,5톤,  8톤, 그리고 대형화물자동차 11톤, ㅣ8톤,  22톤, 25톤. 추레라 까지 순차적으로 운행 하면서 화물 적재함에 정해진 톤 수에 맞추어서 적재물을 상차 하고 운행 하도록 법에 정해져 있습니다 . 버스 승용차에 정해진 탑승 인원이 법으로 정해졌듯이 모던 화물자동차는 자기 차량에 맞는 적정 중량과 부피짐을  톤수별 상차하고   개인 화물종사자분들은 그에 맞는  운반비 를 받고  개인 생업을 유지하면서 대한민국에서 화물운송종사자로 살아가는 현실 입니다.

그러나 지금은 특수목적 차량에만  부착되던 바퀴가(비행기에서 올리고 내리고 하는 슬라이딩 바퀴가 ) 십몇년 전부터 4.5톤 화물자동차 에 부착이 되면서 기존 뒤바퀴 앞에 달면 앞축 뒤바퀴 뒤축에 달면 후축으로 등록 되고 허가 받아서 도로에 운행  되고 있습니다.. 4.5톤 화물자동차가 축을 달면   일반적으로 4.5톤축차라고 합니다. 이 차는 축간 간격이 좁아서 고속도로  개근대에 진입 하면서 도로법77조  축 중량 과  총 중량이 단속이 안된다는 이유로 마구 잡이 과적을 하고 다닙니다  아이가 어른 보다 더 무거운 짐을  지고 다니는 현상 입니다..

최근 서부발전소 사고로  보듯이 4
5톤 축차가 한개 2톤 중량  스크류 다섯개 10톤을 상차하기 위해서  둥근 위험한 제품을 무리하게 이단 적재 하다가  떨어져 화물차 기사분이 스크류 깔림으로  화물차기사의 죽음으로  이어진 사고 입니다. 그리고  4.5톤 축차가 10톤 상차 하는  과적은  과적 이라고 말도 못하는 현실 이고 후축을 달고는 자기 적재중량 400% 이상 15.톤~ 20톤 이상도 아무런  위법 행위를 거리낌  없이 고속도로를 무리하게 운행하고 다닙니다.  마치 70 80년대  성수대교가 무너 지거전  8톤 차가 20톤  이상 과적하고 다니던 과거의 현실이 아직까지도 이루어 진다는 생각을 접을 수 없습니다.

현재 대한민국  고속도로는  4.5톤축차의 과적으로 타이어 과열, 타이어 터짐, 브레이크 밀림과 운전자 운전제어 능력 감소 등으로 오는  사고로  대형 사고로 이어지고 ,  오르막 운행시 차량 출력을 제대로 내지 못하고 상식 이하의 저속 운행으로  다른 차량의 정상 운행을 방해하는 상황이 발생하고 있습니다

관계 공무원에게 4.5톤축차의 부당함의 민원 하면  4.5톤 화물자동차에 바퀴를 하나 더 다는  축을  허가 해준 이유는  과적을 하라고 허가 해준것이 아니고 바퀴를 하나 더 달면서 차량에 안전성을 가하고 적재된 화물을  충격 흡수에 도움을 주며서 제품도 보호하고 ,도로도 보호 하면서 화물운전자의 안전한  운전에 도움이  되도록 허가를 내어 주었다 합니다.  

그리고 좋은 취지를  달아 주었는데, 과적으로 악용 하는것은 화물운전자가 운반비를 더 받기 위해서 악용하는 나쁜 사례라고 답을 합니다. 그리고 과적을 하지 못하게 관련 법에 의해서  공무원이  항시 단속을 한다고 답을 합니다. 

그러나 현실은  부피가 적게 나오는 중량 제품 파이프 코일 수지 시트철판  금형  가공석  등 모든 적재물을
전국적으로 대기업  중소기업 가리지 않고 주선사를 통하거나 직접 풀랫폼 화물앱 어풀에서  배차 하고  상차 시키고 있습니다   과적 강요  불법으로 물류비를 아끼고 부당한 이윤을 추구 하는 현실 입니다.
대한민국 화물자동차 절반이 4.5톤축차를 운행하고 다니는 현실 입니다.

세월호의 예를 보듯이 화물자동차가  섬 지역으로 화물을 상차하고 배에  들어 갈 때 차량을 개근대에 올려서 중량 측정을 하는것이 아니고  화물자동차 등록증에 기재된 적재중량  톤  수  만 확인 하고 선비를  내고 배에 올라 갑니다.
  배의 선원은  차량등록증에 기재된 톤 수만 확인하고 전체 차량들의 중량을  계산 하는데 과적으로  상차된  배 전체의 중량은  아무도 알수 없이 배가 바다로 나가는 것 입니다.

이제는  4.5톤 화물자동차 축차의  피해가 너무 광범히 합니다. 현재 화물맨, 전국24시  화물어풀을 통해서 물동량을 구하는  화물자동차가 다수를 차지 하는데  모든 차량이  톤수 제한없이   이용 하도록  화물 풀랫폼 어풀은    물동량을 올리는 주선사 또는 기업 에서는 무제한 적으로  위법 과적을 강요 하면서 화물자동차를 찾습니다.. 운반비  또한  터무니 없는  운송비로    너 아니고도  싣고 갈 다른 차 많다 하는 식으로   매일 다른 고무줄 같은 운송비로  4.5톤 축차를  통해 배차하고  정상적으로  법을 지키는 차들이  운반비  손해를 보는 것입니다. 11.톤 15톤 22톤 화물자동차가 상차하고 운행 하여야할 제품을  4.5톤 축차를 이용해서 대한민국  도로를 위험 하게 달리게 합니다. 또한 기업 주선사는 부당한  이윤을 물류비를 통해서 극대화 시키면서 
4.5톤 축을 달고 다니는 화물차주분들을 범법자로 만들고 있습니다. 
위의 모든 불법이 화물  안전운임제가 이루어지면 차량별 톤수별 운임이 정해저서   이제는 불법이 없으리라고 희망을 가져 보았지만  현재 3년 한시적으로 어렵게 만들어진  안전운임법 은 컨테이너.비씨티 두 직종만 적용되고, 또한 편법 비정상 으로  수행 되는 현실에서  일반 카고 윙바디 화물 종사자분들의 희망을 가질 수 없습니다.
이제는 도로에서도 물류시장의 공정함과 45만  화물운송 종사들이 안전하고 보람찬 일터가 되며 국민에게 안전을 주는 화물운송 시장을 이루도록 정부에서는 4.5톤차에   한바퀴 더  축  다는   허가를 막아   주십시오."
2020-09-16,2020-10-16,정치개혁,836,화성시장 서철모 시장직 박탈과 더불어민주당 퇴출을 청원합니다.,"주택 9채 가진 화성시장 서철모! 
대기업과 손잡고 농민 몰아내고 주택장사해서 대기업에 이익 몰아주는 행위를 규탄하며 주민들에게 '법대로 하라 ' 는 화성시장 서철모의 시장직 박탈과 더불어민주당 퇴출을 청원합니다.

1. 주택 9채 가진 화성시장 서철모가 화성시 기산동에서 수십년 동안 농사지으며 터전을 지켜온 농민들을 강제수용으로 몰아내고, **건설과 손잡고 주택건설사업을 추진 중에 있습니다. 화성시는 이를 ‘공공개발’이라고 주장하지만 실제는 농민땅 강제수용해 **건설에 사업권을 주고 농민들이 받아야 할 이익을 **건설에 주려는 것입니다.

2. 화성시의회는 2018. 9. 화성시와 **건설이 공동으로 출자하고자 계획한 SPC 설립 출자동의안에 대하여 사업계획 및 추진방식에 대한 전면적인 재검토가 필요하다는 이유로 부결처리하였습니다.

3. 그럼에도 불구하고 화성시는 앞에서는 농민들에게 공공기여 200억원을 내면 사업을 준다고 했다가, 다시 공공기여 420억원으로 올려 **건설과 같이 맞춰 오면 준다고 하면서 시간을 끌어오다가, 뒤에서는 농민들 몰래 **건설과 사업협약을 진행하며 농민들의 등에 비수를 꽂고 있습니다.

4. 화성시는 주민들에게 **건설과 동등한 조건이면 화성반월지구와 같은 사업방식으로 진행할 수 있게 하겠다고 하였고, 주민들에게 2020. 1. 15까지 **건설과 동등조건 및 공공기여 420억원을 하라고 하여 모든 조건을 수용하여 제시하였는데, **건설과 2019.12.31. 기습적으로 사업협약을 체결하고 그 내용도 공개하지 않고 있습니다.

5. 화성시장은 주민들 몰래 **건설과 사업협약을 하면서도 토지소유자들이 **건설의 공공기여 내용과 동등 그 이상으로 제안되고 화성시가 그 제안을 수용 동의할 경우 **건설과의 사업협약은 취소한다고 약정까지 해놓고, 주민들이 **건설과 동등한 내용의 공공기여를 하자 이제는 **건설과 협약을 맺었기 때문에 안된다는 일방적인 주장만 되풀이하고 있습니다.

6. 화성시는 반월지구는 땅값이 비싸 수익이 안나 주민들에게 사업을 이전해주고, 기산지구는 땅값이 싸서 수익이 난다며 화성시와 **건설이 사업을 한다고 합니다.

7. 화성시장은 공식적으로 주민간담회 및 공문으로 주민사업을 약속하고, 뒤에서는 **건설과 협약을 체결하는 등 주민들을 기망하고 독단적으로 본 사업을 처리하는 이유를 분명히 밝혀야 할 것이며, ‘공공기여’라는 명목으로 출자분만 200억에서 420억 이상으로 올려 농민들의 고혈을 짜놓게 하고, ‘공공개발’이라고 하면서 왜 사기업인 **건설에 사업권을 주려고 하는지, 정치권의 이권 개입의혹 등 수십년 동안 화성을 지키며 살아온 농민들의 땅을 빼앗으려고 주민들에게 '법대로 하라 '고 만 하는 9채 주택을 가진 시장 서철모의 시장직 박탈과 더불어민주당 퇴출을 청원합니다.

 [본 게시물의 일부 내용이 국민 청원 요건에 위배되어 관리자에 의해 수정되었습니다]"
