start,end,category,count,title,content
2020-09-10,2020-10-10,인권/성평등,867,부럽지 않은 ****** (제조가 아닌) 죄조 직원의 현실을 바로잡아주세요,"******는 전임직(생산직:현장 고졸/전문재졸중심 공장에서 근무)과 사무직(대졸 이상, 현장에서 전임직과 함께 일하는 직원과 사무실에서 근무하는 직원)으로 크게 분류.
전임직은 회사의 인정을 받고 있는오래된 생산직 노동조합( 97% 이상의 가입)이 있는 반면,
사무직은 이제 2년된 신생노조(초기라 가입자가 적음)가 있음

******를 다닌다는 자체만으로 많은 사람들은 배부른 소리다며 부러워 할 것입니다.
물론, 금전적으로나 저희보다 좋지 않은 환경에서 근무하는 사람들도  많을 것이기에 충분히 이해를 합니다만, 실상 그 내면을 보면 마냥 부러워 할 수 없는것이 현실입니다.

******의 제조분야에는 전임직(제조 생산직)과 사무직(죄조기술팀이라 불리고 있을 정도)이 함께 일을 하고 있습니다.
업무상 분류가 되어야 하나 무슨 이유에서인지 사무직도 입사와 동시에 강제로 3교대 근무(공장에서 주간 야간 새벽)를 하고 있습니다.
입사 당시에는 1~2년 뒤 교대에서 일반 근무로 변경을 하기로 약속을 함에도 불구하고, 입사와 동시에 약속은 지켜지지 않아 학사 심지어 석사 출신의 사무직 직원들은 자괴감과 함께 무기력한 마음의 우울증을 앓는 경우가 늘어나고 있습니다.
심지어 노조가 강한 생산직에 비해 그렇지 않은 사무직 제조 기술팀은 역차별로 인해 더한 불이익을 받고 있는 것이 현실입니다.

<불합리>
제조 생산직팀에서 제조 기술팀들의 순위를 매겨 평가에 영향을 주는 경우
업무량에 맞지 않는 인원 배분으로 항상 근로시간 초과(법적으로 주 52시간까지 근무를 해야하나 휴게시간 강제 입력(62시간 체류시간+@) 규정을 정해 쉬지도 않은 시간을 쉬었다고 허위로 입력하는 사례)
업무R&R 정립이 필요(생산직에 비해 일도 많이 하고 차별을 받으나 현재는 제조기술이 대부분의 일을 하고 있음)
정확한 교대지침 부족(교대기간,업무 형태 대한 사전 고지, 교대중 근무시간 엄수등)으로 미래가 불투명
제조사무직은 평가에 대한 불이이익이 금전적으로 연봉삭감부터 보너스 미지급/진급/고용불안에 이르지만 제조생산직은 평가에 따른 불이이익이 없음
사무직에게만 적용되는 고용불안
**계열사에서 만든 교육프로그램(*******)을 사무직에게만 강제로 (년간 100시간) 수강하도록 하여 매주 초 팀별 순위/개인별 순위등을 HR과 임원진에서 공개하며 강요
인력팀은 직원들을 소모품으로 생각하여 불합리를 외쳐도 더한 처벌을 가함(오죽하면 직원들은 벽돌팀이라고 불리움) 


이런한 이유등으로 제조기술직에서는 우울증을 앓아 자살하는 경우가 늘어나고 있습니다.
최근 한 석사출신 신입사원은 이러한 상황이 힘들어 회사에 보직변경을 지속적으로 요청하였으나 뜻이 이루어지지 않자 결국 목숨을 끊었다는
안타까운 소문도 있었습니다.

****** 죄조기술이 제조기술이 될수는 없는 것일까요?

아래는 2020년 8월경에 신입사원이 퇴사를 하며 다음과 같은 글을 전체메일로 보내며 퇴사한 내용입니다.

안녕하세요 (전)MXXXX XXX입니다.
제가 퇴사를 결심하게 된 이유는 행복하지 않아서입니다.
저는 스스로 행복에 대한 역치가 굉장히 낮은 낙관론자라 생각했지만 일련의 불행한 경험이 쌓이며 행복에 대한 역치 뿐 아니라 불행에 대한 역치도 낮음을 깨달았습니다.

제조기술 인원은 줄어드는데 왜 관리하는 인원은 늘어날까, 제조기술은 왜 모든 팀에게 을일까, 제조기술은 정말 죄조기술인가 등등의 다양한 피해의식
그리고 8월이 되도록 연봉협상이 제대로 안되는 회사에 다닌다는 답답함과 일련의 광 팔기, 보여주기식으로 느껴지는 업무들로 인해 엄청난 불행을 느꼈으며 그로 인해 화가 많아졌습니다.
(지극히 주관적인 생각으로 인해 겪은 감정임을 알아주셨으면 좋겠습니다.)

이러한 불행을 느끼며 가장 놀라웠던 경험은 내가 사람을 이렇게나 싫어할 수 있구나 였습니다.
자연스레 열정과 의지가 식었음을 느꼈으며 이러한 불행을 통해 퇴사를 결심했습니다.

퇴사를 결심하며 아쉬웠던 점은

첫 째, 왜 빨리 퇴사를 생각하지 않았을까 입니다.
하지만 더 늦기 전에 지금이라도 퇴사를 결심해서 정말 다행이라고 생각합니다.

둘 째, ****에서 좋은 인연을 맺은 사람들을 떠난다는 것입니다.
훌륭한 선·후배 그리고 정말 일 잘하고 사람 좋은 동기들을 떠난다는 것이 가장 아쉽습니다.
하지만 몇몇 안 좋은 인연들을 떠난다는 기쁨 덕분에 시원섭섭함 보다는 시원한 감정이 앞서는 것 같습니다.

그 중에서도 큰 고통과 스트레스를 받으며 서로에게 힘이 되어준 XXX 그리고 최고의 선배이자 참 엔지니어인 XXX 선배를 알게 되어서 
정말로 행운이었고 떠나는 것이 아쉽다는 이야기를 꼭 하고 싶습니다.


저는 ****에서 하나의 구성원이 아닌 하나의 소모품에 불과하다는 느낌을 많이 받았습니다.
이러한 개인적인 생각으로, 저는 스스로를 불량품이라고 생각합니다.

 [본 게시물의 일부 내용이 국민 청원 요건에 위배되어 관리자에 의해 수정되었습니다]"
2020-09-10,2020-10-10,경제민주화,721,3호선 마스크 미착용자 엄벌해주세요,"항상 나라를위해 힘써주셔서 감사합니다 
코로나 바이러스로 인해 사회적 거리두기 운동을하는 이시국에 사회적거리는 커녕 

마스크를 미착용하고 유동인구가 많은 지하철에탑승을하고 그것도 모잘라가 공공시설이며 
항상 청결해야할 승객좌석을 다리를올리고 혼자 이용하는 사진을보고 너무도 화가 납니다 

물론 실수는 할수 있습니다 하지만 사리 분별 할수있는 성인여성이 그런무책임한 행동을 했다는것이 이해가 힘드네요 지하철은 공공시설이고 노약자들 이용이 많은곳입니다.

요즘같은시국에는 더더욱 그렇구요 본보기로 꼭 처벌부탁드립니다"
2020-09-10,2020-10-10,기타,"1,168",뉴 *** 구매자를 살려주세요.,"어릴때부터 차를 가지고 싶어 돈을 조금씩 조금씩 모았습니다. 그리고 설레는 마음을 가지고 첫차를 계약 그리고 지금은 출근길에 운전하고 있는 35살 대한민국 국민입니다. 제차의 이름은 더 뉴*** 입니다. 디자인도 제눈에는 이쁘고 모든게 사랑스럽습니다. 그런데 갑자기 종이(엔진오일결함)가 저희집으로 도착했습니다. 엔진오일관련해서 결함이 있는것입니다. 바로 차량으로 가서 본넷을 열고 엔진오일양을 체크해봤습니다. 과거 6월에 충전했는데 4칸남아있습니다. 그게 일주일전입니다. 그리고 오늘 체크해봤습니다. LOW보다 한참 아래인 맨끝에만 살짝 남아있습니다. 보통차량 반년분의 엔진오일이  일주일만에 사라졌습니다. 

이와 관련하여 차량제조업(대기업)의 조치는 엔진오일을 새로 채운 후 15,000KM를 주행 후 문제가 생기면 조치해주겠다입니다. 

여기서 가장 큰문제는 대기업이 구매자의 생명을 위협하며 살인미수의 실험을 하고있습니다. 엔진오일 부족시 화재, 시동꺼짐등의 문제가 발생할수 있고 이는 고속주행 및 저행운전이라도 사고시 운전자에게 큰 위험이 될수있습니다. 보통의 차량과 다르게 엔진오일이 급격히 감소하는 차량은 엔진오일부족에 대처할수있는 시간이 매우 짧습니다. 일주일만에 반년분량이 사라지는 만큼 엔진오일경고등이 뜨는순간 그마져도 바로 사라져 화재의 위험이 훨씬 큼니다.

두번째 봉인으로 인한 엔진오일 측정불가는 운전자의 안전을 엔진오일 경고등 하나만에 의지하여 지켜야 합니다.
만약 엔진오일 경고등 고장 차량의 경우 운전자는 어디서 안전을 찾아야 합니까??

대기업의 오너분들 그리고 결정자 분들께는 제가 소인이지만 그래도 구매자인 저의 의견에 조금만 귀 기울여 주시기를 간절히 바랍니다. 그리고 보다 저극적이고 안전한 정책으로 사랑스러운 저의 더 뉴***가 흉기가 되지 않게 부탁드립니다.

 [본 게시물의 일부 내용이 국민 청원 요건에 위배되어 관리자에 의해 수정되었습니다]"
2020-09-10,2020-10-10,보건복지,727,증증장애인특장차량 버스전용차로 운행을 허가해 주세요,"안녕하세요
저는 장애인자립생활센터 센터장 입니다
자립생활센터는 중증장애인들의 자립을 위해 여러활동들을 하는곳 입니다
그중 장애인들의 이동권 확보를 위해서도 많은 노력을 하고 있습니다

요즘 그 성과의 일환으로 휠체어나 보장구를 사용하는 중증장애인들을 위한 특장차량으로 카니발이나 스타렉스를 특수개조 하여 운행합니다

그리고 중증장애인들의 사회 참여가 늘어나면서 고속도료를 이용 장거리 이동을 하는 경우가 많아지고 있습니다

하지만 현재 중증장애인들의 장애특성상 위급한경우가 발생할수도 있고 장시간 개조된 차량안에서  도로위에 대기하기엔 어려움이 많고 위험 상항에 처할 수가 있습니다

따라서 장애인표시 부착차량이 아니라
카니발이나 스타렉스로 중증장애인인 탑승할 수 있도록 개조된 차량에 한해서 장애인탑승시 버스전용차로 운행을 허가해 줄것을 아래와 같은 사유로 청원합니다

1. 중증장애인 특성상 건강하지 못한 고위험군에 속하는 사람들도 많고,  휠체어나 보장구에 앉아 차량속에서 장시간 지체하기엔 어려움이 많습니다
오랜시간 차량속에서 대기시 응급상황이 발생되거나 인명사고로 이어 질수도 있습니다

2. 카니발이나 스타렉스 11인승의 경우 6인 이상 탑승시 버스전용차로 운행이 가능하나 장애인특장차로 개조퇸 차량은 실상6인 이상이 타기가 불가능 합니다 따라서  중증장애인탑승시 고속도로 버스전용차로 운행을 허용해야 합니다

3. 이제 장애복지도 시혜의 시대는 지났습니다 장애인은 집에만 있고 동네 어귀만 오가야 하는 시대도 지났습니다 이제 장애인스스로 기본권을을 누리고 여가활동과 체육활동 문화향유권을 누려야 하는 시대입니다 헌법에 보장된  인산의 존엄성을 조금이라도 누리고 회복할 수 있도록 이런 기본권을 정부가 보장해 주어야 합니다

따라서 특장차로 개조된 차량중 장애인 탑승차량은 버스전용차로 운행을 허용해 줄것을 청원합니다"
2020-09-10,2020-10-10,기타,591,게임내에서 벌어지는 기업의 사기행위,"https://namu.wiki/w/***************

위 링크는 사건내용입니다.
**이라는 대기업의 민낯입니다
유저들은 돈과 시간을 투자하여
게임내에서 얻고자 하는 목표를
운영자들은 프로그램을 조작하여 수백 수천만원을 투자한 사람들을 기망하고 조롱하였습니다
나아가 게임내 부당하게 취득한 재화를 현금으로 바꾸었을수도 있습니다
명백한 배임과 횡령입니다
공정위나 게등위 금감원 등의 기관에서 개입하여 경찰조사가 시작되어야 합니다
고작 게임이 아닙니다
현금화하면 수천 수억의 부당이득을 취한 것입니다

 [본 게시물의 일부 내용이 국민 청원 요건에 위배되어 관리자에 의해 수정되었습니다]"
2020-09-10,2020-10-10,기타,895,친정엄마의사고보상금을이모에게 편취를당했습다,저는두아이를둔주부입니다 23년전 저의친정엄머니께서교통사고를당하여 뇌손상장애1등급판정을받아 20년째 요양병원레계십니다 그당시 부모님의이혼으로 미성년자였던저는 보호자가없어 보상금을이모가 받게되었습니다 그러나 이모는 아픈엄마를 정신병원월30만원병원에 모셨고 저는 자퇴를시키고 보험금을받은이모는한푼도 돌려주지않았습니다앞으로 얼마나 오랜시간을병원에계실지모르는 저희어머니는 현재 아무런 보상금하나가없습니다  홀로저만보고힘들게살아오시다 사고를당하신 저희어머니의보험금을 편취한 이모를 벌하여주십시요
2020-09-10,2020-10-10,성장동력,385,대한민국 소상공인은 목숨 걸고 살아갑니다.,"극한 직업이라는 영화를 보다가 ""우리 같은 소상공인들 다 목숨 걸고 일하는 사람이야"" 라는 명대사에서 눈물이 찡했었습니다. 누구의 보호도 받지 못하고 희생되어가는 ***** **...그래도 살아보자고 버티고 버팁니다.

20년동안 무역회사 직장 생활로 젊은 시절을 보냈습니다. 그런데 미중 무역분쟁과 한일 무역분쟁으로 세계경제가 침체되고 홍콩 민주화 운동으로 회사사정이 악화 되었습니다. 작년부터 많은 중소기업들이 직원을 정리하기 시작했습니다. 이미 3년 전부터 우리나라의 40대 실업 문제는 현업에서는 몸으로 느끼고 있습니다. 자식들이 커가는 가장 돈이 많이 들어가는 성장 동력인 40대가 우후죽순 실직을 당하기 시작했습니다. 실업률 통계는 현실과 맞지 않습니다. 왜냐...40대가 본업에서 물러났다고 그냥 집에 있으면 온가족은 어떻게 연명합니까...뭐라도...다른 일이라도 구해야하죠...어쩔수 없이 본업을 그만둔것 자체가 실업입니다. 작년 친구 한명이 회사를 여러번 옮기다가 집을 팔아서 작은 가계를 오픈할까  고민하다가 한국에서 더이상 뭐라도 하기 싫다고  이민을 갔습니다. 힘들어하던 친구가 집 판 돈으로 소상공인이 되었었다면....올해 그 친구 가족은 어땠을까요. 오래 동안 함께 일해온 몇명 되지도 않는 직원을 내보내는건 아닌듯하고 나 하나의 월급이면 직원 급여해결에 보탬이되니 내가 먼저 40대에 퇴사했습니다. 가족들에게 40대 퇴직을 말로 설명하던 그 순간이 지금도 생생합니다. 청춘을 다 바쳤던 회사인데...그 후유증이 몇달을 가더군요.

퇴직금으로 소상공인이 되었습니다. 요즘 대세라는 SNS 홍보에 대해 교육도 찾아다니면서 받고 새로 준비한 매장에서 새로 회사를 창업할때 그때 그 심정으로 모든걸 쏟아부었습니다.
그런데 코로나가 오고 국내 경기는 얼어붙기 시작했습니다.

총선기간...코로나 정국에서 전국민 재난 지원금이 지급되었습니다. 선별 지급보다는 전국민 지급이 표 개수에 훨씬 효과적일겁니다. 

학교다닐때 배웠을겁니다. 정당은 정권을 잡고 정치적 이상을 실현하기 위한 단체입니다. 국민을 위한 단체가 아니라 권력잡는 것이 정당의 목표라는건 교과서에 나와있는 말입니다. 

6월 7월이 되면서 대한민국은 성공적으로 코로나를 이겨낸 나라로 해외에서 극찬을 받고 모든 청와대, 정부, 여당이 K방역을 자화자찬 했습니다. 그리고 8월초반부터 코로나 감염자수가 약간씩 증가하기 시작했습니다. 8월중반전에 이미 하루 100명이 넘었는데 침체된 내수를 위해서  누군가의 재판날인 8월17일 임시공휴일을 지정한다고 발표하였습니다. 그리고 8월15일 2개의 집회가 승인되었습니다. 8월17일 18일 언론은 8.15집회로 코로나 하루 감염자가 폭증했다는 뉴스가 나오기 시작했습니다.  이미 1주일 전부터 하루 100명 이상 감염자가 나오는 상황에서 집회를 승인해주고 임시공휴일까지 지정한것 다시 돌이켜 보아도 이해할수가 없습니다.

2단계 사회적 거리두기가 시행되고 거리는 다시 얼어붙기 시작했습니다. 8월30일 오전 국무총리가 TV에 나와서 3단계로 올리지 않고 당분간 2단계를 유지하겠다고 발표했습니다. 그런데 같은날 오후에 중앙재난본부에서 기습적으로 선별 업종에 대해 1주일간 집합 금지 조치를 발표했습니다. 2.5단계?......정치인들이 잘하는 기습 날치기 법안 통과처럼.....경제인들이 잘하는 안좋은 뉴스는 주식 마감전에 공시하는 것처럼...그렇게 집합금지조치는 발표되었습니다.

매장에 나가서 1주일 휴업 안내문을 출력해서 문앞에 붙였습니다. 오픈하고 쉬는날 없이 하루도 문을 닫지 않았는데....1주일간 휴업 안내문을 문앞에 붙이는 소상공인들의 심정이란..…...휴...
힘든 시기에 대한민국 소상공인들이 1주일 버텨주면 전국민이 안전하다고 하니 버티고 버텨야지 다짐했습니다. 그리고 학원도 문닫는다고하니 애들 교육비도 줄거라 생각했는데....그런데 대형 학원들은 코로나에도 온라인수업으로하고 학원비는 똑같이 다 받아간다고합니다. 대학도 마찬가지고....요즘 인강으로 공부하는 학생들 많던데..인강 수업료하고 대형 학원 수업료하고 같다는게 도져히 이해가 가지 않지만..그들은 ""대형""이라는 글자가 붙어있으니 ""소""상공인하고 다르게 보호를 받는구나 생각했습니다.

1주일동안 하루에 수십번씩 코로나 관련 뉴스를 보고 또 보았습니다. 1주일 후에는 꼭 다시 오픈하기를 고대하며...
빈 매장을 그냥 바라만 보다가 이번 기회에 매장 수리 공사를 하기로 하고 급하게 알아보았습니다. 문닫고 돈도 못버는데 왜 돈을 더 쓰냐고는 주변의 애기도 다 무시하고...월요일 오픈전에 공사를 끝내기 위해 바쁘게 보냈습니다.
금요일 오전 11시에 집합금지조치 연장 관련 발표가 있을거라는 뉴스가 나왔습니다. 11시를 기다렸는데 의사 협회와 협상때문에 발표가 미루어 진다는 뉴스가 올라왔습니다. 의협에서 의사를 대변해서 정부와 협상하는데 소상공인은 누가 대변해주는지.......요즘 대학 입시는 전국의 모든 의대를 최우선으로 채우고 그 다음 서울,연,고대....순이라더니..역시 의사들의 파워는 막강합니다. 1분에 한번씩 핸드폰으로 뉴스만 보고 있는데.....점점 뉴스 분위기가 집합금지조치 연장 방향으로 가닥을 잡았다는 내용.... 공사를 마무리하고 바닥을 쓸던 빗자루를 나도 모르게 집어던졌습니다. 공사 마무리도 하지 않고 1주일 휴업 추가 연기 안내문을 붙이고 그렇게 매장을 나왔습니다. 우리에게 오픈할 월요일은 더이상 없으니...

월요일 그래도 그냥 나온 매장이 마음에 걸려 다시 매장으로 가서 빗자루를 들고 청소를 했습니다. 

대한민국 국민에게는 국방,납세,교육,근로의 4대 의무가 있습니다. 의무를 다해야하지만 또한 그에 대한 권리도 있습니다.
자유권(국가로부터 간섭받지 않고 행동하고 생각할수 있는 권리), 평등권 (차별받지 않을 권리), 사회권 (인간답게 살도록 국가에 요구할수 있는 권리), 청구권 (국가에에 어떤일을 해달라고 하는 권리), 참정권(투표할수 있는 권리)

4대 의무를 다했는데 왜 소상공인들의 권리는 보호 받지 못하나요. 

코로나 극복 다 같이 고통을 나누자고하는데.....그건 소상공인을 제외하고 얘기하는 듯합니다.

우리 대학시절에 도서관을 가면 토익 공부하고 자격증 공부하고...그렇게 취업을 준비했습니다. 그런데 지금 대학생이나 취업준비생들을 보면 공무원시험이나 각종 국가 고시를 준비하는 사람이 대다수입니다. 대한민국에서 퇴직을 보장해주는 직종은 이제 국가에서 채용하는 사람뿐입니다. 40대에 퇴사를 고민해야하는 일반 근로자와는 다른 세상에 살고 있는겁니다. 

14일이면 한달의 절반입니다. 안그래도 줄어든 매출에서 한달의 절반 매출이 없어집니다. 높은 정치인분들...정부관료분들...경제인분들 자기의 급여가 절반만 받는다고 생각하면...어떠실지요....당장 생계비부터....

우리 선조들은 비가 내리지 않으면 왕이 자신의 죄를 탓하며 비가 올때까지 기우제를 지냈습니다. 그 당시 백성들과 왕들은 우매해서 그렇게 하면 정말 모든게 해결 될꺼라고 생각했을까요?
힘들어 하는 백성의 고통을 조금이라도 나누고자 하던 왕들의 마음이 아니었을까요?

버러지 같은 소상공인이지만 우리도 국민일진데 국민의 자유권, 평등권, 사회권을 박탈하는 정부 시책을 발표할때 국민에게 머리 숙이는 모습을 한번이라도 보여준다면 백성은 아무 말없이 또 하루를 굷을 것입니다. 

좋은 뉴스는 정치인이 발표하고 안좋은 뉴스는 중앙재난본부에서 발표하는 건지요?
작금의 대한민국은 진보와 보수로 나뉘는게 아니라..기득권과 비기득권으로 나누어져 있는듯합니다. 힘있는자와 없는자...

한달의 절반을 문닫고 하늘만 바라봐도 300만원에 달하는 임대료를 기득권에게 조용히 바쳐야하는 소상공인...
그리고는 선별적 지원이라고하니 단돈 100만원이라도 간절히 기다리는 소상공인....한달의 절반을 휴업했는데 고작 100만원....그래도 엎드려서 받아야하는 소상공인들의 심정은 어떨까요? 우리 자식들이 갚아야하는 돈인지 알면서 염치 없이 받아야하는...그런데 자기들 돈인냥..인심쓰는듯 발표하는 정치인들....우리 모두 우리 자식들에게 빚지고 지금 하루를 살아가는겁니다.

오늘도 날이 밝았는데.....갈 곳을 잃은 소상공인들은 오늘 하루 어떻게 보내야할런지....텅빈 매장을 다시 돌며 바닥의 먼지 하나를 주우려 나가봅니다.

대한민국은 자유 민주주의 공화국이니 의무를 다한 소상공인들을 국가는 버리지 않을거라 믿어봅니다.

오늘 하루도 대한민국 소상공인은 목숨걸고 살아갑니다. 하루 빨리 코로나 극복하는 그날까지...

 [본 게시물의 일부 내용이 국민 청원 요건에 위배되어 관리자에 의해 수정되었습니다]"
2020-09-10,2020-10-10,안전/환경,"2,225",교통수단에서도 마스크 미착용승객은 강력히 경고해야합니다,"3호선에서 한 여성이 마스크를 벗고 열차에 드러누워서 승객분들과 시민들께서 불편을 호소하고 계십니다. 하지만 그 여성은 인스타그램에서는 물론 심지어 생방송까지 켜면서 자신이 한 짓에대해서 반성의 기미가 1도 없어보이고 심지어는 자신에게 이거에 대한 글에 반박하는 시민들에게 고소하겠다고 겁을 주고 이습니다. 그리고 이사건은 지하철에서 발생한 일로 방역수칙 위반뿐만아니라 철도안전법 47조 제 6항을 위반한 행위입니다.
일반 시민들을 위해서라도 그 시민에게 강력한 처벌을 해야합니다."
2020-09-10,2020-10-10,기타,"5,072",횡령 및 배임으로 인한 상장폐지,"현재 기업의 임원들이 횡령 및 배임으로 인해
기소를 당하면 그 회사 주식 거래가 정지되고
상장적격성 실질심사를 거친 후 상장폐지 또는
거래재개가 됩니다.

이 부분에서 왜 주주들이 피해를 봐야하는지
모르겠습니다. 횡령 및 배임으로 이익을 본
사람은 주주가 아닌데, 범죄자는 이익을 보고
솜방망이 처벌을 받고, 주주는 피땀흘려 모은
돈이 휴지조각 되고.. 말이 안되지 않습니까?

정의, 그리고 약자를 위한 나라가 아니라
부자와 강자를 위한 나라가 되어가고 있습니다.

횡령 및 배임을 한 사람은 재산 몰수 및 기타
방식으로 환수 그리고 처벌을 하고, 주주들에게는
피해가 가지 않게 해주세요.

더불어 횡령 및 배임으로 인한 상장적격성
실질심사로 거래가 정지되는 점을 고쳐주세요.
소액주주들에게는 소중한 전재산입니다.

약자와 서민을 위한 나라라면,
이 목소리를 듣고 그냥 지나치지 않을것이라고
생각합니다."
